
l00btqo,https://www.reddit.com/r/TooAfraidToAsk/comments/1c6d78x/deleted_by_user/l00btqo/,2024-04-17 16:36:20 UTC,,TooAfraidToAsk,0,https://www.reddit.com/r/TooAfraidToAsk/comments/1c6d78x/deleted_by_user/,l00ao9o,"I mean, if you accept that each of us ""knows"" about 1000 people (both men and women), you might be right, but it'd be nice to see a calculation. You also need the tacit assumption that people we know are equally likely to be rapists as the general popluation",

l0048v9,https://www.reddit.com/r/TooAfraidToAsk/comments/1c6d78x/deleted_by_user/l0048v9/,2024-04-17 15:54:29 UTC,,TooAfraidToAsk,0,https://www.reddit.com/r/TooAfraidToAsk/comments/1c6d78x/deleted_by_user/,,"Leaving aside the (very serious) political and emotional issues, I'm not sure there's a good mathematical answer to this.

If we assume rapists are randomly distributed, it IS likely we all know at least one rapist.

However, if a small number of rapists are committing a large number of rapes, it's less likely.",

l2ual2c,https://www.reddit.com/r/TooAfraidToAsk/comments/1cllj04/deleted_by_user/l2ual2c/,2024-05-06 15:22:43 UTC,,TooAfraidToAsk,0,https://www.reddit.com/r/TooAfraidToAsk/comments/1cllj04/deleted_by_user/,,"22Y? Also, this question comes off as a bit rude",

l2zjgw0,https://www.reddit.com/r/TooAfraidToAsk/comments/1cmdam6/why_being_racist_is_not_okay_but_being_fatphobic/l2zjgw0/,2024-05-07 14:46:50 UTC,,TooAfraidToAsk,0,https://www.reddit.com/r/TooAfraidToAsk/comments/1cmdam6/why_being_racist_is_not_okay_but_being_fatphobic/,,Being fatphobic is not OK. Body shaming is wrong.,

l2pcn0s,https://www.reddit.com/r/TooAfraidToAsk/comments/1cku75g/how_to_stop_getting_wet_dreams/l2pcn0s/,2024-05-05 16:14:06 UTC,,TooAfraidToAsk,0,https://www.reddit.com/r/TooAfraidToAsk/comments/1cku75g/how_to_stop_getting_wet_dreams/,l2pcgvc,"I think you have a very sex-negative attitude and you need to work on realizing masturbation is not shameful or wrong. Some people would recommend therapy, but I think there's a lot you can do on your own.",

l118eah,https://www.reddit.com/r/TooAfraidToAsk/comments/1cbwf2l/how_true_is_the_statement_that_beautyhotness_is/l118eah/,2024-04-24 12:18:31 UTC,,TooAfraidToAsk,0,https://www.reddit.com/r/TooAfraidToAsk/comments/1cbwf2l/how_true_is_the_statement_that_beautyhotness_is/,,"> average-looking or even a fat woman

Are you implying all heavy women are unattractive?",

l118354,https://www.reddit.com/r/TooAfraidToAsk/comments/1cbwj0q/deleted_by_user/l118354/,2024-04-24 12:16:12 UTC,,TooAfraidToAsk,0,https://www.reddit.com/r/TooAfraidToAsk/comments/1cbwj0q/deleted_by_user/,,"> fapping is good when in fact its a losers cope

Masturbation is awesome and your comment is rude.",

l2pbke4,https://www.reddit.com/r/TooAfraidToAsk/comments/1cku75g/how_to_stop_getting_wet_dreams/l2pbke4/,2024-05-05 16:07:20 UTC,,TooAfraidToAsk,0,https://www.reddit.com/r/TooAfraidToAsk/comments/1cku75g/how_to_stop_getting_wet_dreams/,,"> I have gotten onto nofap

Regular masturbation is healthy and normal. Nofap is not.",

l3b1eld,https://www.reddit.com/r/TooAfraidToAsk/comments/1co24d1/deleted_by_user/l3b1eld/,2024-05-09 17:02:09 UTC,,TooAfraidToAsk,0,https://www.reddit.com/r/TooAfraidToAsk/comments/1co24d1/deleted_by_user/,,I've never heard of Austin being the comedy center or anything. Do you have sources/evidence?,

l3blu17,https://www.reddit.com/r/TooAfraidToAsk/comments/1co3gby/deleted_by_user/l3blu17/,2024-05-09 19:00:06 UTC,,TooAfraidToAsk,0,https://www.reddit.com/r/TooAfraidToAsk/comments/1co3gby/deleted_by_user/,,"I'll give you an answer no one wants: it could be random coincidence. There are lots of ways to divide up human beings and then take some metric (eg, IQ) on the individual subsets. Some subsets will be higher for a given metric and some will be lower. If we do this with enough different partitions, we'll get results that seem significant but really aren't",

l40jctx,https://www.reddit.com/r/TooAfraidToAsk/comments/1cru7co/is_racism_same_as_racial_discrimination/l40jctx/,2024-05-14 15:29:10 UTC,,TooAfraidToAsk,0,https://www.reddit.com/r/TooAfraidToAsk/comments/1cru7co/is_racism_same_as_racial_discrimination/,l40h8xi,"How would you statistically support whether a race is famous for doing something? Go around asking people ""which race, if any, is famous for stealing bikes?""",

l4b8a57,https://www.reddit.com/r/TooAfraidToAsk/comments/1ctdhda/deleted_by_user/l4b8a57/,2024-05-16 14:34:22 UTC,,TooAfraidToAsk,0,https://www.reddit.com/r/TooAfraidToAsk/comments/1ctdhda/deleted_by_user/,,"I believe that people have the right to use force, even deadly force, to someone committing or threatening a violent crime. Penny was apparently trying to subdue Neely, not kill him. According to https://en.wikipedia.org/wiki/Killing_of_Jordan_Neely wasn't sure that Neely was unconscious when Penny continued choking him. Penny did everything right. Penny is a hero.

In general, I support incidents like this one, but also recommend more people carry guns: Penny was very brave in attempting to physically stop a dangerous man.",

l4aq667,https://www.reddit.com/r/TooAfraidToAsk/comments/1ctblgm/found_blood_in_my_stool_what_would_be_the_next/l4aq667/,2024-05-16 12:33:25 UTC,,TooAfraidToAsk,0,https://www.reddit.com/r/TooAfraidToAsk/comments/1ctblgm/found_blood_in_my_stool_what_would_be_the_next/,l4apzbd,"What you really have to worry about is black tarry stool which indicates internal bleeding which can be serious. External bleeding isn't great, but is usually less serious",

l5gxxse,https://www.reddit.com/r/TooAfraidToAsk/comments/1czkmad/do_all_guysgals_masturbate_and_what_ages/l5gxxse/,2024-05-24 13:44:54 UTC,,TooAfraidToAsk,0,https://www.reddit.com/r/TooAfraidToAsk/comments/1czkmad/do_all_guysgals_masturbate_and_what_ages/,l5gxcen,"Sure, neither of which contradicts what I said :)",

l5qwk95,https://www.reddit.com/r/TooAfraidToAsk/comments/1d0sq9f/am_i_crazy_for_believing_if_you_move_to_a_country/l5qwk95/,2024-05-26 14:15:04 UTC,,TooAfraidToAsk,0,https://www.reddit.com/r/TooAfraidToAsk/comments/1d0sq9f/am_i_crazy_for_believing_if_you_move_to_a_country/,,"I believe freedom is a birthright and that people pretty much have a right to live whereever the want, though I also believe in property rights.

I therefore believe laws should be identical across the world and that people have no obligation to adapt to others ways of doing things.

Social change will never occur if we blindly obey the bad laws of the places we live.

As an American, if I ever move to Europe, I will work to fix it, not accept it.",

l6hagm2,https://www.reddit.com/r/TooAfraidToAsk/comments/1d4wmea/deleted_by_user/l6hagm2/,2024-05-31 14:18:19 UTC,,TooAfraidToAsk,0,https://www.reddit.com/r/TooAfraidToAsk/comments/1d4wmea/deleted_by_user/,,Act on it how. By making films?,

l5gveti,https://www.reddit.com/r/TooAfraidToAsk/comments/1czkmad/do_all_guysgals_masturbate_and_what_ages/l5gveti/,2024-05-24 13:28:10 UTC,,TooAfraidToAsk,0,https://www.reddit.com/r/TooAfraidToAsk/comments/1czkmad/do_all_guysgals_masturbate_and_what_ages/,,"Masturbation is natural and healthy and there's no evidence porn ""probs messes w yo head"" (if anything, the opposite)",

l6xti4g,https://www.reddit.com/r/TooAfraidToAsk/comments/1d793aq/what_motivation_would_trump_even_have_to_stop/l6xti4g/,2024-06-03 17:25:07 UTC,,TooAfraidToAsk,0,https://www.reddit.com/r/TooAfraidToAsk/comments/1d793aq/what_motivation_would_trump_even_have_to_stop/,l6xrrph,"I don't think anything he did should be considered a crime. So, in my mind, he's not guilty of any crime (to the extent I'm aware)",

l6xtbu0,https://www.reddit.com/r/TooAfraidToAsk/comments/1d793aq/what_motivation_would_trump_even_have_to_stop/l6xtbu0/,2024-06-03 17:24:08 UTC,,TooAfraidToAsk,0,https://www.reddit.com/r/TooAfraidToAsk/comments/1d793aq/what_motivation_would_trump_even_have_to_stop/,l6xq4et,I've clarified that I don't feel anything he did is a crime in my mind.,

l6xtexo,https://www.reddit.com/r/TooAfraidToAsk/comments/1d793aq/what_motivation_would_trump_even_have_to_stop/l6xtexo/,2024-06-03 17:24:37 UTC,,TooAfraidToAsk,0,https://www.reddit.com/r/TooAfraidToAsk/comments/1d793aq/what_motivation_would_trump_even_have_to_stop/,l6xr0d0,I've clarified I meant that I regard nothing he did as illegal in my mind,

l6x05sx,https://www.reddit.com/r/TooAfraidToAsk/comments/1d75hm9/is_donald_trump_innocent/l6x05sx/,2024-06-03 14:38:10 UTC,,TooAfraidToAsk,0,https://www.reddit.com/r/TooAfraidToAsk/comments/1d75hm9/is_donald_trump_innocent/,,"As far as I know, he hasn't done anything I would consider illegal. So he's innocent of criminal activity in my mind.",

l6mvtt3,https://www.reddit.com/r/TooAfraidToAsk/comments/1d5p3ds/deleted_by_user/l6mvtt3/,2024-06-01 15:19:23 UTC,,TooAfraidToAsk,0,https://www.reddit.com/r/TooAfraidToAsk/comments/1d5p3ds/deleted_by_user/,,"I'm going to call you out here and ask for a source other than your own limited observations. You might be right, but I don't think your observations are sufficient to confirm that.",

l6xcgcb,https://www.reddit.com/r/TooAfraidToAsk/comments/1d75hm9/is_donald_trump_innocent/l6xcgcb/,2024-06-03 15:49:07 UTC,,TooAfraidToAsk,0,https://www.reddit.com/r/TooAfraidToAsk/comments/1d75hm9/is_donald_trump_innocent/,l6x4re6,"Well, OK, I guess I'd need to know what he's done to decide whether *I* consider it illegal in my mind. From what I've heard, he hasn't, but maybe there's a fact I'm missing. I did make it clear I'm referring to my personal belief and morality",

l6rzo4e,https://www.reddit.com/r/TooAfraidToAsk/comments/1d6fgnc/why_is_the_american_leftwing_much_more_open_and/l6rzo4e/,2024-06-02 15:24:24 UTC,,TooAfraidToAsk,0,https://www.reddit.com/r/TooAfraidToAsk/comments/1d6fgnc/why_is_the_american_leftwing_much_more_open_and/,,I thought sex work was legal in many more parts of Europe than in the United States?,

l6xncgv,https://www.reddit.com/r/TooAfraidToAsk/comments/1d793aq/what_motivation_would_trump_even_have_to_stop/l6xncgv/,2024-06-03 16:50:37 UTC,,TooAfraidToAsk,0,https://www.reddit.com/r/TooAfraidToAsk/comments/1d793aq/what_motivation_would_trump_even_have_to_stop/,,"A lot of people (including me) feel that Trump was unfairly convicted. If he committed a crime where I feel he was fairly convicted, I might stop supporting him. It also depends on the type of crime. I'm sure if Trump committed different types of crimes (eg, more ""blue collar"" crime), he would lose support. So, no, Trump can't commit more crimes (in general) and automatically get more popular.

EDIT: to clarify, I feel nothing Trump did (that I know about, and in this case specifically) should be illegal. That's what I mean by ""convicted unfairly"".",

l6xcvwd,https://www.reddit.com/r/TooAfraidToAsk/comments/1d75hm9/is_donald_trump_innocent/l6xcvwd/,2024-06-03 15:51:34 UTC,,TooAfraidToAsk,0,https://www.reddit.com/r/TooAfraidToAsk/comments/1d75hm9/is_donald_trump_innocent/,l6x6mnb,"If I understand correctly, he paid using his own money but used campaign money to cover it up somehow. In other words, if you consider reimbursement, he ultimately didn't use campaign money as hush money.

The other problem is the concept of campaign money in general. I'm opposed to donation limits and wonder if campaign contributions should be treated as personal gifts to the candidate. As https://blog.turbotax.intuit.com/tax-deductions-and-credits-2/are-your-political-campaign-contributions-tax-deductible-11380/ notes, they're not tax deductible, so I see no reason to treat them differently.",

l6y7c40,https://www.reddit.com/r/TooAfraidToAsk/comments/1d793aq/what_motivation_would_trump_even_have_to_stop/l6y7c40/,2024-06-03 18:41:52 UTC,,TooAfraidToAsk,0,https://www.reddit.com/r/TooAfraidToAsk/comments/1d793aq/what_motivation_would_trump_even_have_to_stop/,l6y5fur,"Good point. He might be thinking that any jail time he would have to serve would be deferred until the election and further if he wins, since he can later pardon himself (or Joe Biden might have to pardon him just to make the transition easier). In that case, he could commit crimes that would require jail time.

So the only crimes he ""can't"" commit are ones that would cost him the Presidency, since then he couldn't pardon himself and it's unlikely the winner would",

l7884yb,https://www.reddit.com/r/TooAfraidToAsk/comments/1d8s4x8/trigger_content_warning_with_step_content_being/l7884yb/,2024-06-05 15:09:04 UTC,,TooAfraidToAsk,0,https://www.reddit.com/r/TooAfraidToAsk/comments/1d8s4x8/trigger_content_warning_with_step_content_being/,,"It's an interestingish-though-biased question, but, I mean, are pizza delivery guys and plumbers being accosted more? Only the mentally ill confuse fantasy with reality, so the question might just be: are there more mentally ill people now and/or do the mentally ill choose to molest step-relatives instead of molesting other people.

Of course, not all step-relative sex is immoral, and most isn't illegal",

l72vod4,https://www.reddit.com/r/TooAfraidToAsk/comments/1d793aq/what_motivation_would_trump_even_have_to_stop/l72vod4/,2024-06-04 15:51:11 UTC,,TooAfraidToAsk,0,https://www.reddit.com/r/TooAfraidToAsk/comments/1d793aq/what_motivation_would_trump_even_have_to_stop/,l72v4ah,"OK, but how does this hush money payment violate your or anyone else's rights?

> Traditional libertarian viewpoint on this is, ""let the market decide"",

I don't think that's true. False advertising is breach of contract, a type of fraud that even libertarians (I think) believe is not protected speech.

I certainly feel the two situations are very different",

l784r33,https://www.reddit.com/r/TooAfraidToAsk/comments/1d8rpha/deleted_by_user/l784r33/,2024-06-05 14:49:29 UTC,,TooAfraidToAsk,0,https://www.reddit.com/r/TooAfraidToAsk/comments/1d8rpha/deleted_by_user/,,Do you mean Hispanics? Or are there people who think Trump will give stimulus checks to citizens of a foreign country?,

l6y2eqr,https://www.reddit.com/r/TooAfraidToAsk/comments/1d793aq/what_motivation_would_trump_even_have_to_stop/l6y2eqr/,2024-06-03 18:14:36 UTC,,TooAfraidToAsk,0,https://www.reddit.com/r/TooAfraidToAsk/comments/1d793aq/what_motivation_would_trump_even_have_to_stop/,l6y0cp6,Which sort of answers the OP's question. Trump has no motivation to stop performing acts that his supporters (and others) don't perceive as crimes or at least not as serious crimes. He only would have motivation to not perform acts that his supporters would consider serious crimes.,

l7267fp,https://www.reddit.com/r/TooAfraidToAsk/comments/1d793aq/what_motivation_would_trump_even_have_to_stop/l7267fp/,2024-06-04 13:19:16 UTC,,TooAfraidToAsk,0,https://www.reddit.com/r/TooAfraidToAsk/comments/1d793aq/what_motivation_would_trump_even_have_to_stop/,l7253rd,"After reading https://www.cbsnews.com/news/trump-charges-conviction-guilty-verdict/ I am convinced that Trump is innocent. In particular, I don't see how a hush money payment could realistically ""conspire to promote or prevent the election of any person to a public office by unlawful means"". No one has an obligation to reveal all their secrets when running for office. If anything, the charges themselves are a conspiracy to prevent the election of Donald Trump to the Presidency.",

l72tru9,https://www.reddit.com/r/TooAfraidToAsk/comments/1d793aq/what_motivation_would_trump_even_have_to_stop/l72tru9/,2024-06-04 15:40:39 UTC,,TooAfraidToAsk,0,https://www.reddit.com/r/TooAfraidToAsk/comments/1d793aq/what_motivation_would_trump_even_have_to_stop/,l72tj3f,"Yes, that is the libertarian point of view.",

l6y9rmy,https://www.reddit.com/r/TooAfraidToAsk/comments/1d793aq/what_motivation_would_trump_even_have_to_stop/l6y9rmy/,2024-06-03 18:55:07 UTC,,TooAfraidToAsk,0,https://www.reddit.com/r/TooAfraidToAsk/comments/1d793aq/what_motivation_would_trump_even_have_to_stop/,l6y8yve,"I did say ""CAN BE"". In this case, I'm just saying it should be legal, not that it's necessarily heroic. If you accept that sexual intercourse should be kept private, then Stormy Daniels was blackmailing Trump and Trump is the victim, so ""morally correct"" is a possibility, or at least ""morally victimized""",

l6z1q9l,https://www.reddit.com/r/TooAfraidToAsk/comments/1d793aq/what_motivation_would_trump_even_have_to_stop/l6z1q9l/,2024-06-03 21:31:31 UTC,,TooAfraidToAsk,0,https://www.reddit.com/r/TooAfraidToAsk/comments/1d793aq/what_motivation_would_trump_even_have_to_stop/,l6z0jkc,"OK, so why didn't he? I realize you can't read Trump's mind, but why would a smart guy with good lawyers go out of this way to do something illegal if he didn't have to?",

l6yts8t,https://www.reddit.com/r/TooAfraidToAsk/comments/1d793aq/what_motivation_would_trump_even_have_to_stop/l6yts8t/,2024-06-03 20:45:55 UTC,,TooAfraidToAsk,0,https://www.reddit.com/r/TooAfraidToAsk/comments/1d793aq/what_motivation_would_trump_even_have_to_stop/,l6ypgzj,"I can't imagine why even a criminal would break the law to do something if they can do the same thing legally, especially if that person has lawyers. Are you suggesting that Trump is a pathological criminal who commits crimes for the sake of committing crimes and not out of necessity?",

l6yoxmo,https://www.reddit.com/r/TooAfraidToAsk/comments/1d793aq/what_motivation_would_trump_even_have_to_stop/l6yoxmo/,2024-06-03 20:18:39 UTC,,TooAfraidToAsk,0,https://www.reddit.com/r/TooAfraidToAsk/comments/1d793aq/what_motivation_would_trump_even_have_to_stop/,l6yolz1,"Evading a law that violates your right is legal in my mind, because freedom is a higher law.",

l6z1lk0,https://www.reddit.com/r/TooAfraidToAsk/comments/1d793aq/what_motivation_would_trump_even_have_to_stop/l6z1lk0/,2024-06-03 21:30:45 UTC,,TooAfraidToAsk,0,https://www.reddit.com/r/TooAfraidToAsk/comments/1d793aq/what_motivation_would_trump_even_have_to_stop/,l6z0hvb,"OK, but why would he do that? He's a smart guy with good lawyers. Why didn't he just pay Stormy off legally?",

l6yu3pe,https://www.reddit.com/r/TooAfraidToAsk/comments/1d793aq/what_motivation_would_trump_even_have_to_stop/l6yu3pe/,2024-06-03 20:47:41 UTC,,TooAfraidToAsk,0,https://www.reddit.com/r/TooAfraidToAsk/comments/1d793aq/what_motivation_would_trump_even_have_to_stop/,l6yrwt7,"I believe, morally, that people have the right to pay other people to keep quiet, at least in general",

l6ybq4t,https://www.reddit.com/r/TooAfraidToAsk/comments/1d793aq/what_motivation_would_trump_even_have_to_stop/l6ybq4t/,2024-06-03 19:05:54 UTC,,TooAfraidToAsk,0,https://www.reddit.com/r/TooAfraidToAsk/comments/1d793aq/what_motivation_would_trump_even_have_to_stop/,l6yah1g,"In the sense that morality triumphs over the letter of the law, yes. I don't accept blind obedience to bad laws.",

l72qgkc,https://www.reddit.com/r/TooAfraidToAsk/comments/1d793aq/what_motivation_would_trump_even_have_to_stop/l72qgkc/,2024-06-04 15:22:06 UTC,,TooAfraidToAsk,0,https://www.reddit.com/r/TooAfraidToAsk/comments/1d793aq/what_motivation_would_trump_even_have_to_stop/,l72q18j,"OK, but who did he harm in doing so? Was this a victimless ""crime""?",

l6y9y7b,https://www.reddit.com/r/TooAfraidToAsk/comments/1d793aq/what_motivation_would_trump_even_have_to_stop/l6y9y7b/,2024-06-03 18:56:07 UTC,,TooAfraidToAsk,0,https://www.reddit.com/r/TooAfraidToAsk/comments/1d793aq/what_motivation_would_trump_even_have_to_stop/,l6y96qc,Not exactly. It's saying morality is more important than legality.,

l6xvh49,https://www.reddit.com/r/TooAfraidToAsk/comments/1d793aq/what_motivation_would_trump_even_have_to_stop/l6xvh49/,2024-06-03 17:36:06 UTC,,TooAfraidToAsk,0,https://www.reddit.com/r/TooAfraidToAsk/comments/1d793aq/what_motivation_would_trump_even_have_to_stop/,l6xut8y,"Surely you agree that not all laws are good laws and it can be morally correct or even heroic to break certain laws, no?",

l6yzmui,https://www.reddit.com/r/TooAfraidToAsk/comments/1d793aq/what_motivation_would_trump_even_have_to_stop/l6yzmui/,2024-06-03 21:19:08 UTC,,TooAfraidToAsk,0,https://www.reddit.com/r/TooAfraidToAsk/comments/1d793aq/what_motivation_would_trump_even_have_to_stop/,l6yz9ll,"I believe freedom is a birthright and that determines which laws are good and bad.

Again, I'm arguing that Trump had the right to pay Stormy Daniels and any actions he took to enforce that right should be legal",

l72x475,https://www.reddit.com/r/TooAfraidToAsk/comments/1d793aq/what_motivation_would_trump_even_have_to_stop/l72x475/,2024-06-04 15:59:07 UTC,,TooAfraidToAsk,0,https://www.reddit.com/r/TooAfraidToAsk/comments/1d793aq/what_motivation_would_trump_even_have_to_stop/,l72wc1h,"> Candidates agree to this, both implicitly and explicitly.

I don't think that's true. Aren't many candidates opposed to campaign funding rules and don't others (including Trump) want harsher anti-libel rules? I'd say candidates are forced into these rights-violating rules, so they don't apply

> Presumably, the other candidates did not pay hush money to sex partners and attempt to disguise the payments as legal fees

True, but I'm saying it wouldn't have mattered if they did. They would be well within their rights to do so.

I think your arguemnt fails here because not only do candidates not agree to campaign laws (they're forced upon them), but the campaign laws also violate their rights and are thus invalid.",

l6yeweg,https://www.reddit.com/r/TooAfraidToAsk/comments/1d793aq/what_motivation_would_trump_even_have_to_stop/l6yeweg/,2024-06-03 19:23:26 UTC,,TooAfraidToAsk,0,https://www.reddit.com/r/TooAfraidToAsk/comments/1d793aq/what_motivation_would_trump_even_have_to_stop/,l6yd6pf,"There's no law against lying to the American public: it's sort of a tradition among politicans :)

Re lying about legal expenses, could you point me to a source? I do feel the tax code is bad law in many places, so don't necessarily object to people avoiding or even evading taxes. In particular, if taxes are payment for government services, the wealthy pay far far too much in taxes.",

l739jmw,https://www.reddit.com/r/TooAfraidToAsk/comments/1d793aq/what_motivation_would_trump_even_have_to_stop/l739jmw/,2024-06-04 17:08:30 UTC,,TooAfraidToAsk,0,https://www.reddit.com/r/TooAfraidToAsk/comments/1d793aq/what_motivation_would_trump_even_have_to_stop/,l734vex,I don't believe in speed limits either. And I have the right to run for President in any way that doesn't violate other people's rights. Freedom can't be conditional on accepting rights violations,

l6ydiub,https://www.reddit.com/r/TooAfraidToAsk/comments/1d793aq/what_motivation_would_trump_even_have_to_stop/l6ydiub/,2024-06-03 19:15:51 UTC,,TooAfraidToAsk,0,https://www.reddit.com/r/TooAfraidToAsk/comments/1d793aq/what_motivation_would_trump_even_have_to_stop/,l6ya6ak,"I'd have to argue that sexual intercourse is inherently private. When I have a sex with someone, I generally do not expect them to be filming or broadcasting it without my consent.

The question is: why did Trump falsify business records? Could he have made the payment legally? And, if so, why didn't he do so? From what I know, everything he did was to evade a law that violated his right to pay Stormy Daniels hush money.",

l72swcb,https://www.reddit.com/r/TooAfraidToAsk/comments/1d793aq/what_motivation_would_trump_even_have_to_stop/l72swcb/,2024-06-04 15:35:46 UTC,,TooAfraidToAsk,0,https://www.reddit.com/r/TooAfraidToAsk/comments/1d793aq/what_motivation_would_trump_even_have_to_stop/,l72sibe,"I believe freedom is a birthright and that any law that violates our freedoms is (ie, should be) invalid. I dislike labels, but that's a pretty standard libertarian viewpoint.",

l6yyeo2,https://www.reddit.com/r/TooAfraidToAsk/comments/1d793aq/what_motivation_would_trump_even_have_to_stop/l6yyeo2/,2024-06-03 21:12:02 UTC,,TooAfraidToAsk,0,https://www.reddit.com/r/TooAfraidToAsk/comments/1d793aq/what_motivation_would_trump_even_have_to_stop/,l6yxvqg,I strongly disagree. We have a moral obligation to break and fight laws that violate people's civil and human rights. A society where people blindly obey bad laws doesn't deserve to work or even exist,

l6y3u10,https://www.reddit.com/r/TooAfraidToAsk/comments/1d793aq/what_motivation_would_trump_even_have_to_stop/l6y3u10/,2024-06-03 18:22:34 UTC,,TooAfraidToAsk,0,https://www.reddit.com/r/TooAfraidToAsk/comments/1d793aq/what_motivation_would_trump_even_have_to_stop/,l6y0mad,"If someone obtains information legally, I see no problem with paying them to keep that information quiet. You could argue that sexual intercourse is implicitly private and that Stormy Daniels had no right to reveal that she had sex with Donald Trump, meaning Donald Trump is actually the victim of blackmail and that Stormy Daniels should be prosecuted.

Leaving that aside, I believe Donald Trump had the right to pay Stormy Daniels hush money. Joking aside, Trump is a rational human being (and has lawyers), so he would've done this in the most straightforward way possible. Apparently, some bad laws prevented him from doing so. Every other ""crime"" he committed (in this situation) was to assert his right to pay Stormy Daniels and work around bad laws, so I don't have a problem with it. I can't see any reason that Donald Trump, advised by lawyers, would break any laws unnecessarily.

I don't remember enough about the sexual assault charges to comment on them. I think that might go beyond the scope of this question though (the OP technically said ""crimes"", not ""civil actions"").

I'm also not addressing the morality of Donald Trump's actions, only the legality. It's possible he and Melania have an open marriage or she forgave him or whatever, but I'm only addressing the legality here",

