
krigo4e,https://www.reddit.com/r/learnpython/comments/1awnzc9/invalid_syntax_error_in_python/krigo4e/,2024-02-21 21:35:55 UTC,,learnpython,0,https://www.reddit.com/r/learnpython/comments/1awnzc9/invalid_syntax_error_in_python/,,Reddit mangled your formatting. Could you try it on https://repl.it or similar?,

kr0bqjz,https://www.reddit.com/r/learnpython/comments/1atvrj7/phytagorean_triad_problem/kr0bqjz/,2024-02-18 16:46:45 UTC,,learnpython,0,https://www.reddit.com/r/learnpython/comments/1atvrj7/phytagorean_triad_problem/,kr096tm,"OK, fine, also check the square root is less than 100 or whatever. Good catch, but my point was that you didn't need a third nested loop",

kh2mgqh,https://www.reddit.com/r/learnpython/comments/192iq1c/how_to_use_different_versions_of_python/kh2mgqh/,2024-01-09 16:49:13 UTC,,learnpython,0,https://www.reddit.com/r/learnpython/comments/192iq1c/how_to_use_different_versions_of_python/,,I use venv myself: https://docs.python.org/3/library/venv.html,

kr02iq9,https://www.reddit.com/r/learnpython/comments/1atvrj7/phytagorean_triad_problem/kr02iq9/,2024-02-18 15:50:39 UTC,,learnpython,0,https://www.reddit.com/r/learnpython/comments/1atvrj7/phytagorean_triad_problem/,,"You could just check `a*a + b*b` is a perfect square without having to go through every value of `c`. There might be other shortcuts

EDIT: also make sure the value of `c` you compute is less than 100",

krig9e8,https://www.reddit.com/r/learnpython/comments/1au93fx/ask_anything_monday_weekly_thread/krig9e8/,2024-02-21 21:33:46 UTC,,learnpython,0,https://www.reddit.com/r/learnpython/comments/1au93fx/ask_anything_monday_weekly_thread/,krhx24e,"```
Python 3.6.8 (default, Nov 16 2020, 16:55:22) 
[GCC 4.8.5 20150623 (Red Hat 4.8.5-44)] on linux
Type ""help"", ""copyright"", ""credits"" or ""license"" for more information.
>>> foo = []
>>> foo.append('elt')
>>> foo
['elt']
```",

kh3j2mz,https://www.reddit.com/r/learnpython/comments/192n8io/automating_subtitle_for_videos/kh3j2mz/,2024-01-09 19:47:07 UTC,,learnpython,0,https://www.reddit.com/r/learnpython/comments/192n8io/automating_subtitle_for_videos/,,"Note that you might need a comma between seconds and milliseconds, not a decimal: https://www.lifewire.com/srt-file-4135479

Example: `01:20:45,138 --> 01:20:48,164`",

krlnjle,https://www.reddit.com/r/learnpython/comments/1awnzc9/invalid_syntax_error_in_python/krlnjle/,2024-02-22 12:58:55 UTC,,learnpython,0,https://www.reddit.com/r/learnpython/comments/1awnzc9/invalid_syntax_error_in_python/,krk5lw0,"Oh, the error message pretty much gives it away. On line 19:

```
  spent = float(input(""Enter an amount spent (0 to quit):"")""
```

Get rid of the extra quotation mark at the end of the line and replace it with a parenthesis.

You have other similar errors, but running the program in repl.it should report them all.

EDIT: https://replit.com/@barrycarter/fork is a version that has no syntax error, though it still may not work",

ku3ofxo,https://www.reddit.com/r/learnpython/comments/1ban4do/code_that_gives_all_possible_combinations/ku3ofxo/,2024-03-09 18:00:37 UTC,,learnpython,0,https://www.reddit.com/r/learnpython/comments/1ban4do/code_that_gives_all_possible_combinations/,ku3l1n4,Do you mean `2^(n+1)-1`?,

ku565ps,https://www.reddit.com/r/learnpython/comments/1barkpe/deleted_by_user/ku565ps/,2024-03-09 23:13:15 UTC,,learnpython,0,https://www.reddit.com/r/learnpython/comments/1barkpe/deleted_by_user/,ku55qu3,"`1030.244u 0.132s 17:10.63 99.9% 0+0k 0+8io 0pf+0w`

is what my machine says, confirming your result (about 17.1 minutes on my machine)",

kvlrk8g,https://www.reddit.com/r/learnpython/comments/1biovo5/having_some_trouble_with_imageopen/kvlrk8g/,2024-03-19 17:09:19 UTC,,learnpython,0,https://www.reddit.com/r/learnpython/comments/1biovo5/having_some_trouble_with_imageopen/,,"The images appears to exist and be valid. My only suggestion would be temporarily download it locally and use the local copy so you can continue coding, unless a large part of your coding involves downloading files. Also check the `response`'s errors or anything else it sends to see what went wrong. They might have blacklisted your IP address or something",

ku4nya0,https://www.reddit.com/r/learnpython/comments/1barkpe/deleted_by_user/ku4nya0/,2024-03-09 21:21:32 UTC,,learnpython,0,https://www.reddit.com/r/learnpython/comments/1barkpe/deleted_by_user/,ku4ndtk,"Wouldn't that require an array with a trillion entries or something. Maybe less if you use shortcuts, but still",

kvlbjgy,https://www.reddit.com/r/learnpython/comments/1bik9il/a_variable_that_is_attached_to_a_method/kvlbjgy/,2024-03-19 15:38:07 UTC,,learnpython,0,https://www.reddit.com/r/learnpython/comments/1bik9il/a_variable_that_is_attached_to_a_method/,,"You've made `x` a ""static variable"" in the function f: a variable that remembers its value between calls to f.

However, as others sugeest, there are probably better ways to create static function variables in Python (eg, using an object).",

ku5095n,https://www.reddit.com/r/learnpython/comments/1barkpe/deleted_by_user/ku5095n/,2024-03-09 22:35:53 UTC,,learnpython,0,https://www.reddit.com/r/learnpython/comments/1barkpe/deleted_by_user/,ku504z1,"Damn, you're right.",

kvwr694,https://www.reddit.com/r/learnpython/comments/1bk9tem/geospatial_indexing/kvwr694/,2024-03-21 16:31:19 UTC,,learnpython,0,https://www.reddit.com/r/learnpython/comments/1bk9tem/geospatial_indexing/,,"You might look into geopandas, though I'd use PostGIS myself (which breaks your rule of remaining database-agnostic)",

ku50k1r,https://www.reddit.com/r/learnpython/comments/1barkpe/deleted_by_user/ku50k1r/,2024-03-09 22:37:49 UTC,,learnpython,0,https://www.reddit.com/r/learnpython/comments/1barkpe/deleted_by_user/,ku4x2zt,"https://oeis.org/A002385/b002385.txt suggests 47995 is the answer?
I think you need to look at 11 digit primes too (since 1 trillion = 10^12 has 13 digits)",

ku4nstw,https://www.reddit.com/r/learnpython/comments/1barkpe/deleted_by_user/ku4nstw/,2024-03-09 21:20:37 UTC,,learnpython,0,https://www.reddit.com/r/learnpython/comments/1barkpe/deleted_by_user/,,"This doesn't help much, but any ~~odd~~even-length palindrome will be divisible by 11. You also don't generally need to test numbers that end in 0, 2, 4, 5, 6, or 8, just those ending in 1,3,5,7. However, even with these shortcuts, I'm not sure this is trivial",

ku4n53u,https://www.reddit.com/r/learnpython/comments/1barkpe/deleted_by_user/ku4n53u/,2024-03-09 21:16:46 UTC,,learnpython,0,https://www.reddit.com/r/learnpython/comments/1barkpe/deleted_by_user/,ku4izst,Where is your primality testing?,

ku50n1l,https://www.reddit.com/r/learnpython/comments/1barkpe/deleted_by_user/ku50n1l/,2024-03-09 22:38:21 UTC,,learnpython,0,https://www.reddit.com/r/learnpython/comments/1barkpe/deleted_by_user/,ku50k6z,I was wrong and edited it,

ku4zy5u,https://www.reddit.com/r/learnpython/comments/1barkpe/deleted_by_user/ku4zy5u/,2024-03-09 22:34:04 UTC,,learnpython,0,https://www.reddit.com/r/learnpython/comments/1barkpe/deleted_by_user/,ku4zq1s,~~odd-length palindromes? Like 121 has 3 digits~~,

ku34sc4,https://www.reddit.com/r/learnpython/comments/1bakym9/text_to_speech_code_this_code_generates_a_blank/ku34sc4/,2024-03-09 16:10:29 UTC,,learnpython,0,https://www.reddit.com/r/learnpython/comments/1bakym9/text_to_speech_code_this_code_generates_a_blank/,,"It's hard to tell because Reddit mangled your formatting, but are you assigning that long ""here document"" to a variable? It looks like you're asking it to just say the word ""article"" unless I'm missing something",

ku51o0u,https://www.reddit.com/r/learnpython/comments/1barkpe/deleted_by_user/ku51o0u/,2024-03-09 22:44:53 UTC,,learnpython,0,https://www.reddit.com/r/learnpython/comments/1barkpe/deleted_by_user/,ku519p1,"Running it now myself (confirmed ~8s for 1 billion)-- as you guessed, 11 digits takes a lot longer to determine if prime, not to mention there are more 11 digit numbers",

kvbfe2j,https://www.reddit.com/r/learnpython/comments/1bh4gbx/i_want_to_create_a_list_which_has_299_elements/kvbfe2j/,2024-03-17 18:42:28 UTC,,learnpython,0,https://www.reddit.com/r/learnpython/comments/1bh4gbx/i_want_to_create_a_list_which_has_299_elements/,kvbcef1,"So the max and min changes are -100 to 100. Naive analysis suggests you only need 201 entries. If you're doing something more complicated, you may need more, and it's even possible you're trying to solve a problem for which there is no clever solution and no technologically feasible solution.

Maybe tell us more and we can help more if you're still stuck",

kz2rkud,https://www.reddit.com/r/learnpython/comments/1c1f6kq/loosing_my_patience_and_hairs_over_this_getting/kz2rkud/,2024-04-11 13:54:18 UTC,,learnpython,0,https://www.reddit.com/r/learnpython/comments/1c1f6kq/loosing_my_patience_and_hairs_over_this_getting/,kz2qv6k,"Yeah, I should really read these things before answering :)

If you can replicate this issue on [repl.it](http://repl.it) or something, others might be able to help more",

kz2b591,https://www.reddit.com/r/learnpython/comments/1c19fjw/need_help_scraping_website/kz2b591/,2024-04-11 12:00:53 UTC,,learnpython,0,https://www.reddit.com/r/learnpython/comments/1c19fjw/need_help_scraping_website/,,"Page 7 of names has the URL ""https://www.behindthename.com/names/7"", so you'd just download the pages ""https://www.behindthename.com/names/x"" where x went from 1 to 88.

I've now done this and uploaded the zipped files to https://ufile.io/kkud7yig (I haven't tested this file sharing service before, so am not 100% sure it will work)",

kxuosbg,https://www.reddit.com/r/learnpython/comments/1busutd/project_strange_results_after_compressing_image/kxuosbg/,2024-04-03 13:44:44 UTC,,learnpython,0,https://www.reddit.com/r/learnpython/comments/1busutd/project_strange_results_after_compressing_image/,,"Instead of overwriting the image in place, have you considered creating a temporary new image?",

kys2xr2,https://www.reddit.com/r/learnpython/comments/1bzulye/can_everyone_learn_how_to_solve_coding_problems/kys2xr2/,2024-04-09 15:16:54 UTC,,learnpython,0,https://www.reddit.com/r/learnpython/comments/1bzulye/can_everyone_learn_how_to_solve_coding_problems/,,My first thought would be: there are 5 items and I can drop any one of them. Were you not able to get that far?,

kz85gmu,https://www.reddit.com/r/learnpython/comments/1c24m0o/new_to_python_is_it_normal_for_my_code_to_take/kz85gmu/,2024-04-12 12:49:46 UTC,,learnpython,0,https://www.reddit.com/r/learnpython/comments/1c24m0o/new_to_python_is_it_normal_for_my_code_to_take/,,"You appear to be looking for cases where `{a,b,d}`, `{a,c,e}` and `{b,c,f}` are all primitive (because GCD = 1) Pythagorean triples, and I'm not sure that's possible. I wrote https://github.com/GroovyJeff/geowanking/blob/master/20240412/nums.py (assuming, without loss of generality, that a < b < c) to test all cases to 10 million and found none, and suspect you could prove none can exist.",

kz2qj86,https://www.reddit.com/r/learnpython/comments/1c1f6kq/loosing_my_patience_and_hairs_over_this_getting/kz2qj86/,2024-04-11 13:47:53 UTC,,learnpython,0,https://www.reddit.com/r/learnpython/comments/1c1f6kq/loosing_my_patience_and_hairs_over_this_getting/,,Try using the full path instead of a local path?,

kxzzb33,https://www.reddit.com/r/learnpython/comments/1bvkgzm/deleted_by_user/kxzzb33/,2024-04-04 11:48:39 UTC,,learnpython,0,https://www.reddit.com/r/learnpython/comments/1bvkgzm/deleted_by_user/,,https://pypi.org/project/inotify/ is probably the most efficient way if you're on Linux,

l1mqs0o,https://www.reddit.com/r/learnpython/comments/1cf3abd/deleted_by_user/l1mqs0o/,2024-04-28 12:19:45 UTC,,learnpython,0,https://www.reddit.com/r/learnpython/comments/1cf3abd/deleted_by_user/,,Free?,

l0rkemr,https://www.reddit.com/r/learnpython/comments/1cafq2t/help_using_multiprocessing_to_do_calculations_on/l0rkemr/,2024-04-22 16:53:29 UTC,,learnpython,0,https://www.reddit.com/r/learnpython/comments/1cafq2t/help_using_multiprocessing_to_do_calculations_on/,,"This doesn't answer your question, but numpy lets you do numerical operations in parallel and that might be all you need",

l240mc4,https://www.reddit.com/r/learnpython/comments/1chlao3/how_do_i_pick_a_random_line_of_a_random_file_from/l240mc4/,2024-05-01 16:16:37 UTC,,learnpython,0,https://www.reddit.com/r/learnpython/comments/1chlao3/how_do_i_pick_a_random_line_of_a_random_file_from/,l23tmtz,"Thanks. I should've noted Unix is the only thing I know (like, literally-- I don't even know my kids' names) :)",

l2358ar,https://www.reddit.com/r/learnpython/comments/1chlao3/how_do_i_pick_a_random_line_of_a_random_file_from/l2358ar/,2024-05-01 13:05:06 UTC,,learnpython,0,https://www.reddit.com/r/learnpython/comments/1chlao3/how_do_i_pick_a_random_line_of_a_random_file_from/,,"I know this is /r/learnpython, not /r/learnunix (which doesn't exist) but `find . -type f | sort -R | head -1` is one way to get a random file somewhere in the current directory, including subdirectories",

l2zl5sl,https://www.reddit.com/r/learnpython/comments/1cmd4og/learnbyexample_is_an_underrated_resource/l2zl5sl/,2024-05-07 14:56:52 UTC,,learnpython,0,https://www.reddit.com/r/learnpython/comments/1cmd4og/learnbyexample_is_an_underrated_resource/,,Are you affiliated with this site? https://www.similarweb.com/website/learnbyexample.org/#overview suggests it's a fairly small/unused site,

l240rzk,https://www.reddit.com/r/learnpython/comments/1chlao3/how_do_i_pick_a_random_line_of_a_random_file_from/l240rzk/,2024-05-01 16:17:31 UTC,,learnpython,0,https://www.reddit.com/r/learnpython/comments/1chlao3/how_do_i_pick_a_random_line_of_a_random_file_from/,l23xhmn,"Your idea is actually better (though will probably take longer) if you want a random line from the set of files as opposed to a random line from a random file, which is slightly different",

l401jyv,https://www.reddit.com/r/learnpython/comments/1crrxkz/is_there_a_tldr_command_for_common_python/l401jyv/,2024-05-14 13:44:05 UTC,,learnpython,0,https://www.reddit.com/r/learnpython/comments/1crrxkz/is_there_a_tldr_command_for_common_python/,,"I assume `pydoc numpy.arange` doesn't suffice? It's a bit more verbose and it requires using the full name of the package (numpy) and not its alias (np), but it's fairly nice",

l4vemme,https://www.reddit.com/r/learnpython/comments/1cwf8j4/python_comparison_project/l4vemme/,2024-05-20 13:26:03 UTC,,learnpython,0,https://www.reddit.com/r/learnpython/comments/1cwf8j4/python_comparison_project/,,I had to google to figure out this post was about technical analysis of stocks/etc,

l4glf83,https://www.reddit.com/r/learnpython/comments/1cu6eci/permisson_error_when_writing_openpyworkbook/l4glf83/,2024-05-17 14:32:35 UTC,,learnpython,0,https://www.reddit.com/r/learnpython/comments/1cu6eci/permisson_error_when_writing_openpyworkbook/,,"I didn't actually read your post, but try using the full path instead of a filename: it's possible the two things you are doing run in different directories",

l40ww9x,https://www.reddit.com/r/learnpython/comments/1crv1ok/is_this_correct_and_good_enough/l40ww9x/,2024-05-14 16:45:10 UTC,,learnpython,0,https://www.reddit.com/r/learnpython/comments/1crv1ok/is_this_correct_and_good_enough/,,For reference this is OEIS 034838 (https://oeis.org/A034838) and the linked page provides programs in several languages (including Python) to calculate these numbers,

l45k22w,https://www.reddit.com/r/learnpython/comments/1cskp3s/how_do_i_speedup_this_simulation_program/l45k22w/,2024-05-15 13:32:09 UTC,,learnpython,0,https://www.reddit.com/r/learnpython/comments/1cskp3s/how_do_i_speedup_this_simulation_program/,,Have you done `python -m cProfile script.py`?,

l4ap2ay,https://www.reddit.com/r/learnpython/comments/1ctb1r6/looping_weird_activity/l4ap2ay/,2024-05-16 12:24:55 UTC,,learnpython,0,https://www.reddit.com/r/learnpython/comments/1ctb1r6/looping_weird_activity/,l4ao3tp,Agreed. http://sscce.org/,

l40bawk,https://www.reddit.com/r/learnpython/comments/1crt2nv/best_courses_that_allows_you_to_build_a_chatbot/l40bawk/,2024-05-14 14:42:57 UTC,,learnpython,0,https://www.reddit.com/r/learnpython/comments/1crt2nv/best_courses_that_allows_you_to_build_a_chatbot/,,"Not sure if this helps, but you can run https://easydiffusion.github.io/ on your own machine locally with no remote AI.",

l5qyofn,https://www.reddit.com/r/learnpython/comments/1d12dbu/if_you_are_learning_java_and_are_switching_to/l5qyofn/,2024-05-26 14:29:23 UTC,,learnpython,0,https://www.reddit.com/r/learnpython/comments/1d12dbu/if_you_are_learning_java_and_are_switching_to/,,"You're right, but I don't think this is ""one thing every forgets to teach you"". The concept of pass-by-value versus pass-by-reference is fairly basic: https://stackoverflow.com/questions/40480/is-java-pass-by-reference-or-pass-by-value",

l5gtoc2,https://www.reddit.com/r/learnpython/comments/1czk5yu/deleted_by_user/l5gtoc2/,2024-05-24 13:16:31 UTC,,learnpython,0,https://www.reddit.com/r/learnpython/comments/1czk5yu/deleted_by_user/,,Are you allowed to run an interpreter to find out? Just do `python3` and see which functions work (without `import math`) and which don't.,

l5gxuad,https://www.reddit.com/r/learnpython/comments/1czkx8s/rename_level_3_folder_based_upon_level_1_and/l5gxuad/,2024-05-24 13:44:16 UTC,,learnpython,0,https://www.reddit.com/r/learnpython/comments/1czkx8s/rename_level_3_folder_based_upon_level_1_and/,,"Well, give it a shot in Python and we can try to help out, but I think this sub requires you at least make an effort.

If I were doing it, I'd use a one-line Perl script with some Unix commands and pipes, but if you want to learn Python while doing it, that's cool too",

l6sbzpa,https://www.reddit.com/r/learnpython/comments/1d6hbgw/deleted_by_user/l6sbzpa/,2024-06-02 16:42:12 UTC,,learnpython,0,https://www.reddit.com/r/learnpython/comments/1d6hbgw/deleted_by_user/,,"Unless you mean getting a job as a Python developer or something, it's very hard for anyone to monetize an app on their own. Plenty of people have a great idea for an app and even the skills to code the app, but the app just never takes off.",

l6mnrsx,https://www.reddit.com/r/learnpython/comments/1d5nyvt/deleted_by_user/l6mnrsx/,2024-06-01 14:26:32 UTC,,learnpython,0,https://www.reddit.com/r/learnpython/comments/1d5nyvt/deleted_by_user/,,"Procedural languages aren't really like grocery stores. They're more like ""dumb robots"" who will do exactly what you tell them, the key word being 'exactly': they generally make no effort to decide whether what you're doing makes sense or not.

I'm into cartography as well -- maybe say more about what you're interested in here, and also feel free to ping me",

l6sd1o1,https://www.reddit.com/r/learnpython/comments/1d6hbgw/deleted_by_user/l6sd1o1/,2024-06-02 16:48:47 UTC,,learnpython,0,https://www.reddit.com/r/learnpython/comments/1d6hbgw/deleted_by_user/,l6scnp8,"Sure, but what percentage are successful? I mean you might get lucky or not believe in statistics, but it's important to realize that, unless you've got something up your sleeve you're not telling us, you are ""unlikely"" to succeed",

l72pmhj,https://www.reddit.com/r/learnpython/comments/1d7zani/deleted_by_user/l72pmhj/,2024-06-04 15:17:23 UTC,,learnpython,0,https://www.reddit.com/r/learnpython/comments/1d7zani/deleted_by_user/,,"If you give us some sample text and post it on repl.it, someone might be able to help more. Not me, of course. But someone",

l727zv9,https://www.reddit.com/r/learnpython/comments/1d7x0el/best_method_for_plotting_large_data_sets_across/l727zv9/,2024-06-04 13:31:11 UTC,,learnpython,0,https://www.reddit.com/r/learnpython/comments/1d7x0el/best_method_for_plotting_large_data_sets_across/,,"I'd go with something like leaflet and show ranges of number when someone is ""zoomed out"", since they probably can't see all 2.3 million values at the same time anyway.",

l71xr3e,https://www.reddit.com/r/learnpython/comments/1d7v1hw/overflow_error_persists/l71xr3e/,2024-06-04 12:17:50 UTC,,learnpython,0,https://www.reddit.com/r/learnpython/comments/1d7v1hw/overflow_error_persists/,,Random thought: do you mean `sqrt(u**2 + v**2)`?,

l7ydy6g,https://www.reddit.com/r/learnpython/comments/1dcighn/code_optimization_large_numbers_pandas_scipy/l7ydy6g/,2024-06-10 12:45:26 UTC,,learnpython,0,https://www.reddit.com/r/learnpython/comments/1dcighn/code_optimization_large_numbers_pandas_scipy/,l7yctxk,"Consider mpmath which will compute the gamma function to arbitrary precision: https://mpmath.org/doc/current/functions/gamma.html

Sample code:

```
>>> import mpmath
>>> mpmath.mp.dps = 50
>>> mpmath.gamma(42.694209944)
mpf('446898503418488811522393343375926936169156367006935.0')

```",

l7y7lg1,https://www.reddit.com/r/learnpython/comments/1dcighn/code_optimization_large_numbers_pandas_scipy/l7y7lg1/,2024-06-10 11:54:45 UTC,,learnpython,0,https://www.reddit.com/r/learnpython/comments/1dcighn/code_optimization_large_numbers_pandas_scipy/,,"Have you tried using numpy's parallelization (evaluate the function for multiple values at the same time)? How accurate does the result have to be? The log of this function is nearly linear and you could approximate it with a polynomial, but that would be less accurate (especially since you're estimating the log and then exponentiating). You could also consider an interpolation function. Also, what goal are you trying to achieve by evaluating this function?",

l7ymzs9,https://www.reddit.com/r/learnpython/comments/1dby4wd/how_do_i_use_scipyoptimizeleast_squares_to_find_a/l7ymzs9/,2024-06-10 13:48:09 UTC,,learnpython,0,https://www.reddit.com/r/learnpython/comments/1dby4wd/how_do_i_use_scipyoptimizeleast_squares_to_find_a/,,"I'm pretty sure this is nonlinear fitting, which is more difficult. If you have some sample data and can put this up on repl.it or even github, people who are not me may be able to help more",

l7yfmhw,https://www.reddit.com/r/learnpython/comments/1dck9i0/dynamic_variable_naming/l7yfmhw/,2024-06-10 12:57:50 UTC,,learnpython,0,https://www.reddit.com/r/learnpython/comments/1dck9i0/dynamic_variable_naming/,l7yfbxa,"I think you can do it in some languages using eval, but it's almost never necessary.",

l854gzq,https://www.reddit.com/r/learnpython/comments/1ddia6b/how_can_i_improve_this_program_in_python_to_find/l854gzq/,2024-06-11 17:06:36 UTC,,learnpython,0,https://www.reddit.com/r/learnpython/comments/1ddia6b/how_can_i_improve_this_program_in_python_to_find/,,"All even perfect numbers are related to Mersenne primes https://en.wikipedia.org/wiki/Perfect_number#Even_perfect_numbers

You could also just use an existing list (https://oeis.org/A000396), but iterating through the natural numbers one at a time is going to be WAY too slow, as you've noticed",

l8ex454,https://www.reddit.com/r/learnpython/comments/1dewhwu/command_line_utility_for_help_and_documentation/l8ex454/,2024-06-13 12:08:40 UTC,,learnpython,0,https://www.reddit.com/r/learnpython/comments/1dewhwu/command_line_utility_for_help_and_documentation/,,How is this different from pydoc?,

l9lgqaa,https://www.reddit.com/r/learnpython/comments/1dl0d8d/in_a_pickle_how_to_extract_data_from_a_pbf_file/l9lgqaa/,2024-06-21 10:28:46 UTC,,learnpython,0,https://www.reddit.com/r/learnpython/comments/1dl0d8d/in_a_pickle_how_to_extract_data_from_a_pbf_file/,,"`ogrinfo -al filename.pbf` will output tons of info, perhaps more than you need. You can limit the info you get by adding `-geom=NONE`",

la7bktb,https://www.reddit.com/r/learnpython/comments/1dn005r/ask_anything_monday_weekly_thread/la7bktb/,2024-06-25 13:28:43 UTC,,learnpython,0,https://www.reddit.com/r/learnpython/comments/1dn005r/ask_anything_monday_weekly_thread/,la7a6dk,"Consider `lst[1]`, `lst[2]`, etc",

laoe77n,https://www.reddit.com/r/learnpython/comments/1dqjjxj/how_i_get_an_entry_that_stays_in_one_format/laoe77n/,2024-06-28 13:30:41 UTC,,learnpython,0,https://www.reddit.com/r/learnpython/comments/1dqjjxj/how_i_get_an_entry_that_stays_in_one_format/,,Look into regular expressions and string matching,

layx7gk,https://www.reddit.com/r/learnpython/comments/1dn005r/ask_anything_monday_weekly_thread/layx7gk/,2024-06-30 12:36:44 UTC,,learnpython,0,https://www.reddit.com/r/learnpython/comments/1dn005r/ask_anything_monday_weekly_thread/,laywivy,"OK, what are you entering to test it. Also, I'm saying that adding print statements often makes it easier to debug without having to use a debugging framework",

lai8h1n,https://www.reddit.com/r/learnpython/comments/1dpor62/khan_academy_input_function_not_working/lai8h1n/,2024-06-27 11:25:08 UTC,,learnpython,0,https://www.reddit.com/r/learnpython/comments/1dpor62/khan_academy_input_function_not_working/,,"There should be a place where you can type in the standard input you want, similar to the way repl.it does it. I know repl.it isn't interactive, and I'm guessing Khan isn't either",

layybf6,https://www.reddit.com/r/learnpython/comments/1ds0954/python_question/layybf6/,2024-06-30 12:45:56 UTC,,learnpython,0,https://www.reddit.com/r/learnpython/comments/1ds0954/python_question/,,"With nested functions, we work from the inside out:

  - range(0,10) is the numbers from 0 to 9. Note that this is 10 numbers total

  - filter(f, ...) selects the numbers for which f is ""true"". In this case ""true"" means ""non-zero"". The only numbers for which x%4 is 0 in this list are [0, 4, 8]. Those are eliminated from the list.

  - len(list(...)) gives us the length of the list after filtering: 10 originally minus the 3 removed by the filter, yielding 7 total

Off the top of my head, I thought the answer would be 8, until I remembered range() starts at 0 and that 0 is divisible by 4",

