
m0jpsyv,https://www.reddit.com/r/Sat/comments/1h7b4k1/deleted_by_user/m0jpsyv/,2024-12-05 15:05:45 UTC,,Sat,0,https://www.reddit.com/r/Sat/comments/1h7b4k1/deleted_by_user/,,Couldn't you just multiply the trinomial out? FOIL and FOIL again,

m1116ta,https://www.reddit.com/r/Sat/comments/1h9ix7k/deleted_by_user/m1116ta/,2024-12-08 13:39:55 UTC,,Sat,0,https://www.reddit.com/r/Sat/comments/1h9ix7k/deleted_by_user/,,"Are you allowed to use desmos on the SAT? (actually asking, I'm old and took the SAT with rocks and chisels)",

m3b85b2,https://www.reddit.com/r/Sat/comments/1hk372f/what_if_we_started_saying_one_thousand_five/m3b85b2/,2024-12-22 17:49:29 UTC,,Sat,0,https://www.reddit.com/r/Sat/comments/1hk372f/what_if_we_started_saying_one_thousand_five/,,"The ""and"" is technically incorrect and should only be used for decimals",

mldm003,https://www.reddit.com/r/Sat/comments/1jrcohr/this_is_ur_reminder_that_your_score_doesnt_define/mldm003/,2025-04-04 14:16:30 UTC,98.48.122.229,Sat,0,https://www.reddit.com/r/Sat/comments/1jrcohr/this_is_ur_reminder_that_your_score_doesnt_define/,mldl7n6,"My current goal is to go back in time and stop you from posting.

I agree people shouldn't focus too much on their SAT scores, but they do have SOME impact on your life, even if it's only making it easier and cheaper (via scholarship) to get a PhD",

mldkyxu,https://www.reddit.com/r/Sat/comments/1jrcohr/this_is_ur_reminder_that_your_score_doesnt_define/mldkyxu/,2025-04-04 14:11:11 UTC,98.48.122.229,Sat,0,https://www.reddit.com/r/Sat/comments/1jrcohr/this_is_ur_reminder_that_your_score_doesnt_define/,,"I hate mankind and take it out on posts like yours.

You're correct in saying no one will care about your SAT score in a few years, but it might matter in the sense of where you and what you are doing.",