
mb1u417,https://www.reddit.com/r/TooAfraidToAsk/comments/1ii00ot/baffling_question_yeah/mb1u417/,2025-02-05 04:05:36 UTC,,TooAfraidToAsk,0,https://www.reddit.com/r/TooAfraidToAsk/comments/1ii00ot/baffling_question_yeah/,,"While I personally support recreational substance use, I'm not sure what you're talking about here and if it has anything to do with drugs. Could you provide additional context and potentially links?",

mbfme5q,https://www.reddit.com/r/TooAfraidToAsk/comments/1ijnvqj/is_it_legal_to_have_your_body_eaten_upon_request/mbfme5q/,2025-02-07 05:41:32 UTC,,TooAfraidToAsk,0,https://www.reddit.com/r/TooAfraidToAsk/comments/1ijnvqj/is_it_legal_to_have_your_body_eaten_upon_request/,,"I'm sure you're trolling, but cannibalism is unhealthy.",

mbsi2yy,https://www.reddit.com/r/TooAfraidToAsk/comments/1il7l5s/would_you_say_its_weird_to_have_a_mommy_kink_if/mbsi2yy/,2025-02-09 05:35:40 UTC,,TooAfraidToAsk,0,https://www.reddit.com/r/TooAfraidToAsk/comments/1il7l5s/would_you_say_its_weird_to_have_a_mommy_kink_if/,,"The mommy kink isn't about the age difference, it's about the roleplay, so it doesn't matter even if the girl is younger than you",

mbwqlp5,https://www.reddit.com/r/TooAfraidToAsk/comments/1ilpup5/why_are_so_many_first_world_countries_majority/mbwqlp5/,2025-02-09 21:39:15 UTC,,TooAfraidToAsk,0,https://www.reddit.com/r/TooAfraidToAsk/comments/1ilpup5/why_are_so_many_first_world_countries_majority/,,What about China?,

mbuwg58,https://www.reddit.com/r/TooAfraidToAsk/comments/1ilicl6/how_to_stay_straight/mbuwg58/,2025-02-09 16:27:31 UTC,,TooAfraidToAsk,0,https://www.reddit.com/r/TooAfraidToAsk/comments/1ilicl6/how_to_stay_straight/,,"Do you mean ""same sex""? Attractions to the opposite sex is heterosexuality",

mbn8rua,https://www.reddit.com/r/TooAfraidToAsk/comments/1ikkflr/i_have_a_strong_libido_what_can_i_do/mbn8rua/,2025-02-08 11:52:59 UTC,,TooAfraidToAsk,0,https://www.reddit.com/r/TooAfraidToAsk/comments/1ikkflr/i_have_a_strong_libido_what_can_i_do/,,Frequent vigorous masturbation with high quality pornography,

mcdvzwj,https://www.reddit.com/r/TooAfraidToAsk/comments/1inufp9/deleted_by_user/mcdvzwj/,2025-02-12 16:11:34 UTC,,TooAfraidToAsk,0,https://www.reddit.com/r/TooAfraidToAsk/comments/1inufp9/deleted_by_user/,,"It's like the whole bikini-vs-underwear thing: same amount of exposure but feels very different. It just seems wrong to wear pajamas outside, so people will definitely give you a second look.",

mc1dk1g,https://www.reddit.com/r/TooAfraidToAsk/comments/1im9tvm/why_do_i_get_downvoted_every_time_i_make_a/mc1dk1g/,2025-02-10 16:34:54 UTC,,TooAfraidToAsk,0,https://www.reddit.com/r/TooAfraidToAsk/comments/1im9tvm/why_do_i_get_downvoted_every_time_i_make_a/,,Because you're wrong. Stop shaming people's fantasies. Anime girls are not real people,

md3b42j,https://www.reddit.com/r/TooAfraidToAsk/comments/1iqvcx3/do_girls_only_like_me_if_i_smell_nice/md3b42j/,2025-02-16 16:18:41 UTC,,TooAfraidToAsk,0,https://www.reddit.com/r/TooAfraidToAsk/comments/1iqvcx3/do_girls_only_like_me_if_i_smell_nice/,,How often do you shower? Do you use deodorant or anti-perspirant?,

md3kj3y,https://www.reddit.com/r/TooAfraidToAsk/comments/1iqwplb/is_anyone_ever_freaked_out_at_thatno_one_cares/md3kj3y/,2025-02-16 17:04:26 UTC,,TooAfraidToAsk,0,https://www.reddit.com/r/TooAfraidToAsk/comments/1iqwplb/is_anyone_ever_freaked_out_at_thatno_one_cares/,,"I mean, your family and friends probably care about you, but why should the rest of us. There are 8 billion of us and we don't even know you",

mdfb3ug,https://www.reddit.com/r/TooAfraidToAsk/comments/1isca6t/a_friend_of_mine_just_told_me_that_his_girlfriend/mdfb3ug/,2025-02-18 13:23:02 UTC,,TooAfraidToAsk,0,https://www.reddit.com/r/TooAfraidToAsk/comments/1isca6t/a_friend_of_mine_just_told_me_that_his_girlfriend/,,"This is one reason ""chaste"" women in old movies ride sidesaddle (the other is that horse-riding can tear the hymen). It MIGHT be why girls like ponies.

If you google around, you'll see the phenomenon is fairly well known. The horse's consistent gait apparently generates the right kind of vibration",

mdeztix,https://www.reddit.com/r/TooAfraidToAsk/comments/1isb02f/deleted_by_user/mdeztix/,2025-02-18 12:02:53 UTC,,TooAfraidToAsk,0,https://www.reddit.com/r/TooAfraidToAsk/comments/1isb02f/deleted_by_user/,,"I'm opposed to mandatory public education, so also opposed to mandatory fitness programs for children.

I would encourage parents and private schools to include physical activity either as part of their cirriculum or just in daily life, but I would oppose government supervision or regulation of such programs",

mdm4769,https://www.reddit.com/r/TooAfraidToAsk/comments/1it58ei/deleted_by_user/mdm4769/,2025-02-19 13:57:12 UTC,,TooAfraidToAsk,0,https://www.reddit.com/r/TooAfraidToAsk/comments/1it58ei/deleted_by_user/,,Cosplay baby!,

medxdam,https://www.reddit.com/r/TooAfraidToAsk/comments/1iwg1na/profit_from_posting_other_ppls_porn_videos/medxdam/,2025-02-23 18:57:57 UTC,,TooAfraidToAsk,0,https://www.reddit.com/r/TooAfraidToAsk/comments/1iwg1na/profit_from_posting_other_ppls_porn_videos/,medlg5n,"http://www.fordhamiplj.org/2024/05/24/reacting-right-fair-use-and-reaction-content/ suggests you're right, but I don't know if it's been tested where someone just basically shows a video and says ""cool"" or whatever without adding meaningful criticism or commentary.

I know YouTube will sometimes still take down such videos and some content producers have moved to patreon, on the theory their videos are safer there AND they get to profit from what is, arguably, someone else's work",

mdm3onk,https://www.reddit.com/r/TooAfraidToAsk/comments/1it5n4p/do_you_think_casual_sex_can_be_addictive_and_also/mdm3onk/,2025-02-19 13:54:17 UTC,,TooAfraidToAsk,0,https://www.reddit.com/r/TooAfraidToAsk/comments/1it5n4p/do_you_think_casual_sex_can_be_addictive_and_also/,,This question seems very biased. Why not ask about the benefits of casual sex and/or if monogamy or abstinence can be addictive?,

mdmml81,https://www.reddit.com/r/TooAfraidToAsk/comments/1it84ak/parents_of_daughters_how_did_your_ultrasound_go/mdmml81/,2025-02-19 15:33:40 UTC,,TooAfraidToAsk,0,https://www.reddit.com/r/TooAfraidToAsk/comments/1it84ak/parents_of_daughters_how_did_your_ultrasound_go/,,"You sound angry. You realize that it's easier to see sticky out parts vs seeing a lack of sticky out parts, right?",

medkuy6,https://www.reddit.com/r/TooAfraidToAsk/comments/1iwg1na/profit_from_posting_other_ppls_porn_videos/medkuy6/,2025-02-23 17:58:44 UTC,,TooAfraidToAsk,0,https://www.reddit.com/r/TooAfraidToAsk/comments/1iwg1na/profit_from_posting_other_ppls_porn_videos/,,"You'd be in violation of copyright, but tons of people already do that on youtube via ""reaction videos"", so I'm not sure. Maybe you could post ""reaction videos"" to stolen porn or something, but it's almost certainly not legal",

mdm3un4,https://www.reddit.com/r/TooAfraidToAsk/comments/1it5kut/deleted_by_user/mdm3un4/,2025-02-19 13:55:13 UTC,,TooAfraidToAsk,0,https://www.reddit.com/r/TooAfraidToAsk/comments/1it5kut/deleted_by_user/,,"We already have a compass in our nose, no need to swallow more: https://www.theregister.com/2006/11/17/the_odd_body_nose_compass/",

mdeugnk,https://www.reddit.com/r/TooAfraidToAsk/comments/1isa8fu/what_is_this_sex_position_called/mdeugnk/,2025-02-18 11:16:29 UTC,,TooAfraidToAsk,0,https://www.reddit.com/r/TooAfraidToAsk/comments/1isa8fu/what_is_this_sex_position_called/,mdetkr8,Damn: https://www.menshealth.com/sex-women/a46118002/prone-bone-sex-position/,

mfrym6c,https://www.reddit.com/r/TooAfraidToAsk/comments/1j2i0us/deleted_by_user/mfrym6c/,2025-03-03 13:26:34 UTC,,TooAfraidToAsk,0,https://www.reddit.com/r/TooAfraidToAsk/comments/1j2i0us/deleted_by_user/,mfrv46n,"Which actually makes it odd that, 50 years ago, when India was the 2nd most populus nation in the world, there were far more European immigrants than immigrants from the Indian subcontinent.",

mfo3tgn,https://www.reddit.com/r/TooAfraidToAsk/comments/1j20y61/how_not_to_care_about_what_others_think_in_an_age/mfo3tgn/,2025-03-02 21:00:51 UTC,,TooAfraidToAsk,0,https://www.reddit.com/r/TooAfraidToAsk/comments/1j20y61/how_not_to_care_about_what_others_think_in_an_age/,,"I think the advice is to ignore people's opinions, not hope they don't express them.",

mg4ytbc,https://www.reddit.com/r/TooAfraidToAsk/comments/1j41wdb/if_vaccines_dont_cause_autism_why_are_people/mg4ytbc/,2025-03-05 12:44:29 UTC,,TooAfraidToAsk,0,https://www.reddit.com/r/TooAfraidToAsk/comments/1j41wdb/if_vaccines_dont_cause_autism_why_are_people/,,"Not everyone accepts vacciness don't cause autism. Even though there are no good studies showing they do, there are also no good studies showing they don't (that I know of).

More importantly, vacciness may have other unknown or person-specific short and long-term dangers (including genetic/reproductive dangers) we don't know about.

It's also counterintuitive to believe forcing illness on the body makes us healthier.

Logically, we have to accept that vaccination can be risky, but also that non-vaccination can be risky",

mhk9dzp,https://www.reddit.com/r/TooAfraidToAsk/comments/1jabgrl/what_is_the_tempature_of_the_vagina/mhk9dzp/,2025-03-13 13:32:25 UTC,,TooAfraidToAsk,0,https://www.reddit.com/r/TooAfraidToAsk/comments/1jabgrl/what_is_the_tempature_of_the_vagina/,mhk8ura,"I was going to say ""I help gay men transition"", but that's a bit much",

mhk6mhp,https://www.reddit.com/r/TooAfraidToAsk/comments/1jabgrl/what_is_the_tempature_of_the_vagina/mhk6mhp/,2025-03-13 13:16:44 UTC,,TooAfraidToAsk,0,https://www.reddit.com/r/TooAfraidToAsk/comments/1jabgrl/what_is_the_tempature_of_the_vagina/,,"Rectal temperature is usually one degree higher Farenheit than oral temperature (don't mix up those thermometers!), and the vagina is sort of like a rectum, so...

I should point out I know very little about thermometers, temperature, rectums, female anatomy, and, well, pretty much everything else",

mhkmru3,https://www.reddit.com/r/TooAfraidToAsk/comments/1jabgrl/what_is_the_tempature_of_the_vagina/mhkmru3/,2025-03-13 14:42:26 UTC,,TooAfraidToAsk,0,https://www.reddit.com/r/TooAfraidToAsk/comments/1jabgrl/what_is_the_tempature_of_the_vagina/,mhk9zdg,"I did some further digging (in the research, not the vagina) and while most researchers get slapped or asked ""are you sure that's a thermometer"", A Jackson was able to find an upper bound:

""Way down yonder on the Chatacoochee, it gets hotter than a hootchie cootchie""

Scholars disagree on whether ""hootchie"" means ""good looking"" or ""lubricated with alchohol"", so the limit may only apply to lubricated vaginas, or to vaginas belonging to lubricated owners.",

mhkneyj,https://www.reddit.com/r/TooAfraidToAsk/comments/1jaboqt/deleted_by_user/mhkneyj/,2025-03-13 14:45:38 UTC,,TooAfraidToAsk,0,https://www.reddit.com/r/TooAfraidToAsk/comments/1jaboqt/deleted_by_user/,mhkag9l,"I'm trying to think of something funny to say, but I can't. I guess I personally can't see getting attached to non-human animals, especially not frogs and mice, but if you actually do feel bad for them, I'm not sure what you can do. Say a little prayer for them? Tell them they're helping people (I mean, it's a different species, but maybe they like humans or something-- probably not though)",

mhy4229,https://www.reddit.com/r/TooAfraidToAsk/comments/1jbybp0/left_testicle_discomfort_some_days_but_no_pain/mhy4229/,2025-03-15 17:00:36 UTC,,TooAfraidToAsk,0,https://www.reddit.com/r/TooAfraidToAsk/comments/1jbybp0/left_testicle_discomfort_some_days_but_no_pain/,,"Before visiting a urologist, try taking an anti-gas tablet: it's a weird place for gas pain, but it solved my problem",

mhk80yn,https://www.reddit.com/r/TooAfraidToAsk/comments/1jaboqt/deleted_by_user/mhk80yn/,2025-03-13 13:24:45 UTC,,TooAfraidToAsk,0,https://www.reddit.com/r/TooAfraidToAsk/comments/1jaboqt/deleted_by_user/,,"Some people would argue that mice and frogs aren't sentient, and so don't care if you unalive them. In fact, it's sort of an eternal rest for them. I'd feel more bad about what you're doing to them while they're alive.",

micxpuk,https://www.reddit.com/r/TooAfraidToAsk/comments/1jdnm5h/what_does_it_mean_if_a_girl_is_called_pretty_by/micxpuk/,2025-03-18 00:43:41 UTC,,TooAfraidToAsk,0,https://www.reddit.com/r/TooAfraidToAsk/comments/1jdnm5h/what_does_it_mean_if_a_girl_is_called_pretty_by/,micx6us,"https://www.verywellfit.com/average-height-for-a-woman-statistics-2632136 says

> In the U.S., the average height for women is about 5 feet 4 inches

Can you countersource? I vaguely remember being the same height as the average woman when I was growing up, 5 foot 6, but the human height has been decreasing slightly.",

mic37sz,https://www.reddit.com/r/TooAfraidToAsk/comments/1jdnm5h/what_does_it_mean_if_a_girl_is_called_pretty_by/mic37sz/,2025-03-17 21:57:20 UTC,,TooAfraidToAsk,0,https://www.reddit.com/r/TooAfraidToAsk/comments/1jdnm5h/what_does_it_mean_if_a_girl_is_called_pretty_by/,mic1s96,"When you turn 18, put your profile up on a dating app: you'll never want for male attention again",

mibzsrs,https://www.reddit.com/r/TooAfraidToAsk/comments/1jdnm5h/what_does_it_mean_if_a_girl_is_called_pretty_by/mibzsrs/,2025-03-17 21:39:50 UTC,,TooAfraidToAsk,0,https://www.reddit.com/r/TooAfraidToAsk/comments/1jdnm5h/what_does_it_mean_if_a_girl_is_called_pretty_by/,mibv9iz,"Actually, it might be the height thing. 5 foot 7 isn't super tall, but men less than your height probably won't be interested. Some guys also don't like overly athletic girls or girls with small breasts on some weird theory it means they're gay and actually want a guy.",

mibsnsd,https://www.reddit.com/r/TooAfraidToAsk/comments/1jdnm5h/what_does_it_mean_if_a_girl_is_called_pretty_by/mibsnsd/,2025-03-17 21:04:06 UTC,,TooAfraidToAsk,0,https://www.reddit.com/r/TooAfraidToAsk/comments/1jdnm5h/what_does_it_mean_if_a_girl_is_called_pretty_by/,,"I hate to ask, but how much do you weigh?",

mic1b59,https://www.reddit.com/r/TooAfraidToAsk/comments/1jdnm5h/what_does_it_mean_if_a_girl_is_called_pretty_by/mic1b59/,2025-03-17 21:47:31 UTC,,TooAfraidToAsk,0,https://www.reddit.com/r/TooAfraidToAsk/comments/1jdnm5h/what_does_it_mean_if_a_girl_is_called_pretty_by/,mic0u3b,"Actually, you mentioned ""mostly white, ever-so-slightly conservative area"". Are interracial relationships common where you are? Some people still stigmatize those",

mpp53m5,https://www.reddit.com/r/TooAfraidToAsk/comments/1kau9jr/aliens/mpp53m5/,2025-04-29 17:55:03 UTC,98.48.122.229,TooAfraidToAsk,0,https://www.reddit.com/r/TooAfraidToAsk/comments/1kau9jr/aliens/,,"I personally believe ""AI"" is really aliens communicating with us to make us feel more comfortable with them",

mpjjc8q,https://www.reddit.com/r/TooAfraidToAsk/comments/1ka5cz3/why_do_so_many_american_women_resort_to_porn/mpjjc8q/,2025-04-28 20:18:31 UTC,98.48.122.229,TooAfraidToAsk,0,https://www.reddit.com/r/TooAfraidToAsk/comments/1ka5cz3/why_do_so_many_american_women_resort_to_porn/,,Very few American women do porn. I wish more did,

mpjm2gc,https://www.reddit.com/r/TooAfraidToAsk/comments/1ka5ndh/why_does_jennifer_lawrence_do_so_many_nude_scenes/mpjm2gc/,2025-04-28 20:31:58 UTC,98.48.122.229,TooAfraidToAsk,0,https://www.reddit.com/r/TooAfraidToAsk/comments/1ka5ndh/why_does_jennifer_lawrence_do_so_many_nude_scenes/,,She's sexy and she knows it,

mpunr48,https://www.reddit.com/r/TooAfraidToAsk/comments/1kbiq5l/why_are_so_many_pop_and_rap_songs_nowadays_about/mpunr48/,2025-04-30 15:04:42 UTC,98.48.122.229,TooAfraidToAsk,0,https://www.reddit.com/r/TooAfraidToAsk/comments/1kbiq5l/why_are_so_many_pop_and_rap_songs_nowadays_about/,,Haven't they always been?,

mqpshxg,https://www.reddit.com/r/TooAfraidToAsk/comments/1kfden2/why_dont_humans_ever_think_of_negative/mqpshxg/,2025-05-05 14:52:50 UTC,98.48.122.229,TooAfraidToAsk,0,https://www.reddit.com/r/TooAfraidToAsk/comments/1kfden2/why_dont_humans_ever_think_of_negative/,,"But we do. There are plenty of measures we take against negative consequences. However, we can't catch everything. If we focused solely on negative consequences and harm, we'd never get anything done",

mqwgheg,https://www.reddit.com/r/TooAfraidToAsk/comments/1kg7ext/am_i_normal_to_fantasize_about_super_random/mqwgheg/,2025-05-06 15:38:50 UTC,98.48.122.229,TooAfraidToAsk,0,https://www.reddit.com/r/TooAfraidToAsk/comments/1kg7ext/am_i_normal_to_fantasize_about_super_random/,,I think most men fantasize about random women they see on the street or on TV.,

mqwth9l,https://www.reddit.com/r/TooAfraidToAsk/comments/1kg5fjn/do_people_save_their_fav_porn_in_their_computer/mqwth9l/,2025-05-06 16:41:27 UTC,98.48.122.229,TooAfraidToAsk,0,https://www.reddit.com/r/TooAfraidToAsk/comments/1kg5fjn/do_people_save_their_fav_porn_in_their_computer/,mqwt414,"Very rarely, but what if there's a crisis or disaster or something. I don't mind losing my home, my car, and my family, but not my porn :)",

mqw51oh,https://www.reddit.com/r/TooAfraidToAsk/comments/1kg5fjn/do_people_save_their_fav_porn_in_their_computer/mqw51oh/,2025-05-06 14:43:52 UTC,98.48.122.229,TooAfraidToAsk,0,https://www.reddit.com/r/TooAfraidToAsk/comments/1kg5fjn/do_people_save_their_fav_porn_in_their_computer/,,"I have 2 TB of porn on my computer (mostly Tumblr blogs from the ""before time""). It's a lot easier to have it on tap, especially when the Internet goes out",

mrks892,https://www.reddit.com/r/TooAfraidToAsk/comments/1kj8kf8/how_did_the_male_loneliness_epidemic_create_such/mrks892/,2025-05-10 12:12:46 UTC,98.48.122.229,TooAfraidToAsk,0,https://www.reddit.com/r/TooAfraidToAsk/comments/1kj8kf8/how_did_the_male_loneliness_epidemic_create_such/,,"It's really the male ""horniness"" epidemic and men use it to try to guilt women into having sex with them.

If it were really just loneliness, men would hang out with other men, not insist that only women can cure their ""loneliness"".

As a man, I don't object to convincing women to have sex with us, but you can see where they'd be angry if we imply we're being emotionally harmed if they don't.",

mt2epsr,https://www.reddit.com/r/TooAfraidToAsk/comments/1kq1lib/should_society_reintroduce_smacking_as_a_means_of/mt2epsr/,2025-05-19 03:43:29 UTC,98.48.122.229,TooAfraidToAsk,0,https://www.reddit.com/r/TooAfraidToAsk/comments/1kq1lib/should_society_reintroduce_smacking_as_a_means_of/,,"Although I don't have a problem with corporal punishment, you may have made the cringiest possible argument for it:

> I've worked with a lot of students from Asia and found them to be infinitely more respectful and polite than their western counterparts

Asian culture is different from Western culture in many ways, so you can't attribute this difference to just corporal punishment.

Kids generally NEED to rebel to some degree to grow, and excessive respect and politeness towards adults can lead to covering up abuse: kids still need to speak out against bad parents and bad teachers.

> a child is being a little shit

This sounds like you're extremely angry at children and not like you're making a valid argument. I'm not sure why you chose to phrase it this way.

> teachers are unable to do their jobs because of the awful behaviour of young people.

I believe public education is really a form of imprisonment for students where they're forcefed useless or inaccurate knowledge and propoganda, and that teachers are mostly bad people who harm children. So teachers not doing their ""jobs"" is a good thing. At the same time, I do believe parents have the right to raise their children how they want, and thus the right to send their children to public school, but I can also understand why children rebel against public education.

> what they think the alternatives to physical discipline are?

This is the weakest part of your argument. Not even our prison system uses physical discipline. Non-violent restraint (forcing a child to remain in a room or an area and not use any entertainment devices) is a good alternative to corporal punishment. Because non-violent restraint may require some physical actions (such as picking the child up or barring a door), it's still a form of ""physical discipline"" but not the same thing as ""corporal punishment"".

To me, the only valid argument for corporal punishment is to remind kids that violence really is the ultimate answer. For the most part, we don't solve problems like slavery or genocide by putting people on the naughty step. Ultimately, we do need war and physical violence and no one should say ""violence is never the answer"". However, violence should be a last resort, and, despite what you say, it sounds like you want to use it a lot, not just in a few specific cases. But, ultimately, kids need to learn that, if they continue to disregard people's rights, they will be met with violence.",

mt2eva2,https://www.reddit.com/r/TooAfraidToAsk/comments/1kq1lib/should_society_reintroduce_smacking_as_a_means_of/mt2eva2/,2025-05-19 03:44:37 UTC,98.48.122.229,TooAfraidToAsk,0,https://www.reddit.com/r/TooAfraidToAsk/comments/1kq1lib/should_society_reintroduce_smacking_as_a_means_of/,mt2d096,"False analogy. Your boss, pastor, spouse is not in charge of raising you.",

mt2d3rn,https://www.reddit.com/r/TooAfraidToAsk/comments/1kq1lib/should_society_reintroduce_smacking_as_a_means_of/mt2d3rn/,2025-05-19 03:31:15 UTC,98.48.122.229,TooAfraidToAsk,0,https://www.reddit.com/r/TooAfraidToAsk/comments/1kq1lib/should_society_reintroduce_smacking_as_a_means_of/,mt2bu54,"There's no accurate ethical way to conduct an experiment that shows what affect corporal punishment (not ""physical abuse"") has on children, so, unless you know of a large-scale unethical study, there's no way research can show anything about whether corporal punishment harms of benefits children. Any research that claims to do so is inherently false. There is no scientific evidence that corporal punishment is harmful, though there's also no scientific evidence that it's helpful either.",

mudbnv5,https://www.reddit.com/r/TooAfraidToAsk/comments/1kvza0m/why_do_some_people_not_appreciate_kindness/mudbnv5/,2025-05-26 16:56:22 UTC,98.48.122.229,TooAfraidToAsk,0,https://www.reddit.com/r/TooAfraidToAsk/comments/1kvza0m/why_do_some_people_not_appreciate_kindness/,,"Aside from these few specific instances, how do you normally treat people? Do other people do you favors as well? Did you charge the car guy gas money? I think there's some context we're missing here",

mthosee,https://www.reddit.com/r/TooAfraidToAsk/comments/1ks0yfd/guys/mthosee/,2025-05-21 15:44:00 UTC,98.48.122.229,TooAfraidToAsk,0,https://www.reddit.com/r/TooAfraidToAsk/comments/1ks0yfd/guys/,,"Depends on what the violent things are, but you don't have to your thoughts to Reddit. You can write them down in a journal, even a non-computer one, and thoroughly destroy what you've written to play it safe. Or, see a therapist, but realize even therapists are required to report certain types of violent thoughts.

Everyone has occasional violent thoughts so if it's *just* that, I wouldn't worry about it.",

mtvujfi,https://www.reddit.com/r/TooAfraidToAsk/comments/1ktqmmh/what_does_it_mean_if_a_man_cums_in_less_than_a/mtvujfi/,2025-05-23 18:56:16 UTC,98.48.122.229,TooAfraidToAsk,0,https://www.reddit.com/r/TooAfraidToAsk/comments/1ktqmmh/what_does_it_mean_if_a_man_cums_in_less_than_a/,,"The clinical term is ""premature ejaculation"" (but only in some cases), though I'm more of a wham, bam, thank you ma'am guy myself",

mvf7l0x,https://www.reddit.com/r/TooAfraidToAsk/comments/1l0q6fo/why_do_people_say_save_europe/mvf7l0x/,2025-06-01 14:43:40 UTC,98.48.122.229,TooAfraidToAsk,0,https://www.reddit.com/r/TooAfraidToAsk/comments/1l0q6fo/why_do_people_say_save_europe/,mvf5vf0,"> most of us just want a complete halt on immigration

Can you source that? Do you mean just Sweden or Europe in general?

I would argue that it's still racism (or anti-nationalism) to claim that immigrants brings problems",

mvm7p9r,https://www.reddit.com/r/TooAfraidToAsk/comments/1l1ms06/why_do_most_scam_calls_come_in_an_indian_accent/mvm7p9r/,2025-06-02 16:52:23 UTC,98.48.122.229,TooAfraidToAsk,0,https://www.reddit.com/r/TooAfraidToAsk/comments/1l1ms06/why_do_most_scam_calls_come_in_an_indian_accent/,,"India is now the most populated country in the world and also a relatively poor country, so you can see where a lot of scammers would be from India. Million dollar idea: give scammers lessons on how to sound more American (or British or even Australian) so they're harder to recognize.",

mwoglbp,https://www.reddit.com/r/TooAfraidToAsk/comments/1l6g5e2/can_reading_books_be_considered_as_a_hobby/mwoglbp/,2025-06-08 16:27:46 UTC,98.48.122.229,TooAfraidToAsk,0,https://www.reddit.com/r/TooAfraidToAsk/comments/1l6g5e2/can_reading_books_be_considered_as_a_hobby/,,"There are many passive hobbies like stamp/coin collecting, board games (incl things like jigsaw puzzles), word games (like crosswords), number games (eg, Sudoku), knitting, building models, and many others",

mvm7gfz,https://www.reddit.com/r/TooAfraidToAsk/comments/1l1ms06/why_do_most_scam_calls_come_in_an_indian_accent/mvm7gfz/,2025-06-02 16:51:13 UTC,98.48.122.229,TooAfraidToAsk,0,https://www.reddit.com/r/TooAfraidToAsk/comments/1l1ms06/why_do_most_scam_calls_come_in_an_indian_accent/,mvm6pt6,Do you have any sort of source on this?,

mwouh60,https://www.reddit.com/r/TooAfraidToAsk/comments/1l6hk0e/so_what_happens_after_you_take_too_much_benadryl/mwouh60/,2025-06-08 17:37:26 UTC,98.48.122.229,TooAfraidToAsk,0,https://www.reddit.com/r/TooAfraidToAsk/comments/1l6hk0e/so_what_happens_after_you_take_too_much_benadryl/,,Benadryl is diphenhydramine hydrochloride: https://www.mountsinai.org/health-library/poison/diphenhydramine-overdose,

