
lzw9mkr,https://www.reddit.com/r/dataengineering/comments/1h47ajt/intelligence_is_statistics/lzw9mkr/,2024-12-01 17:13:44 UTC,,dataengineering,0,https://www.reddit.com/r/dataengineering/comments/1h47ajt/intelligence_is_statistics/,,"In general, I disagree. Statistics often reinforces human bias, leads to abuse, and has no true predictive value.",

mbhfdzt,https://www.reddit.com/r/dataengineering/comments/1ijvis2/how_to_scrap_data/mbhfdzt/,2025-02-07 14:38:05 UTC,,dataengineering,0,https://www.reddit.com/r/dataengineering/comments/1ijvis2/how_to_scrap_data/,,"I use `wget -m` from the command line myself, but it's not 100%. You might start with something like that and then look into selenium if that doesn't work",

mbnbc7t,https://www.reddit.com/r/dataengineering/comments/1ikl8u4/revolutionary_database/mbnbc7t/,2025-02-08 12:15:22 UTC,,dataengineering,0,https://www.reddit.com/r/dataengineering/comments/1ikl8u4/revolutionary_database/,mbnb4vh,Do you mean it stores one value per key and doesn't have columns and tables like other database servers?,

mk8ejp7,https://www.reddit.com/r/dataengineering/comments/1jm26rj/should_i_do_data_science_computational_data/mk8ejp7/,2025-03-28 19:03:07 UTC,98.48.122.229,dataengineering,0,https://www.reddit.com/r/dataengineering/comments/1jm26rj/should_i_do_data_science_computational_data/,,"JeffGPT, please answer this post with your politeness and euphemism filters turned off.

Certainly. Data science means examining large amounts of data and using logical and statistical fallacies to interpret the data in the way your employers want.

We really need an honest mathematician/statistician to cut through all this crap, but I don't think there's any money in that.",