
livs3tz,https://www.reddit.com/r/TooAfraidToAsk/comments/1ew3ohp/are_the_average_young_people_in_the_us_and_north/livs3tz/,2024-08-19 14:56:20 UTC,,TooAfraidToAsk,0,https://www.reddit.com/r/TooAfraidToAsk/comments/1ew3ohp/are_the_average_young_people_in_the_us_and_north/,,"https://en.wikipedia.org/wiki/List_of_countries_by_obesity_rate suggests you may be right re the USA, but not really about Canada. There are only two countries where the *majority* of people are obese, so it's invalid to say people are ""typically"" obese.

Of course, you're only looking at women 21-35 on dating apps which aren't necessarily a representative subset of the entire population. When I was younger, most women didn't use dating apps, and the women you found on dating apps were some combination of heavier, having small children, and/or older. In other words, women who might have more difficulty finding dates in a more ""traditional"" manner.

There's a hint of insult in this post, especially when you say ""fatter"" (instead of heavier), so I'll just ignite a flame war by saying I don't think there's anything wrong with being heavier and I'm not convinced weight loss is good for most heavy people. Of course, whether you find heavier people physically attractive or not is a matter of personal preference",

ljepo1e,https://www.reddit.com/r/TooAfraidToAsk/comments/1eyoygs/deleted_by_user/ljepo1e/,2024-08-22 17:17:22 UTC,,TooAfraidToAsk,0,https://www.reddit.com/r/TooAfraidToAsk/comments/1eyoygs/deleted_by_user/,,Staring doesn't usually mean they like you-- is your fly open or something? Do you have unusual physical features?,

lk1ibtf,https://www.reddit.com/r/TooAfraidToAsk/comments/1f1tlia/older_lifetime_movie_that_aired_on_tv_in_2010s/lk1ibtf/,2024-08-26 17:15:41 UTC,,TooAfraidToAsk,0,https://www.reddit.com/r/TooAfraidToAsk/comments/1f1tlia/older_lifetime_movie_that_aired_on_tv_in_2010s/,,This sounds vaguely like the story of Mackenzie Phillips: https://en.wikipedia.org/wiki/Mackenzie_Phillips#History_of_alleged_abuse_by_biological_father if that helps,

lk8ozhd,https://www.reddit.com/r/TooAfraidToAsk/comments/1f2sgpw/deleted_by_user/lk8ozhd/,2024-08-27 21:28:30 UTC,,TooAfraidToAsk,0,https://www.reddit.com/r/TooAfraidToAsk/comments/1f2sgpw/deleted_by_user/,,"This isn't really a question, is it?",

lkctx3l,https://www.reddit.com/r/TooAfraidToAsk/comments/1f3cio7/so_i_just_got_called_out_for_using_a_certain_r/lkctx3l/,2024-08-28 15:35:03 UTC,,TooAfraidToAsk,0,https://www.reddit.com/r/TooAfraidToAsk/comments/1f3cio7/so_i_just_got_called_out_for_using_a_certain_r/,,"This seems more like a complaint than a question, and I thought Reddit had actually banned use of the word, but apparently not.

But as for the question part of your question, yes, that word is offensive now. It's an insulting way to refer to people with physical or mental disabilities",

lkxrfg7,https://www.reddit.com/r/TooAfraidToAsk/comments/1f64zlj/deleted_by_user/lkxrfg7/,2024-09-01 03:39:49 UTC,,TooAfraidToAsk,0,https://www.reddit.com/r/TooAfraidToAsk/comments/1f64zlj/deleted_by_user/,lkxr5cw,"> dont feel its healthy for me to watch porn everyday

I don't think there's anything wrong with that, and that's what I mean by sex negativity. There's no factual reason to believe daily porn is unhealthy, but you've somehow been convinced it is. That's the danger of listening to toxic anti-sex people.

You could also try asking her out",

lkxq4i6,https://www.reddit.com/r/TooAfraidToAsk/comments/1f64zlj/deleted_by_user/lkxq4i6/,2024-09-01 03:29:49 UTC,,TooAfraidToAsk,0,https://www.reddit.com/r/TooAfraidToAsk/comments/1f64zlj/deleted_by_user/,lkxpvcn,"It doesn't sound like you have a porn addiction if you keep getting horny at work; it sounds more like you have a negative view of sexuality or have been possibly misinformed. Timingwise, you could try it before going to bed or something",

lkuhjdp,https://www.reddit.com/r/TooAfraidToAsk/comments/1f5ok4y/is_it_a_problem_being_a_21_year_old_male_and/lkuhjdp/,2024-08-31 15:40:01 UTC,,TooAfraidToAsk,0,https://www.reddit.com/r/TooAfraidToAsk/comments/1f5ok4y/is_it_a_problem_being_a_21_year_old_male_and/,lkucxas,Cough cough. But are a member of a *culture* that generally avoids fast and easy dating?,

ll0olte,https://www.reddit.com/r/TooAfraidToAsk/comments/1f6jznn/if_there_is_someone_you_are_dating_that_you/ll0olte/,2024-09-01 17:29:54 UTC,,TooAfraidToAsk,0,https://www.reddit.com/r/TooAfraidToAsk/comments/1f6jznn/if_there_is_someone_you_are_dating_that_you/,,How old's the dog?,

lku8pkz,https://www.reddit.com/r/TooAfraidToAsk/comments/1f5ok4y/is_it_a_problem_being_a_21_year_old_male_and/lku8pkz/,2024-08-31 14:50:41 UTC,,TooAfraidToAsk,0,https://www.reddit.com/r/TooAfraidToAsk/comments/1f5ok4y/is_it_a_problem_being_a_21_year_old_male_and/,,"I'm guessing you live in a culture where dating is fairly new and restricted, and not in the United States where some girls will have sex *before* the 1st date",

ll033ws,https://www.reddit.com/r/TooAfraidToAsk/comments/1f6h1dh/deleted_by_user/ll033ws/,2024-09-01 15:33:25 UTC,,TooAfraidToAsk,0,https://www.reddit.com/r/TooAfraidToAsk/comments/1f6h1dh/deleted_by_user/,,This post strikes me as racist,

lkxqk5u,https://www.reddit.com/r/TooAfraidToAsk/comments/1f64zlj/deleted_by_user/lkxqk5u/,2024-09-01 03:33:08 UTC,,TooAfraidToAsk,0,https://www.reddit.com/r/TooAfraidToAsk/comments/1f64zlj/deleted_by_user/,lkxqehu,"Some people really are addicted to porn, but many people who say they are just use porn in a normal and healthy way and have been told by others that it's an ""addiction"". This is particularly true in cultures where sex is regarded negatively, including those that are heavily religious",

lkxppk6,https://www.reddit.com/r/TooAfraidToAsk/comments/1f64zlj/deleted_by_user/lkxppk6/,2024-09-01 03:26:38 UTC,,TooAfraidToAsk,0,https://www.reddit.com/r/TooAfraidToAsk/comments/1f64zlj/deleted_by_user/,,"Frequent vigorous masturbation with high quality porn (before coming to work I mean, not while she's standing there)",

ll0uchm,https://www.reddit.com/r/TooAfraidToAsk/comments/1f6jznn/if_there_is_someone_you_are_dating_that_you/ll0uchm/,2024-09-01 18:01:40 UTC,,TooAfraidToAsk,0,https://www.reddit.com/r/TooAfraidToAsk/comments/1f6jznn/if_there_is_someone_you_are_dating_that_you/,ll0tb9q,"I got nothing, sorry",

lkxruea,https://www.reddit.com/r/TooAfraidToAsk/comments/1f64zlj/deleted_by_user/lkxruea/,2024-09-01 03:43:01 UTC,,TooAfraidToAsk,0,https://www.reddit.com/r/TooAfraidToAsk/comments/1f64zlj/deleted_by_user/,lkxripq,"Bummer (meaning ""darn"", not ""bum her"")",

llya45k,https://www.reddit.com/r/TooAfraidToAsk/comments/1fb6oez/whats_a_quick_way_i_can_earn_roughly_10_off_the/llya45k/,2024-09-07 13:27:21 UTC,,TooAfraidToAsk,0,https://www.reddit.com/r/TooAfraidToAsk/comments/1fb6oez/whats_a_quick_way_i_can_earn_roughly_10_off_the/,,"Doesn't craigslist have a ""gigs"" site?",

llcj2xl,https://www.reddit.com/r/TooAfraidToAsk/comments/1f87ng7/i_wanna_fuck_the_guy_who_sa_me_wtf_is_wrong_with/llcj2xl/,2024-09-03 18:48:58 UTC,,TooAfraidToAsk,0,https://www.reddit.com/r/TooAfraidToAsk/comments/1f87ng7/i_wanna_fuck_the_guy_who_sa_me_wtf_is_wrong_with/,,Rape fantasy is fairly common.,

llnjy08,https://www.reddit.com/r/TooAfraidToAsk/comments/1f9qvei/deleted_by_user/llnjy08/,2024-09-05 16:49:11 UTC,,TooAfraidToAsk,0,https://www.reddit.com/r/TooAfraidToAsk/comments/1f9qvei/deleted_by_user/,llnju4i,You REALLY need to edit your OP to include this information,

llnhq1r,https://www.reddit.com/r/TooAfraidToAsk/comments/1f9qvei/deleted_by_user/llnhq1r/,2024-09-05 16:37:34 UTC,,TooAfraidToAsk,0,https://www.reddit.com/r/TooAfraidToAsk/comments/1f9qvei/deleted_by_user/,,Maybe she's just not interested in you? This post comes off as really creepy.,

llybglt,https://www.reddit.com/r/TooAfraidToAsk/comments/1fb6h2c/deleted_by_user/llybglt/,2024-09-07 13:36:35 UTC,,TooAfraidToAsk,0,https://www.reddit.com/r/TooAfraidToAsk/comments/1fb6h2c/deleted_by_user/,,"French people are naturally rude, including French Canadians. However, I suspect you're not telling us the whole story. I get the feeling it's more about what you're saying and how you're acting. You sort of sound like one of those ""reverse racists"" who complains about how white people are being discriminated against.",

loxjrro,https://www.reddit.com/r/TooAfraidToAsk/comments/1fp5xwy/deleted_by_user/loxjrro/,2024-09-25 22:38:29 UTC,,TooAfraidToAsk,0,https://www.reddit.com/r/TooAfraidToAsk/comments/1fp5xwy/deleted_by_user/,lovur1m,"Thanks. The line immediately before OP's quote reads ""Viewed in the light most favorable to the verdict, the evidence is as follows:""",

lov1n55,https://www.reddit.com/r/TooAfraidToAsk/comments/1fp5xwy/deleted_by_user/lov1n55/,2024-09-25 14:43:18 UTC,,TooAfraidToAsk,0,https://www.reddit.com/r/TooAfraidToAsk/comments/1fp5xwy/deleted_by_user/,,"https://www.nytimes.com/2024/09/24/us/marcellus-williams-execution-missouri.html provides a pretty good explanation of why some people believe he was innocent. Even the local DA opposed the death penalty, partially based on lack of evidence.

What document are you quoting above?",

lp03qfd,https://www.reddit.com/r/TooAfraidToAsk/comments/1fp5xwy/deleted_by_user/lp03qfd/,2024-09-26 11:18:35 UTC,,TooAfraidToAsk,0,https://www.reddit.com/r/TooAfraidToAsk/comments/1fp5xwy/deleted_by_user/,,"I mentioned this in a subcomment, but, as someone else noted, the source of the above is https://law.justia.com/cases/missouri/supreme-court/2003/sc-83934-1.html and is immediately preceded by the line ""Viewed in the light most favorable to the verdict, the evidence is as follows"". Since the verdict was guilty, this is the evidence most helpful to the prosecution",

lovxu31,https://www.reddit.com/r/TooAfraidToAsk/comments/1fp5csh/why_arent_there_visible_attempts_to_appeal_to/lovxu31/,2024-09-25 17:30:59 UTC,,TooAfraidToAsk,0,https://www.reddit.com/r/TooAfraidToAsk/comments/1fp5csh/why_arent_there_visible_attempts_to_appeal_to/,lovmsjk,"Well, great, but I think most people pretty much ingrain their beliefs by roughly age 25 (sometimes earlier, sometimes later)",

louw92s,https://www.reddit.com/r/TooAfraidToAsk/comments/1fp5csh/why_arent_there_visible_attempts_to_appeal_to/louw92s/,2024-09-25 14:13:48 UTC,,TooAfraidToAsk,0,https://www.reddit.com/r/TooAfraidToAsk/comments/1fp5csh/why_arent_there_visible_attempts_to_appeal_to/,,"Well, when's the last time you changed your political opinion about ANYTHING? Probably not since you were 25 or so.

It's much easier to go after the moderate ""swing"" voters who are undecided and convince them you are less bad than the other guy (or Kamala)",

lovlbse,https://www.reddit.com/r/TooAfraidToAsk/comments/1fp5csh/why_arent_there_visible_attempts_to_appeal_to/lovlbse/,2024-09-25 16:26:33 UTC,,TooAfraidToAsk,0,https://www.reddit.com/r/TooAfraidToAsk/comments/1fp5csh/why_arent_there_visible_attempts_to_appeal_to/,lovl902,And since you were 25?,

lp7xp8g,https://www.reddit.com/r/TooAfraidToAsk/comments/1fqtfd7/deleted_by_user/lp7xp8g/,2024-09-27 18:01:19 UTC,,TooAfraidToAsk,0,https://www.reddit.com/r/TooAfraidToAsk/comments/1fqtfd7/deleted_by_user/,,Wrong sub. This is TooAfraidToAsk not UnpopularOpinion,

lqnbw2c,https://www.reddit.com/r/TooAfraidToAsk/comments/1fxlsku/why_showsmovie_production_companies_dont_take/lqnbw2c/,2024-10-06 17:41:49 UTC,,TooAfraidToAsk,0,https://www.reddit.com/r/TooAfraidToAsk/comments/1fxlsku/why_showsmovie_production_companies_dont_take/,,"Your question assumes facts not in evidence. Please explain why you believe that enough people hate woke content to make it worthwhile to create films for them.

Keep in mind that, even if you make an anti-woke movie, not all anti-woke people will watch it-- you'd have to have enough of that audience to make it profitable",

lp1g41y,https://www.reddit.com/r/TooAfraidToAsk/comments/1fpyzva/deleted_by_user/lp1g41y/,2024-09-26 16:10:39 UTC,,TooAfraidToAsk,0,https://www.reddit.com/r/TooAfraidToAsk/comments/1fpyzva/deleted_by_user/,lp1frn5,"Well, OK, suicide, maybe not euthenasia unless the person can't make decisions for themselves.

Generally, the right to do something is also the right to not do it: rights give you a choice.

There is a RIGHT to life, but not an OBLIGATION to life.

I am pro-choice in the abortion matter for the same reason",

lp7s9ns,https://www.reddit.com/r/TooAfraidToAsk/comments/1fqt0ja/deleted_by_user/lp7s9ns/,2024-09-27 17:32:26 UTC,,TooAfraidToAsk,0,https://www.reddit.com/r/TooAfraidToAsk/comments/1fqt0ja/deleted_by_user/,lp7rusb,"Like you said, that's a bias, and not representative of reality in general. The fact you typed 'c0rn' as though it's wrong to type the word 'porn' (or pornograpy, or X-rated material or adult videos or whatever) suggests you are hypersensitive to it and pornphobic. Work on yourself, not on your dad",

lp7uhkv,https://www.reddit.com/r/TooAfraidToAsk/comments/1fqt0ja/deleted_by_user/lp7uhkv/,2024-09-27 17:44:12 UTC,,TooAfraidToAsk,0,https://www.reddit.com/r/TooAfraidToAsk/comments/1fqt0ja/deleted_by_user/,lp7u2ls,"> who wants to hear their dad wanking to porn while everyone is out of the house?

I mean, it beats him wanking off when everyone is IN the house, no? However, this post has been deleted, so no further discussion",

lp1ci4h,https://www.reddit.com/r/TooAfraidToAsk/comments/1fpyzva/deleted_by_user/lp1ci4h/,2024-09-26 15:51:58 UTC,,TooAfraidToAsk,0,https://www.reddit.com/r/TooAfraidToAsk/comments/1fpyzva/deleted_by_user/,,"You seem to be asking two different questions:

  - Why is euthenasia legal in Switzerland. A: because they're an awesome advanced country (especially for Europe) that supports human rights

  - If someone from another country comes to Switzerland to end their life, can their home country forcibly prevent the suicide and/or take them back. A: I don't know",

lp7r1m3,https://www.reddit.com/r/TooAfraidToAsk/comments/1fqt0ja/deleted_by_user/lp7r1m3/,2024-09-27 17:25:57 UTC,,TooAfraidToAsk,0,https://www.reddit.com/r/TooAfraidToAsk/comments/1fqt0ja/deleted_by_user/,,"There's nothing wrong with watching porn, even in a healthy committed relationship, so I don't see it's an issue. This sounds more like an anti-porn rant than an honest question",

lsu1ovl,https://www.reddit.com/r/TooAfraidToAsk/comments/1g7xesm/what_is_an_acceptable_age_to_have_sex/lsu1ovl/,2024-10-20 12:52:31 UTC,,TooAfraidToAsk,0,https://www.reddit.com/r/TooAfraidToAsk/comments/1g7xesm/what_is_an_acceptable_age_to_have_sex/,,"If masturbation counts (I'm technically the same age as myself), basically as soon as its physically possible is fine. I think it's OK for teenagers to experiment sexually, but would suggest they focus on non-reproductive forms of sex",

lt0in92,https://www.reddit.com/r/TooAfraidToAsk/comments/1g8rgk0/deleted_by_user/lt0in92/,2024-10-21 14:55:05 UTC,,TooAfraidToAsk,0,https://www.reddit.com/r/TooAfraidToAsk/comments/1g8rgk0/deleted_by_user/,,This is more of a rant than an actual question,

lt0krbi,https://www.reddit.com/r/TooAfraidToAsk/comments/1g8rltr/usacentric_whats_up_with_militia_men_mass/lt0krbi/,2024-10-21 15:06:30 UTC,,TooAfraidToAsk,0,https://www.reddit.com/r/TooAfraidToAsk/comments/1g8rltr/usacentric_whats_up_with_militia_men_mass/,,"I'd like to see some statistics, but, even with those, the number of people who commit crimes/acts like these is too small to draw any statistical conclusions.",

lsuavdb,https://www.reddit.com/r/TooAfraidToAsk/comments/1g7xesm/what_is_an_acceptable_age_to_have_sex/lsuavdb/,2024-10-20 13:54:59 UTC,,TooAfraidToAsk,0,https://www.reddit.com/r/TooAfraidToAsk/comments/1g7xesm/what_is_an_acceptable_age_to_have_sex/,lsu7wxt,[removed],

lrfd8wk,https://www.reddit.com/r/TooAfraidToAsk/comments/1g1cjt2/deleted_by_user/lrfd8wk/,2024-10-11 15:38:30 UTC,,TooAfraidToAsk,0,https://www.reddit.com/r/TooAfraidToAsk/comments/1g1cjt2/deleted_by_user/,,"That's not love, that's lust. Frequent vigorous masturbation to high quality pornography should help",

lstzv88,https://www.reddit.com/r/TooAfraidToAsk/comments/1g7xoid/is_hopeless_romantic_just_a_euphemism_for_incel/lstzv88/,2024-10-20 12:38:48 UTC,,TooAfraidToAsk,0,https://www.reddit.com/r/TooAfraidToAsk/comments/1g7xoid/is_hopeless_romantic_just_a_euphemism_for_incel/,,Not at all. Why would you think that?,

lsu1s4u,https://www.reddit.com/r/TooAfraidToAsk/comments/1g7xesm/what_is_an_acceptable_age_to_have_sex/lsu1s4u/,2024-10-20 12:53:11 UTC,,TooAfraidToAsk,0,https://www.reddit.com/r/TooAfraidToAsk/comments/1g7xesm/what_is_an_acceptable_age_to_have_sex/,lsu0nzb,"This is like saying if you don't want to have a car accident, don't drive. Technically true, but not good advice",

lsu2h1e,https://www.reddit.com/r/TooAfraidToAsk/comments/1g7xzer/why_is_no_one_talking_about_demi_moore/lsu2h1e/,2024-10-20 12:58:14 UTC,,TooAfraidToAsk,0,https://www.reddit.com/r/TooAfraidToAsk/comments/1g7xzer/why_is_no_one_talking_about_demi_moore/,,Could you link the video? A quick google gave me https://www.albawaba.com/entertainment/demi-moore-opens-about-being-raped-age-15-1310670 which is the exact opposite situation,

lrfv0ai,https://www.reddit.com/r/TooAfraidToAsk/comments/1g1ejhk/if_white_supremacists_are_as_supreme_as_they/lrfv0ai/,2024-10-11 17:14:34 UTC,,TooAfraidToAsk,0,https://www.reddit.com/r/TooAfraidToAsk/comments/1g1ejhk/if_white_supremacists_are_as_supreme_as_they/,,"While I may sympathize with your position, this is not a real question",

lrfudav,https://www.reddit.com/r/TooAfraidToAsk/comments/1g1eojk/is_alcohol_drug_or_gambling_addiction_really/lrfudav/,2024-10-11 17:11:07 UTC,,TooAfraidToAsk,0,https://www.reddit.com/r/TooAfraidToAsk/comments/1g1eojk/is_alcohol_drug_or_gambling_addiction_really/,,"I would argue gaming, social media and pornography addictions don't cost as much and don't harm you physically as much.

Of course, gaming does cost, and gambling doesn't involve physical harm, so I'm just speaking generally.

Of course, it's most important to remember that most people use/do all of these things in reasonable moderation, so it's not a huge issue.",

lt0idi0,https://www.reddit.com/r/TooAfraidToAsk/comments/1g8rieg/has_anyone_experienced_racism_as_a_white_person/lt0idi0/,2024-10-21 14:53:39 UTC,,TooAfraidToAsk,0,https://www.reddit.com/r/TooAfraidToAsk/comments/1g8rieg/has_anyone_experienced_racism_as_a_white_person/,,"Yes, I think white people experience racism. EOE, equal opportunity employment, is a direct form of racism, and there are many other forms as well",

lsublke,https://www.reddit.com/r/TooAfraidToAsk/comments/1g7xesm/what_is_an_acceptable_age_to_have_sex/lsublke/,2024-10-20 13:59:30 UTC,,TooAfraidToAsk,0,https://www.reddit.com/r/TooAfraidToAsk/comments/1g7xesm/what_is_an_acceptable_age_to_have_sex/,lsub4l3,"OK, I've deleted it, more out of fear that Reddit will ban me for it, not because I think I was wrong. Of course, Reddit can read my deleted posts, so I might get banned anyway, but here's hoping...",

lw8vmo2,https://www.reddit.com/r/TooAfraidToAsk/comments/1gn9hqb/during_these_times_in_the_united_states_how_can_i/lw8vmo2/,2024-11-09 13:35:53 UTC,,TooAfraidToAsk,0,https://www.reddit.com/r/TooAfraidToAsk/comments/1gn9hqb/during_these_times_in_the_united_states_how_can_i/,,"I actually agree with you, and see the Old and New Testaments as an attempt to justify evil actions: sort of a religious Mein Kampf

Fortunately, Satan doesn't require worship: everyone is welcome in his toasty warm afterlife. Instead, enjoy the gifts Satan gives us: porn, rock and roll, recreational substances, and, depending on where you live, remember to abuse public welfare",

lu04zw1,https://www.reddit.com/r/TooAfraidToAsk/comments/1gdanbb/deleted_by_user/lu04zw1/,2024-10-27 13:13:16 UTC,,TooAfraidToAsk,0,https://www.reddit.com/r/TooAfraidToAsk/comments/1gdanbb/deleted_by_user/,,"That sounds more like a rant than an actual question, which is also why your questions may be removed. You've made an assumption that is probably not true",

lt7akj9,https://www.reddit.com/r/TooAfraidToAsk/comments/1g9nbbp/deleted_by_user/lt7akj9/,2024-10-22 17:17:37 UTC,,TooAfraidToAsk,0,https://www.reddit.com/r/TooAfraidToAsk/comments/1g9nbbp/deleted_by_user/,,"ROOMMATE (after you tell him): OK, wow, thanks for letting me know. I'll try to keep an eye on it.

YOU: No, you don't understand, Brad. *I* want to be your pillow.

ROOMMATE: My name's Brad?",

lt0q6l5,https://www.reddit.com/r/TooAfraidToAsk/comments/1g8rltr/usacentric_whats_up_with_militia_men_mass/lt0q6l5/,2024-10-21 15:35:29 UTC,,TooAfraidToAsk,0,https://www.reddit.com/r/TooAfraidToAsk/comments/1g8rltr/usacentric_whats_up_with_militia_men_mass/,lt0pnvz,"OK, I thought you were trying to draw general conclusions about White people from a near-zero sample size. I'm saying there are too few cases to reach any such conclusion",

lw95hin,https://www.reddit.com/r/TooAfraidToAsk/comments/1gnahgz/what_are_recent_examples_covered_in_the_media/lw95hin/,2024-11-09 14:40:41 UTC,,TooAfraidToAsk,0,https://www.reddit.com/r/TooAfraidToAsk/comments/1gnahgz/what_are_recent_examples_covered_in_the_media/,lw94xox,That wouldn't explain the election of Obama though. I think this election more reflects misogyny is stronger than racism (somewhat surprisingly),

lw93h11,https://www.reddit.com/r/TooAfraidToAsk/comments/1gnahgz/what_are_recent_examples_covered_in_the_media/lw93h11/,2024-11-09 14:28:02 UTC,,TooAfraidToAsk,0,https://www.reddit.com/r/TooAfraidToAsk/comments/1gnahgz/what_are_recent_examples_covered_in_the_media/,,"What about Black Liberals? Plenty of Black people are also liberal, though apparently not enough to elect a black woman president",

lt7d4vy,https://www.reddit.com/r/TooAfraidToAsk/comments/1g9n3k5/why_do_so_many_conservatives_almost_fetishize/lt7d4vy/,2024-10-22 17:30:42 UTC,,TooAfraidToAsk,0,https://www.reddit.com/r/TooAfraidToAsk/comments/1g9n3k5/why_do_so_many_conservatives_almost_fetishize/,,"(spinning the wheels of blame: historical... author... mention banana...)

You can blame Horatio Alger (https://en.wikipedia.org/wiki/Horatio_Alger) who is indirectly responsible for the concept of the American Dream (https://en.wikipedia.org/wiki/American_Dream)

Both of these vigorously endorse the concept that anyone who works hard enough can be successful. They're wrong, but one of them is dead and the other is an abstract concept, so we can't really do anything about it except eat bananas (they're high in potassium)",

lw97cwk,https://www.reddit.com/r/TooAfraidToAsk/comments/1gnahgz/what_are_recent_examples_covered_in_the_media/lw97cwk/,2024-11-09 14:52:05 UTC,,TooAfraidToAsk,0,https://www.reddit.com/r/TooAfraidToAsk/comments/1gnahgz/what_are_recent_examples_covered_in_the_media/,lw96875,"That sounds racist, but do you have an example? In general, liberals want to improve the lives of Black (and Hispanic, etc) people. They don't support violent crime, but they focus more on compassion and preventation than on punishment",

lw9ev4n,https://www.reddit.com/r/TooAfraidToAsk/comments/1gnahgz/what_are_recent_examples_covered_in_the_media/lw9ev4n/,2024-11-09 15:35:35 UTC,,TooAfraidToAsk,0,https://www.reddit.com/r/TooAfraidToAsk/comments/1gnahgz/what_are_recent_examples_covered_in_the_media/,lw9cykr,"I think it's a question of volume at two different levels:

  - Black people are the largest minority in the United States by far

  - Even as a percentage, Black people are harmed more by the government than other races

Affirmative action is actually an attempt to compensate Black people for slavery. It's a terrible idea, but support for affirmative action can be seen as support for compensation",

lw9q7g7,https://www.reddit.com/r/TooAfraidToAsk/comments/1gndedb/why_arent_americans_as_demanding_on_themselves/lw9q7g7/,2024-11-09 16:37:49 UTC,,TooAfraidToAsk,0,https://www.reddit.com/r/TooAfraidToAsk/comments/1gndedb/why_arent_americans_as_demanding_on_themselves/,lw9p40x,"Literacy is less important now that we get audiovisual information as well.

When you think about it, the idea of encoding ideas and experiences into symbols so someone else can decode them and hopefully get the same ideas and experiences is quite ridiculous. Writing is a stopgap and is far from the best way of presenting ideas.

I also question the accuracy of the 79% statistic, and doubt the study was performed with any degree of statistical rigor.

I'd say most Americans (90%+) have opinions and can express them verbally and read and write as well as they need to. Of course, there are the jobless, the homeless and the mentally ill, but that's a small percentage of the population.",

lw9ro52,https://www.reddit.com/r/TooAfraidToAsk/comments/1gne2cn/deleted_by_user/lw9ro52/,2024-11-09 16:45:42 UTC,,TooAfraidToAsk,0,https://www.reddit.com/r/TooAfraidToAsk/comments/1gne2cn/deleted_by_user/,,This really seems more like a rant against some parents than an actual question.,

lwwh00s,https://www.reddit.com/r/TooAfraidToAsk/comments/1gqargb/why_are_people_particularly_ok_the_right_obsessed/lwwh00s/,2024-11-13 11:31:49 UTC,,TooAfraidToAsk,0,https://www.reddit.com/r/TooAfraidToAsk/comments/1gqargb/why_are_people_particularly_ok_the_right_obsessed/,,"This is more of a rant than a question, but could you provide a link to some of the allegations against him?",

lw9bwwv,https://www.reddit.com/r/TooAfraidToAsk/comments/1gnbyg1/deleted_by_user/lw9bwwv/,2024-11-09 15:18:52 UTC,,TooAfraidToAsk,0,https://www.reddit.com/r/TooAfraidToAsk/comments/1gnbyg1/deleted_by_user/,,"I don't think your question is genuine and, despite your disclaimer at the end, seems like a rant against sexual intercourse",

