
krnsxzv,https://www.reddit.com/r/learnprogramming/comments/1axgk9i/deleted_by_user/krnsxzv/,2024-02-22 20:38:26 UTC,,learnprogramming,0,https://www.reddit.com/r/learnprogramming/comments/1axgk9i/deleted_by_user/,,Are you affiliated with this site? It appears to be non-free,

kqp4jgb,https://www.reddit.com/r/learnprogramming/comments/1asakkv/how_do_i_make_my_code_faster/kqp4jgb/,2024-02-16 15:31:52 UTC,,learnprogramming,0,https://www.reddit.com/r/learnprogramming/comments/1asakkv/how_do_i_make_my_code_faster/,,Your solution is better than what mine would've been: merge sort the arrays and find the median.,

kqp60lh,https://www.reddit.com/r/learnprogramming/comments/1asakkv/how_do_i_make_my_code_faster/kqp60lh/,2024-02-16 15:40:30 UTC,,learnprogramming,0,https://www.reddit.com/r/learnprogramming/comments/1asakkv/how_do_i_make_my_code_faster/,kqp5vuw,I know. That's why I said OP's solution (which also doesn't meet the complexity restriction) is better,

krm9y2r,https://www.reddit.com/r/learnprogramming/comments/1ax8qw6/deleted_by_user/krm9y2r/,2024-02-22 15:28:55 UTC,,learnprogramming,0,https://www.reddit.com/r/learnprogramming/comments/1ax8qw6/deleted_by_user/,,Can we see your code? Perhaps on https://repl.it or something so we can play with it?,

krlwhk9,https://www.reddit.com/r/learnprogramming/comments/1ax6sk9/ageism_as_a_problem_in_the_career/krlwhk9/,2024-02-22 14:04:25 UTC,,learnprogramming,0,https://www.reddit.com/r/learnprogramming/comments/1ax6sk9/ageism_as_a_problem_in_the_career/,,"I don't have an answer to your question, but keep in mind that ""decades of experience"" isn't always a good thing in a fast moving industry like ours.",

ksuh72p,https://www.reddit.com/r/learnprogramming/comments/1b3sy8u/is_personalization_the_future_of_learning/ksuh72p/,2024-03-01 13:10:00 UTC,,learnprogramming,0,https://www.reddit.com/r/learnprogramming/comments/1b3sy8u/is_personalization_the_future_of_learning/,,"This reads a bit like an advertisement, but I'm nonetheless curious.",

ktn5l3s,https://www.reddit.com/r/learnprogramming/comments/1b85tej/finding_the_sum_of_all_the_adjacent_elements_in/ktn5l3s/,2024-03-06 18:14:44 UTC,,learnprogramming,0,https://www.reddit.com/r/learnprogramming/comments/1b85tej/finding_the_sum_of_all_the_adjacent_elements_in/,,"Suggestion: post the code to repl.it or similar so we can help more. Also, try to construct a minimal example that fails -- for example, try using a fixed array (that fails) instead of reading an array from the standard input (unless that's what's causing the failure)",

kw1rfan,https://www.reddit.com/r/learnprogramming/comments/1bkzzbt/javascript_object_question/kw1rfan/,2024-03-22 14:17:00 UTC,,learnprogramming,0,https://www.reddit.com/r/learnprogramming/comments/1bkzzbt/javascript_object_question/,,"Objects can have multiple properties pointing to the same value:

```
js> ordered = {1234: 'big box', 5678: 'big box'};
({1234:""big box"", 5678:""big box""})
js> ordered[1234]
""big box""
js> ordered[5678]
""big box""
```

The trickier question (which you did not ask) is can a given key (property) have multiple values. The answer there is also yes, but it requires a little more work, especially if you want to be efficient",

kvgjvj3,https://www.reddit.com/r/learnprogramming/comments/1bhx6pz/whatre_people_using_these_days_to_add_comments_to/kvgjvj3/,2024-03-18 18:05:42 UTC,,learnprogramming,0,https://www.reddit.com/r/learnprogramming/comments/1bhx6pz/whatre_people_using_these_days_to_add_comments_to/,,"Pedantic correction: disqus.com not ""Discuss""",

kvgg5ep,https://www.reddit.com/r/learnprogramming/comments/1bhwhdy/deleted_by_user/kvgg5ep/,2024-03-18 17:44:57 UTC,,learnprogramming,0,https://www.reddit.com/r/learnprogramming/comments/1bhwhdy/deleted_by_user/,,"Inside the while loop, does the user get to input new guesses or do you change the random number? The way you have it now, the loop checks for equality for two fixed numbers that never change.",

kvwoq8s,https://www.reddit.com/r/learnprogramming/comments/1bjy84n/counting_leap_years/kvwoq8s/,2024-03-21 16:17:51 UTC,,learnprogramming,0,https://www.reddit.com/r/learnprogramming/comments/1bjy84n/counting_leap_years/,,"This doesn't answer your question, but you can use the floor() function to compute something like this without looping. For example, the number of leap days since the Gregorian Reformation in October 1582 (https://en.wikipedia.org/wiki/Gregorian_calendar) through the end of year `y` is, in Mathics form, something like:

`f[y_] = Floor[(y-1580)/4] - Floor[(y-1600)/100] + Floor[(y-1600)/400]`

(you need the 1600 so the numbers line up correctly)

Note that observation of leap years prior to 1582 was a bit spotty, depending on how you define leap year. Quoting https://en.wikipedia.org/wiki/February_29

> The convention of using February 29 was not widely accepted before the 15th century; from Julian's edict until the 16th century (formally), February 24 was doubled instead.[2]",

kuujm2u,https://www.reddit.com/r/learnprogramming/comments/1bensil/one_law_to_rule_them_all_how_using_law_of_demeter/kuujm2u/,2024-03-14 15:35:20 UTC,,learnprogramming,0,https://www.reddit.com/r/learnprogramming/comments/1bensil/one_law_to_rule_them_all_how_using_law_of_demeter/,kuui5wy,"I've also noticed a lot of ""link only"" (or almost ""link only"") posts and have been disappointed, since it makes more sense to post the content directly here so it can be discussed here.

However, rule 8, ""no indirect links"", seems to allow it, though I suppose it could be reported under rule 2 ""No spam or tasteless self-promotion""",

kvl69hv,https://www.reddit.com/r/learnprogramming/comments/1bilfyn/deleted_by_user/kvl69hv/,2024-03-19 15:07:33 UTC,,learnprogramming,0,https://www.reddit.com/r/learnprogramming/comments/1bilfyn/deleted_by_user/,,"This isn't bad, so my suggestions are only minor ones:

```
    my $pid = $row->[0]; # PID as key
    my $company = $row->[1]; # Company name as key
    my $last_name = $row->[2]; # Employee last name
    my $first_name = $row->[3]; # Employee first name
```

It's not trivial in your case, but consider `my($pid, $company, $last_name, $first_name)` since you're really just deconstructing an array

`    push @{$data_hash{$company}}, [$pid, $last_name, $first_name]; `

Consider `$data_hash{$company}{'pid'}` instead of storing the pid and names as an array",

kvlam41,https://www.reddit.com/r/learnprogramming/comments/1bik9ti/display_highest_and_lowest_numbers_from_batch_csv/kvlam41/,2024-03-19 15:32:49 UTC,,learnprogramming,0,https://www.reddit.com/r/learnprogramming/comments/1bik9ti/display_highest_and_lowest_numbers_from_batch_csv/,,Can we see your code?,

kuukmks,https://www.reddit.com/r/learnprogramming/comments/1benk40/need_with_a_travel_problem/kuukmks/,2024-03-14 15:41:01 UTC,,learnprogramming,0,https://www.reddit.com/r/learnprogramming/comments/1benk40/need_with_a_travel_problem/,,"Yes, this is pretty much TSP: https://en.wikipedia.org/wiki/Travelling_salesman_problem

Most programming languages will have libraries that can solve the problem somewhat efficiently, but, since it is an NP hard problem, there are no fast perfect solutions",

ktnj9ij,https://www.reddit.com/r/learnprogramming/comments/1b88luv/please_help/ktnj9ij/,2024-03-06 19:28:23 UTC,,learnprogramming,0,https://www.reddit.com/r/learnprogramming/comments/1b88luv/please_help/,,"I mean, if you know how many minutes are in an hour and how many hours are in a day, you can just multiply. The only tricky one is days in a year, since that varies based on leap year, but you can surely find a reasonable value (I use 365.2425 myself which is the average for a Gregorian calendar year, including leap years)",

l117o1z,https://www.reddit.com/r/learnprogramming/comments/1cbw5yc/deleted_by_user/l117o1z/,2024-04-24 12:13:00 UTC,,learnprogramming,0,https://www.reddit.com/r/learnprogramming/comments/1cbw5yc/deleted_by_user/,,Look into https://leafletjs.com/index.html though I don't think it does 100% of what you need,

l40ubuz,https://www.reddit.com/r/learnprogramming/comments/1crw704/good_idea_or_nah/l40ubuz/,2024-05-14 16:30:50 UTC,,learnprogramming,0,https://www.reddit.com/r/learnprogramming/comments/1crw704/good_idea_or_nah/,,"As the original acronym sort of implies (BASIC = Beginners' All-purpose Symbolic Instruction Code) (https://en.wikipedia.org/wiki/BASIC) was originally designed to do that, but then people started using it to write serious code.

You might look into something like a Turing machine emulator (which may be TOO bare bones) or work with psuedocode, but I think BASIC kind of does what you want",

l45eb2j,https://www.reddit.com/r/learnprogramming/comments/1csjd0t/mysql_server_help_beginner/l45eb2j/,2024-05-15 12:53:07 UTC,,learnprogramming,0,https://www.reddit.com/r/learnprogramming/comments/1csjd0t/mysql_server_help_beginner/,l45e3nb,"No, \`CREATE USER\` is the command you'd use to create a user. Example: \`CREATE USER loyoung IDENTIFIED BY PASSWORD 'foo'\`. However, that's off the top of my head, so please doublecheck the syntax. I use MySQL from the command line, so I may not be able to help more with workbench, sorry",

l45c0jr,https://www.reddit.com/r/learnprogramming/comments/1csjd0t/mysql_server_help_beginner/l45c0jr/,2024-05-15 12:36:38 UTC,,learnprogramming,0,https://www.reddit.com/r/learnprogramming/comments/1csjd0t/mysql_server_help_beginner/,,"General advice: avoid logging into MySQL (or anything else) as user ""root"". Some applications prohibit it entirely. I'm not sure MySQL does, but use an unprivileged user to access the MySQL server",

l45dney,https://www.reddit.com/r/learnprogramming/comments/1csjd0t/mysql_server_help_beginner/l45dney/,2024-05-15 12:48:27 UTC,,learnprogramming,0,https://www.reddit.com/r/learnprogramming/comments/1csjd0t/mysql_server_help_beginner/,l45cqrc,"Did you user `CREATE USER` in MySQL to make sure the MySQL user exists, and `GRANT` to make sure it has access to the right databases?",

l5vndau,https://www.reddit.com/r/learnprogramming/comments/1d1r1oy/free_live_consultation_for_aspiring_programmers/l5vndau/,2024-05-27 13:16:48 UTC,,learnprogramming,0,https://www.reddit.com/r/learnprogramming/comments/1d1r1oy/free_live_consultation_for_aspiring_programmers/,,"This seems a bit spammy, but what are your qualifications?",

l6mmc8l,https://www.reddit.com/r/learnprogramming/comments/1d5n3qo/what_programming_challenge_have_you_given_up_on/l6mmc8l/,2024-06-01 14:17:08 UTC,,learnprogramming,0,https://www.reddit.com/r/learnprogramming/comments/1d5n3qo/what_programming_challenge_have_you_given_up_on/,,"I've given up on a lot of challenges. At one point, I wanted to create a realistic model of our galaxy using GAIA data, but there's just too much of it (~3 billion stars) and the data is too inaccurate to be useful.

I've instead decided to use a smaller database of stars, but haven't gotten around to that either, but that part's just laziness not giving up",

l7t8imf,https://www.reddit.com/r/learnprogramming/comments/1dbt20s/deleted_by_user/l7t8imf/,2024-06-09 13:25:21 UTC,,learnprogramming,0,https://www.reddit.com/r/learnprogramming/comments/1dbt20s/deleted_by_user/,,"> Unfortunately I deleted my last query attempt so don't have a WIP to show

Please re-create it and show us your efforts. We're here to help, but you should show you've done some work on your own. Also, avoid deleting mistakes. Mark them as being wrong, but you can often learn from them",

l7czmhq,https://www.reddit.com/r/learnprogramming/comments/1d9f5fj/irl_tutorials_of_functional_programming/l7czmhq/,2024-06-06 12:05:26 UTC,,learnprogramming,0,https://www.reddit.com/r/learnprogramming/comments/1d9f5fj/irl_tutorials_of_functional_programming/,,"Try googling ""programming for engineers"" (no quotes). Courses for engineers tend to focus on more practical applications. Also consider learning procedural programming (instead of functional) as procedural is more concrete and less abstract",

l7o435j,https://www.reddit.com/r/learnprogramming/comments/1db27f2/how_to_highlight_numerical_values_that_are_or_on/l7o435j/,2024-06-08 12:51:56 UTC,,learnprogramming,0,https://www.reddit.com/r/learnprogramming/comments/1db27f2/how_to_highlight_numerical_values_that_are_or_on/,,Are you familiar with greasemonkey?,

l8fdw9a,https://www.reddit.com/r/learnprogramming/comments/1dezgmj/how_to_digest_messy_code_with_no_comments/l8fdw9a/,2024-06-13 14:04:15 UTC,,learnprogramming,0,https://www.reddit.com/r/learnprogramming/comments/1dezgmj/how_to_digest_messy_code_with_no_comments/,,I generally add a lot of print statements (or the code inside a debugger or tracer) too see what's going on.,

l87d8mf,https://www.reddit.com/r/learnprogramming/comments/1ddn7yh/approximation_of_the_integral_of_a_function_in_c/l87d8mf/,2024-06-12 01:10:58 UTC,,learnprogramming,0,https://www.reddit.com/r/learnprogramming/comments/1ddn7yh/approximation_of_the_integral_of_a_function_in_c/,,Are you affiliated with this code?,

l95odms,https://www.reddit.com/r/learnprogramming/comments/1dir814/i_want_to_learn_to_code_is_my_project_idea_too/l95odms/,2024-06-18 14:17:00 UTC,,learnprogramming,0,https://www.reddit.com/r/learnprogramming/comments/1dir814/i_want_to_learn_to_code_is_my_project_idea_too/,,I assume you're familiar with angieslist.com?,

l95qntf,https://www.reddit.com/r/learnprogramming/comments/1dir814/i_want_to_learn_to_code_is_my_project_idea_too/l95qntf/,2024-06-18 14:30:49 UTC,,learnprogramming,0,https://www.reddit.com/r/learnprogramming/comments/1dir814/i_want_to_learn_to_code_is_my_project_idea_too/,l95pq1s,"homeadvisor.com is another one, but I get it now. You're looking to compete with these services. Unless you have a large bankroll, it's going to be difficult: coding will be the easy part",

l96py2i,https://www.reddit.com/r/learnprogramming/comments/1diu1qw/random_numbers_and_distributions/l96py2i/,2024-06-18 17:47:33 UTC,,learnprogramming,0,https://www.reddit.com/r/learnprogramming/comments/1diu1qw/random_numbers_and_distributions/,l96o2u9,"Based on OP's other comments, I think they're creating a color key",

l96eynt,https://www.reddit.com/r/learnprogramming/comments/1diu1qw/random_numbers_and_distributions/l96eynt/,2024-06-18 16:47:21 UTC,,learnprogramming,0,https://www.reddit.com/r/learnprogramming/comments/1diu1qw/random_numbers_and_distributions/,,"I mean, sort them, take the 51st percentile and assign everything less to red, take the (51+48.5) percentile and assign everything between 51 and 51+48.5 to blue and the rest to green. Of course, since your list has a finite number of values, you'll have to round off, and won't have any green (unless you choose special rounding rules)",

la15sa0,https://www.reddit.com/r/learnprogramming/comments/1dna1v1/guys_i_feel_lost/la15sa0/,2024-06-24 10:55:45 UTC,,learnprogramming,0,https://www.reddit.com/r/learnprogramming/comments/1dna1v1/guys_i_feel_lost/,,"> 34 out of 50 restaurateurs to whom I sent the presentation responded and would be happy to try the software

How much would they be willing to pay for the software (or use of the software) is the real question.

68% is a remarkable response rate from ""cold calling"", so I'm wondering if they're just willing to beta test and/or are saying they expect to use it for free since they're presumably doing a favor for you.

If you can get a reasonably solid commitment from even 34 restaurants, it'll probably be faster to find someone else to develop the backend, either via partnership or direct payment

I hate to be one of those people, but selling your app is WAY more important than developing it.",

latt2q5,https://www.reddit.com/r/learnprogramming/comments/1dracn8/where_to_find_programming_friends/latt2q5/,2024-06-29 13:09:55 UTC,,learnprogramming,0,https://www.reddit.com/r/learnprogramming/comments/1dracn8/where_to_find_programming_friends/,,I've recently taken up Julia because I don't want any friends :),

lao9egg,https://www.reddit.com/r/learnprogramming/comments/1dqhrx7/please_help_me_troubleshoot_why_google_rejects_my/lao9egg/,2024-06-28 12:58:32 UTC,,learnprogramming,0,https://www.reddit.com/r/learnprogramming/comments/1dqhrx7/please_help_me_troubleshoot_why_google_rejects_my/,lao9253,"https://support.google.com/a/answer/14114704 states ""You will no longer use a password for access (with the exception of app passwords)."", suggesting that if you have a specific password for an app that's not your general password, it may continue to work",

lai6tff,https://www.reddit.com/r/learnprogramming/comments/1dpnasw/a_question_about_base64/lai6tff/,2024-06-27 11:10:05 UTC,,learnprogramming,0,https://www.reddit.com/r/learnprogramming/comments/1dpnasw/a_question_about_base64/,,"The word ""binary"" is being used differently here. The ASCII table (https://www.lookuptables.com/text/ascii-table) encodes upper and lower letters, numbers, symbols, and a few ""control codes"" (the first 32 entries). It uses up 128 entries total, or 7 bits. If you use only these bytes, you are in ""ASCII mode"". If you use any characters outside of these, you are in ""binary mode"".

Even today, some languages, some programs and some operating systems distinguish between the two modes. Example: https://diveintopython.org/learn/file-handling/binary-files

In particular, some SMTP servers don't handle binary data well, so you have to encode (not encrypt) your message into ASCII. Base64 (aka MIME-64) is actually a pretty efficient system, using 8 bits to store 6 bits of data. I'm old enough to remember uuencode (https://en.wikipedia.org/wiki/Uuencoding), which was less efficient.

TGl2ZSBsb25nIGFuZCBwcm9zcGVyCg==",

lao4lty,https://www.reddit.com/r/learnprogramming/comments/1dqhrx7/please_help_me_troubleshoot_why_google_rejects_my/lao4lty/,2024-06-28 12:23:43 UTC,,learnprogramming,0,https://www.reddit.com/r/learnprogramming/comments/1dqhrx7/please_help_me_troubleshoot_why_google_rejects_my/,,"Make sure your account is set to allow ""less secure apps"", but it's only a temporary solution since Google is going to turn off ALL less secure access soon: https://support.google.com/a/answer/6260879?hl=en__",

laij3qp,https://www.reddit.com/r/learnprogramming/comments/1dpq1jm/dsa_in_depth_university_courses/laij3qp/,2024-06-27 12:48:34 UTC,,learnprogramming,0,https://www.reddit.com/r/learnprogramming/comments/1dpq1jm/dsa_in_depth_university_courses/,,"I mean, data science IS math. You might be able to find a course that focuses more on analysis, but you won't be able to escape math in general",

ld4hvfa,https://www.reddit.com/r/learnprogramming/comments/1e2yz4c/deleted_by_user/ld4hvfa/,2024-07-14 11:22:57 UTC,,learnprogramming,0,https://www.reddit.com/r/learnprogramming/comments/1e2yz4c/deleted_by_user/,ld4eii1,This is a very clever joke :),

ld4htw6,https://www.reddit.com/r/learnprogramming/comments/1e2yz4c/deleted_by_user/ld4htw6/,2024-07-14 11:22:33 UTC,,learnprogramming,0,https://www.reddit.com/r/learnprogramming/comments/1e2yz4c/deleted_by_user/,,"If it works for you, great. I find documentation tedious and overly ""clinical"". I've learned most coding by doing or, more recently, via AI such as ChatGPT",

lb54bey,https://www.reddit.com/r/learnprogramming/comments/1dsvw7y/deleted_by_user/lb54bey/,2024-07-01 15:47:25 UTC,,learnprogramming,0,https://www.reddit.com/r/learnprogramming/comments/1dsvw7y/deleted_by_user/,,"If you committed crimes when you were under 18, you might be able to have the records sealed and claim a clean criminal record",

ld4fu9e,https://www.reddit.com/r/learnprogramming/comments/1e2mq2l/i_need_ideas_for_a_domain_specific_language/ld4fu9e/,2024-07-14 11:02:20 UTC,,learnprogramming,0,https://www.reddit.com/r/learnprogramming/comments/1e2mq2l/i_need_ideas_for_a_domain_specific_language/,,"I hesitate to suggest it ... [that's the hesitation], but consider an AI that makes everything seem dangerous like the site dhmo.org

The idea would be to show that the phrasing of an idea can greatly impact how people view it. In theory, it would help teach people logic and bias.

In reality, people would use it to strengthen their own hateful positions and make the world a worse place, but that's good too",

ldgpce8,https://www.reddit.com/r/learnprogramming/comments/1e4r03r/cannot_print_a_hash_in_perl/ldgpce8/,2024-07-16 15:34:59 UTC,,learnprogramming,0,https://www.reddit.com/r/learnprogramming/comments/1e4r03r/cannot_print_a_hash_in_perl/,ldgmhz2,"Something like `for $i (keys %age_gap) {print ""$i $age_gap{$i}\n""}` is a simple example",

ldgm56j,https://www.reddit.com/r/learnprogramming/comments/1e4r03r/cannot_print_a_hash_in_perl/ldgm56j/,2024-07-16 15:17:28 UTC,,learnprogramming,0,https://www.reddit.com/r/learnprogramming/comments/1e4r03r/cannot_print_a_hash_in_perl/,,"Try `print(%age_gap)` and you'll get something like `HASH(0x000000)`, but it's better if you look through the keys and values instead.",

ldt1udj,https://www.reddit.com/r/learnprogramming/comments/1e6hmx0/to_motivating_students/ldt1udj/,2024-07-18 18:04:09 UTC,,learnprogramming,0,https://www.reddit.com/r/learnprogramming/comments/1e6hmx0/to_motivating_students/,,"This sounds a little suss, especially since it uses Google Forms for signup. Can you tell us more about this company, give us a webpage, tell us when it was established, etc? Does it teach about Amazon's CodeCatalyst?",

lev8wmq,https://www.reddit.com/r/learnprogramming/comments/1ebukbk/is_learning_to_build_a_chess_engine_from_scratch/lev8wmq/,2024-07-25 13:25:32 UTC,,learnprogramming,0,https://www.reddit.com/r/learnprogramming/comments/1ebukbk/is_learning_to_build_a_chess_engine_from_scratch/,,"If your chess engine just makes legal moves without trying to win, yes. If you want an ""intelligent"" chess engine, that's more difficult",

lev9utt,https://www.reddit.com/r/learnprogramming/comments/1ebukbk/is_learning_to_build_a_chess_engine_from_scratch/lev9utt/,2024-07-25 13:31:24 UTC,,learnprogramming,0,https://www.reddit.com/r/learnprogramming/comments/1ebukbk/is_learning_to_build_a_chess_engine_from_scratch/,lev9ksj,"Well, write code to create the board with the start pieces first, let the player choose a move, check the move's validity, and then let your engine find a valid move and perform it.",

lfzt7i1,https://www.reddit.com/r/learnprogramming/comments/1ehk40y/project_difficulty_for_beginner/lfzt7i1/,2024-08-01 16:05:49 UTC,,learnprogramming,0,https://www.reddit.com/r/learnprogramming/comments/1ehk40y/project_difficulty_for_beginner/,,"I don't think this project would be too hard for you, but it might actually be easier using Unix command-line tools instead of Python. There are Python libraries that do the same thing as Unix tools, but they might be harder to learn (of course, you can cheat and use `os.system` but that doesn't count)",

lhksubo,https://www.reddit.com/r/learnprogramming/comments/1eoty6h/whats_wrong_with_this_program/lhksubo/,2024-08-11 12:05:52 UTC,,learnprogramming,0,https://www.reddit.com/r/learnprogramming/comments/1eoty6h/whats_wrong_with_this_program/,lhgze0b,"Oh, it's ctrl-d in Unix. Might be ctrl-z on other operating systems.

In Unix, ctrl-z means ""suspend process"" (at least in the shells I'm familiar with)",

lhfv5bo,https://www.reddit.com/r/learnprogramming/comments/1eoty6h/whats_wrong_with_this_program/lhfv5bo/,2024-08-10 14:26:17 UTC,,learnprogramming,0,https://www.reddit.com/r/learnprogramming/comments/1eoty6h/whats_wrong_with_this_program/,,General debugging tip: add more printf's to see what's happening. Specific tip: make sure you're entering something on the standard input and hitting ctrl-d when you finish or piping the result of a program to this one,

lhfc2ws,https://www.reddit.com/r/learnprogramming/comments/1eor21o/deleted_by_user/lhfc2ws/,2024-08-10 12:11:24 UTC,,learnprogramming,0,https://www.reddit.com/r/learnprogramming/comments/1eor21o/deleted_by_user/,lhfbprr,"Yeah, I see what you're saying. I'm going to follow this thread in case someone comes up with something useful. Every time I start a project, I know someone else has started it, done some work, and abandoned it, but it's easier to start from scratch than to find their work",

lhf9hae,https://www.reddit.com/r/learnprogramming/comments/1eor21o/deleted_by_user/lhf9hae/,2024-08-10 11:49:26 UTC,,learnprogramming,0,https://www.reddit.com/r/learnprogramming/comments/1eor21o/deleted_by_user/,,"I mean, in theory, that's what 99% of github is",

lj27q6z,https://www.reddit.com/r/learnprogramming/comments/1ewy89t/deleted_by_user/lj27q6z/,2024-08-20 16:10:36 UTC,,learnprogramming,0,https://www.reddit.com/r/learnprogramming/comments/1ewy89t/deleted_by_user/,,"If you want to do something new and interesting, try finding a problem that's not difficult, but so obscure or boring that no one else has even bothered solving it (except, once you start working on it, you'll find someone else has solved it 10 years ago and 10 times better, but that's a separate issue).

I'm working on a bunch of mini-GIS projects like finding the shortest marine route from Brisbane to Cardiff or creating a Voronoi diagram for various countries, or determining how far you can get from a given country.

Nothing super-exciting, but it's a fun way to ""learn"" GIS",

litmmja,https://www.reddit.com/r/learnprogramming/comments/1evr74p/learn_programming_coding_and_ai_with/litmmja/,2024-08-19 03:47:41 UTC,,learnprogramming,0,https://www.reddit.com/r/learnprogramming/comments/1evr74p/learn_programming_coding_and_ai_with/,,Are you affiliated with this product? It appears to be relatively unknown: searches for it turn up another product entirely,

