
laz1oxq,https://www.reddit.com/r/learnpython/comments/1ds0u59/completing_a_series_is_there_a_better_solution_to/laz1oxq/,2024-06-30 13:12:22 UTC,,learnpython,0,https://www.reddit.com/r/learnpython/comments/1ds0u59/completing_a_series_is_there_a_better_solution_to/,,"Not really without cheating. You'll notice the multiplicands are ultimately all numbers that, when taken mod 4, yield a 3. Possibly faster ways to compute this are at OEIS 008545 (https://oeis.org/A008545). These are known as the ""quadruple factorial"" numbers",

lanvn5a,https://www.reddit.com/r/learnpython/comments/1dqgrwm/how_to_calculate_unknown_position_in_2d_grid/lanvn5a/,2024-06-28 11:09:17 UTC,,learnpython,0,https://www.reddit.com/r/learnpython/comments/1dqgrwm/how_to_calculate_unknown_position_in_2d_grid/,,"Step 1 would be to draw a diagram, similar to https://www.geogebra.org/calculator/e9jkb4dj",

layw90h,https://www.reddit.com/r/learnpython/comments/1dn005r/ask_anything_monday_weekly_thread/layw90h/,2024-06-30 12:28:33 UTC,,learnpython,0,https://www.reddit.com/r/learnpython/comments/1dn005r/ask_anything_monday_weekly_thread/,layw4jg,General debugging tip: print the values of dollars and percent before multiplying them,

lactc4i,https://www.reddit.com/r/learnpython/comments/1dn005r/ask_anything_monday_weekly_thread/lactc4i/,2024-06-26 12:47:03 UTC,,learnpython,0,https://www.reddit.com/r/learnpython/comments/1dn005r/ask_anything_monday_weekly_thread/,lac5w9p,"Probably irrelevant note: I use symbolic links a lot, so when I do `cd ..` from `/ABC/DEF/GHI` I don't always get to `/ABC/DEF`. You might want to use the Python equivalent of Unix's `realpath` to make sure your `cd ..` work properly, especailly if you use symbolic links a lot",

lai8rl4,https://www.reddit.com/r/learnpython/comments/1dponh8/whenever_i_use_the_docx_module_in_python_it_gives/lai8rl4/,2024-06-27 11:27:44 UTC,,learnpython,0,https://www.reddit.com/r/learnpython/comments/1dponh8/whenever_i_use_the_docx_module_in_python_it_gives/,,`pip install exceptions`?,

lattxh0,https://www.reddit.com/r/learnpython/comments/1dqgrwm/how_to_calculate_unknown_position_in_2d_grid/lattxh0/,2024-06-29 13:16:06 UTC,,learnpython,0,https://www.reddit.com/r/learnpython/comments/1dqgrwm/how_to_calculate_unknown_position_in_2d_grid/,latts8g,"Oh, I wasn't saying use that to answer: I was saying draw a diagram something like that and then work out values.",

laeq5e3,https://www.reddit.com/r/learnpython/comments/1dn005r/ask_anything_monday_weekly_thread/laeq5e3/,2024-06-26 19:21:37 UTC,,learnpython,0,https://www.reddit.com/r/learnpython/comments/1dn005r/ask_anything_monday_weekly_thread/,lacziq1,"Ignore my comment-- it would never appear on a test, it's just something weird I noticed because of the way I do things",

ld4jyfz,https://www.reddit.com/r/learnpython/comments/1e302nm/i_have_this_issue_its_complicated_please_help_in/ld4jyfz/,2024-07-14 11:43:07 UTC,,learnpython,0,https://www.reddit.com/r/learnpython/comments/1e302nm/i_have_this_issue_its_complicated_please_help_in/,ld4jv6z,"See, that's what I mean :)

I don't know if I can help you until I see the problem. Probably not, because I don't know to program, but, if you post the problem here, I may have some thoughts",

lb2p8o6,https://www.reddit.com/r/learnpython/comments/1dsi7xw/how_to_create_a_set_of_random_values_that_follow/lb2p8o6/,2024-07-01 03:07:34 UTC,,learnpython,0,https://www.reddit.com/r/learnpython/comments/1dsi7xw/how_to_create_a_set_of_random_values_that_follow/,,"Try list comprehension maybe?

```
import numpy
[1/(1+np.exp(-x)) for x in np.arange(-6, 6, 0.1)]
```",

ld4gp4c,https://www.reddit.com/r/learnpython/comments/1e2zo7a/why_normal/ld4gp4c/,2024-07-14 11:11:13 UTC,,learnpython,0,https://www.reddit.com/r/learnpython/comments/1e2zo7a/why_normal/,,"```
>>> 2.5000000000000001 
2.5
```

Python doesn't recognize 2.5000000000000001 as a floating point number because floating point numbers don't have that degree of precision",

lb3t9ov,https://www.reddit.com/r/learnpython/comments/1dsi7xw/how_to_create_a_set_of_random_values_that_follow/lb3t9ov/,2024-07-01 10:05:24 UTC,,learnpython,0,https://www.reddit.com/r/learnpython/comments/1dsi7xw/how_to_create_a_set_of_random_values_that_follow/,lb37c8y,Give it a shot yourself first,

lc1byah,https://www.reddit.com/r/learnpython/comments/1dxfucj/is_there_a_way_to_host_python_projects_for_really/lc1byah/,2024-07-07 13:23:52 UTC,,learnpython,0,https://www.reddit.com/r/learnpython/comments/1dxfucj/is_there_a_way_to_host_python_projects_for_really/,,I believe Amazon and Google have free tiers but they might be for a limited time only,

ld4jokb,https://www.reddit.com/r/learnpython/comments/1e302nm/i_have_this_issue_its_complicated_please_help_in/ld4jokb/,2024-07-14 11:40:31 UTC,,learnpython,0,https://www.reddit.com/r/learnpython/comments/1e302nm/i_have_this_issue_its_complicated_please_help_in/,,"You might be better off posting your problem here, so people can know if there's any chance they can help",

lc1crkd,https://www.reddit.com/r/learnpython/comments/1dxfucj/is_there_a_way_to_host_python_projects_for_really/lc1crkd/,2024-07-07 13:29:57 UTC,,learnpython,0,https://www.reddit.com/r/learnpython/comments/1dxfucj/is_there_a_way_to_host_python_projects_for_really/,lc1cbwz,"OK, you may want to specify that in your post. You can use a low value/virtual card if you're worried about overspending",

ld4k59v,https://www.reddit.com/r/learnpython/comments/1e302nm/i_have_this_issue_its_complicated_please_help_in/ld4k59v/,2024-07-14 11:44:55 UTC,,learnpython,0,https://www.reddit.com/r/learnpython/comments/1e302nm/i_have_this_issue_its_complicated_please_help_in/,ld4k2je,You can post it on imgur or something and link it here. I think that's allowed.,

lb53yky,https://www.reddit.com/r/learnpython/comments/1dsw21l/side_effects_to_creating_functions/lb53yky/,2024-07-01 15:45:26 UTC,,learnpython,0,https://www.reddit.com/r/learnpython/comments/1dsw21l/side_effects_to_creating_functions/,,"Assuming this isn't a troll, that's how functions work. When you call `power(5)`, for example, the n in `power(n)` gets replaced by 5, so you have `n=5` for that function. You can replace `(n)` with `(x)` if you want, but it's better to understand function parameters.",

ldlcrfu,https://www.reddit.com/r/learnpython/comments/1e5fefk/help_a_rookie/ldlcrfu/,2024-07-17 11:11:48 UTC,,learnpython,0,https://www.reddit.com/r/learnpython/comments/1e5fefk/help_a_rookie/,,"> i cant rewatch all of that once again due to getting bored

Maybe programming isn't for you?",

lf1terq,https://www.reddit.com/r/learnpython/comments/1ecqwsl/best_way_to_number_a_string_in_alphabetical_order/lf1terq/,2024-07-26 15:50:54 UTC,,learnpython,0,https://www.reddit.com/r/learnpython/comments/1ecqwsl/best_way_to_number_a_string_in_alphabetical_order/,,"If you're allowed to use `numpy`, `numpy.argsort` does this if you use it twice:

```
import numpy
numpy.argsort(numpy.argsort([i for i in ""bear""]))
```

Only slightly tested, use with caution.

According to ChatGPT, `sorted(range(len(array)), key=lambda k: array[k])` twice might do the trick as well, but I didn't test it.",

lf1qobf,https://www.reddit.com/r/learnpython/comments/1ecqvw9/adding_python_to_one_drive/lf1qobf/,2024-07-26 15:36:12 UTC,,learnpython,0,https://www.reddit.com/r/learnpython/comments/1ecqvw9/adding_python_to_one_drive/,lf1pyud,"Agreed. I'm pretty sure OneDrive is just for file storage. They don't actually let you run anything on their servers.

OP could get away with client-side JavaScript (or compiled client-side Python which I'm pretty sure doesn't really work well), but that's about it",

lfzv9qb,https://www.reddit.com/r/learnpython/comments/1ehk4b8/i_have_problem_in_inputoutput/lfzv9qb/,2024-08-01 16:16:47 UTC,,learnpython,0,https://www.reddit.com/r/learnpython/comments/1ehk4b8/i_have_problem_in_inputoutput/,,"Post the code on repl.it or pythonfiddle.com with the file (or a sample file if the original is private). Also, try using the full path to the file.",

lfzxv6h,https://www.reddit.com/r/learnpython/comments/1ehku66/good_morning_having_problem_to_create_a_proper/lfzxv6h/,2024-08-01 16:30:25 UTC,,learnpython,0,https://www.reddit.com/r/learnpython/comments/1ehku66/good_morning_having_problem_to_create_a_proper/,,"You might want to put this code up on repl.it or pythonfiddle.com so we can help more, but it's unlikely anyone will straight out write it for you unless they're being evil and want to punish you for cheating by writing it wrong",

lg4ulqt,https://www.reddit.com/r/learnpython/comments/1ei9f8o/cant_write_list_to_txt_file/lg4ulqt/,2024-08-02 13:05:42 UTC,,learnpython,0,https://www.reddit.com/r/learnpython/comments/1ei9f8o/cant_write_list_to_txt_file/,,Try posting the code on repl.it or pythonfiddle.com with a sample file so we can actually run it,

lg579tc,https://www.reddit.com/r/learnpython/comments/1eiatse/equation_derivation/lg579tc/,2024-08-02 14:20:54 UTC,,learnpython,0,https://www.reddit.com/r/learnpython/comments/1eiatse/equation_derivation/,lg5713e,"Sure. If it's a public formula, post it somewhere and I could try running Julia on it. That probably won't work either, but I have large number of other useless suggestions",

lg56qgw,https://www.reddit.com/r/learnpython/comments/1eiatse/equation_derivation/lg56qgw/,2024-08-02 14:17:52 UTC,,learnpython,0,https://www.reddit.com/r/learnpython/comments/1eiatse/equation_derivation/,lg56d93,That could work. Mathematica (free on cloud.wolfram.com) has a FindFormula function (https://reference.wolfram.com/language/ref/FindFormula.html) but it doesn't really work well,

lg553md,https://www.reddit.com/r/learnpython/comments/1eiatse/equation_derivation/lg553md/,2024-08-02 14:08:35 UTC,,learnpython,0,https://www.reddit.com/r/learnpython/comments/1eiatse/equation_derivation/,,Have you tried Fourier analysis?,

lg4xjfa,https://www.reddit.com/r/learnpython/comments/1ei9itk/whats_wrong_with_the_max_module_of_python/lg4xjfa/,2024-08-02 13:24:04 UTC,,learnpython,0,https://www.reddit.com/r/learnpython/comments/1ei9itk/whats_wrong_with_the_max_module_of_python/,lg4wia1,"""Hexadecimal value"" is an odd turn of phrase, but I'd say alphabetically. Remember ""1"" comes before ""9"" in the alphabet, so ""10"" comes before ""9"". Unix programs like `sort` deal with this via options (`-n` is numeric sort)

To fix, just remove the quotation marks so Python treats your numbers as numbers",

lgfvzr7,https://www.reddit.com/r/learnpython/comments/1ejtij2/help_with_code_required/lgfvzr7/,2024-08-04 12:07:49 UTC,,learnpython,0,https://www.reddit.com/r/learnpython/comments/1ejtij2/help_with_code_required/,,"Without actually running your code, I suspect it's confusing characters with strings.",

lhff1he,https://www.reddit.com/r/learnpython/comments/1eorr2s/python_is_easy_for_them_not_for_me/lhff1he/,2024-08-10 12:35:22 UTC,,learnpython,0,https://www.reddit.com/r/learnpython/comments/1eorr2s/python_is_easy_for_them_not_for_me/,,"It's far from the easiest language to learn and I personally hate it. However, it is also popular and has many useful libraries, so there is value to learning it

If you really hate it and don't see a career in it, consider learning a different language.",

lhfgju3,https://www.reddit.com/r/learnpython/comments/1eorr2s/python_is_easy_for_them_not_for_me/lhfgju3/,2024-08-10 12:47:03 UTC,,learnpython,0,https://www.reddit.com/r/learnpython/comments/1eorr2s/python_is_easy_for_them_not_for_me/,lhffjbk,"Here's a helpful thought: once a programming language becomes popular and people start writing code in it, there will ""always"" be jobs in that language. There are even jobs in COBOL and FORTRAN which are super-old, and BASIC and Pascal which were designed as learning tools, not actual languages. So, if you learn Python, there will ""always"" be jobs out there for ""you""

Here are some unhelpful thoughts:

  - AI will take over and all (most) programmers will become useless

  - Lots of people are studying Python, so the supply of Python programmers might vastly exceed the demand

  - You said Python was your first programming language, so it's possible that you find programming itself hard, not just the Python-specific quirks of programming. In that case, you're stuck regardless of which (procedural) language you use",

lh3vwcg,https://www.reddit.com/r/learnpython/comments/1en6dsz/need_help/lh3vwcg/,2024-08-08 13:53:04 UTC,,learnpython,0,https://www.reddit.com/r/learnpython/comments/1en6dsz/need_help/,,Please tell us here even if only so we can decide if we can help via DM,

li8pzac,https://www.reddit.com/r/learnpython/comments/1esvzdd/editing_remote_files/li8pzac/,2024-08-15 14:08:09 UTC,,learnpython,0,https://www.reddit.com/r/learnpython/comments/1esvzdd/editing_remote_files/,,"If you have ssh access, you can create a tunnel. If not, consider using ncftpget and ncftpput (part of ncftp) as a command-line ""cheat"" to do this.",

liea4ms,https://www.reddit.com/r/learnpython/comments/1etmgjz/python_project_35_hours/liea4ms/,2024-08-16 12:33:59 UTC,,learnpython,0,https://www.reddit.com/r/learnpython/comments/1etmgjz/python_project_35_hours/,,"Do this project for me: write a program that finds the shortest marine route between two points in the world (or on a given raster). It's like finding the shortest path through a maze but with the slightly added difficulty that the ""cost"" to move from square to square isn't the same (geodesic distance)",

ljf1csw,https://www.reddit.com/r/learnpython/comments/1eyq2fv/where_does_the_time_go_when_programming/ljf1csw/,2024-08-22 18:16:34 UTC,,learnpython,0,https://www.reddit.com/r/learnpython/comments/1eyq2fv/where_does_the_time_go_when_programming/,,"Before I started using the Pomodoro method, the same thing when I was coding alone at home. Literally hours would pass while I was in ""the zone"".",

lifzj41,https://www.reddit.com/r/learnpython/comments/1etmgjz/python_project_35_hours/lifzj41/,2024-08-16 18:11:25 UTC,,learnpython,0,https://www.reddit.com/r/learnpython/comments/1etmgjz/python_project_35_hours/,lifvns8,"Wow, I was sort of joking, but OK. You can create a directed graph using something like networkx, and treat the world as a grid of points. The distance between two adjacent points would be the great circle distance. Of course, land points (ones you can't access) wouldn't be included. Networkx would then find the shortest path for the weighted graph.

The project was inspired by https://new.reddit.com/r/NoStupidQuestions/comments/1ehtvbn/ignoring_the_fact_its_physically_impossible_how/ where it turns out the ""obvious"" shortest path is actually nowhere near the actual shortest path

Of course, you can extend this to problems like ""what's the shortest land path between X and Y"" or even ""what path between X and Y touches the least water"".

If you really want to do this, consider grabbing data from naturalearthdata.com and using tools like gdaltools (written in Python) to find what parts of the Earth are water and what parts are land.",

lig0bys,https://www.reddit.com/r/learnpython/comments/1etmgjz/python_project_35_hours/lig0bys/,2024-08-16 18:15:43 UTC,,learnpython,0,https://www.reddit.com/r/learnpython/comments/1etmgjz/python_project_35_hours/,lifzx2u,"Great circle distance when moving from water to water. No nodes on land. Of course, some paths may be impossible just as you can have impossible mazes. The only thing that makes this different from most maze pathfinders is that the distance is based on great circle distance, not standard linear or Manhattan distance",

ljf16g0,https://www.reddit.com/r/learnpython/comments/1eyq2fv/where_does_the_time_go_when_programming/ljf16g0/,2024-08-22 18:15:40 UTC,,learnpython,0,https://www.reddit.com/r/learnpython/comments/1eyq2fv/where_does_the_time_go_when_programming/,ljeyv7p,Add Rankine and Kelvin please,

lls7x32,https://www.reddit.com/r/learnpython/comments/1fad9i0/free_python_football_statistic_api/lls7x32/,2024-09-06 12:16:50 UTC,,learnpython,0,https://www.reddit.com/r/learnpython/comments/1fad9i0/free_python_football_statistic_api/,,https://sportsdatabase.com/ may or may not be helpful,

lln3n9a,https://www.reddit.com/r/learnpython/comments/1f9ou42/filtering_out_coordinates_outside_of_a_boundary/lln3n9a/,2024-09-05 15:22:52 UTC,,learnpython,0,https://www.reddit.com/r/learnpython/comments/1f9ou42/filtering_out_coordinates_outside_of_a_boundary/,,"Unrelated to Python, but consider using a raster map of Oklahoma as your mask instead of a rectangle and add the comment ""Oklahoma is not OK (in this program)""

EDIT: I realize you said filter out points OUTSIDE Oklahoma, so my joke doesn't make sense, but the advice still might",

ln8nj1v,https://www.reddit.com/r/learnpython/comments/1fhaxul/can_you_give_an_exact_definition_of_syntactic/ln8nj1v/,2024-09-15 13:04:48 UTC,,learnpython,0,https://www.reddit.com/r/learnpython/comments/1fhaxul/can_you_give_an_exact_definition_of_syntactic/,,"`a=(b>0?4:7)` is a very compact (arguably minimalist) of setting the value of `a`, but a little hard for people to read

`IF B IS GREATER THAN 0 THEN SET A TO 4 ELSE SET A TO 7` is a much longer way to say the same thing (I'm mimicking COBOL but this code may not be 100% valid), but presumably a lot easier to read for humans. That ""easier to read"" is the syntactic sugar (makes code prettier for us humans).

A milder example is some languages use `begin` and `end` (syntactic sugar) to offset code blocks, whereas others use `{` and `}`.",

llyec05,https://www.reddit.com/r/learnpython/comments/1fb6xua/feasibility_question_is_it_possible_to_build_a/llyec05/,2024-09-07 13:55:39 UTC,,learnpython,0,https://www.reddit.com/r/learnpython/comments/1fb6xua/feasibility_question_is_it_possible_to_build_a/,,Absolutely. You can read files in Python and then use the data in those files to create options,

loua1h2,https://www.reddit.com/r/learnpython/comments/1fp1sfv/insert_data_into_sql_server/loua1h2/,2024-09-25 11:51:12 UTC,,learnpython,0,https://www.reddit.com/r/learnpython/comments/1fp1sfv/insert_data_into_sql_server/,,Is the instance listening on a TCP/IP port?,

lp0wzzn,https://www.reddit.com/r/learnpython/comments/1fpxegd/is_there_a_sha256_hash_generator_that_can_output/lp0wzzn/,2024-09-26 14:30:24 UTC,,learnpython,0,https://www.reddit.com/r/learnpython/comments/1fpxegd/is_there_a_sha256_hash_generator_that_can_output/,,Is it possible that the first few characters are a hash of some sort?,

lp12jii,https://www.reddit.com/r/learnpython/comments/1fpxegd/is_there_a_sha256_hash_generator_that_can_output/lp12jii/,2024-09-26 14:59:57 UTC,,learnpython,0,https://www.reddit.com/r/learnpython/comments/1fpxegd/is_there_a_sha256_hash_generator_that_can_output/,lp123kn,It's a mistake on my part but I think OP gets the point,

lp0xegt,https://www.reddit.com/r/learnpython/comments/1fpxegd/is_there_a_sha256_hash_generator_that_can_output/lp0xegt/,2024-09-26 14:32:35 UTC,,learnpython,0,https://www.reddit.com/r/learnpython/comments/1fpxegd/is_there_a_sha256_hash_generator_that_can_output/,,"Answer by AI, but vetted by me:

The string $5$.8eHlM5ABCDEFGHIJKLMNOP.ABCDEFGHIJKLMNOP appears to be a hashed password using the SHA-512 crypt algorithm. Here’s a breakdown of its components:

    $5$: Indicates the use of the SHA-512 hashing algorithm.
    .8e: Part of the salt used in the hashing process.
    HlM5ABCDEFGHIJKLMNOP: The actual salt value.
    ABCDEFGHIJKLMNOP: The hashed password.

This format is commonly used in Unix-like systems for storing hashed passwords in the /etc/shadow file. The salt helps to protect against rainbow table attacks by ensuring that identical passwords hash to different values.

Edit: I'm assuming you altered the string length since ""ABCDEFGHIJKLMNOP"" is not long enough to be a SHA-256 hashed string",

lp102xm,https://www.reddit.com/r/learnpython/comments/1fpxegd/is_there_a_sha256_hash_generator_that_can_output/lp102xm/,2024-09-26 14:47:00 UTC,,learnpython,0,https://www.reddit.com/r/learnpython/comments/1fpxegd/is_there_a_sha256_hash_generator_that_can_output/,lp0yyi6,"The `crypt` module does this. Code written by AI, tweaked, and tested:

```
import crypt

# Password to be hashed
password = ""your_password""

# THIS IS WRONG: Salt (must start with $5$ for SHA-512)

salt = ""$6$.8eHlM5ABCDEFGHIJKLMNOP""

# Create hashed password
hashed_password = crypt.crypt(password, salt)

print(hashed_password)
```

The result is `$6$.8eHlM5ABCDEFGHI$ok/KMRhHBRPPf.uJ45Kz7RW69oKJjM5LLX0gqtZQEAz6uIA2BfgcizzEfHEZdDo8eDRyQmIOKi2aZEQ4KbV4T0`",

ltctvqp,https://www.reddit.com/r/learnpython/comments/1gacul8/generating_random_variables_that_follow_a_uniform/ltctvqp/,2024-10-23 15:32:34 UTC,,learnpython,0,https://www.reddit.com/r/learnpython/comments/1gacul8/generating_random_variables_that_follow_a_uniform/,ltctemg,"If you're using a finite amount of precision (eg, Float32, Float64, or a specific number of digits), you can reduce this to a discrete problem or use 0+MIN_FLOAT as your starting point. This is ugly though. Have you run any tests to see the standard random number generator can actually return the left endpoint?",

ltcqbz4,https://www.reddit.com/r/learnpython/comments/1gacul8/generating_random_variables_that_follow_a_uniform/ltcqbz4/,2024-10-23 15:14:13 UTC,,learnpython,0,https://www.reddit.com/r/learnpython/comments/1gacul8/generating_random_variables_that_follow_a_uniform/,,"Mathematically, the chance of getting `a` or `b` in the interval `(a,b)` (for `b > a`) is 0, so it's really the same thing. Unless you're talking about a discrete distribution or some special case",

ltcumi8,https://www.reddit.com/r/learnpython/comments/1gacul8/generating_random_variables_that_follow_a_uniform/ltcumi8/,2024-10-23 15:36:22 UTC,,learnpython,0,https://www.reddit.com/r/learnpython/comments/1gacul8/generating_random_variables_that_follow_a_uniform/,,"Quoting https://docs.python.org/3/library/random.html

> random.uniform(a, b): Return a random floating-point number N such that a <= N <= b for a <= b and b <= N <= a for b < a.

which would be `[a,b]`. The next bit explains why it's really hard to distinguish between `(a,b)` and `[a,b]` in cases like this (ie, when you're using a computer with finite precision instead of a mathematical abstraction):

> The end-point value b may or may not be included in the range depending on floating-point rounding in the expression a + (b-a) * random().",

m2hvoft,https://www.reddit.com/r/learnpython/comments/1hgbiba/does_mark_lutz_love_spam/m2hvoft/,2024-12-17 14:16:13 UTC,,learnpython,0,https://www.reddit.com/r/learnpython/comments/1hgbiba/does_mark_lutz_love_spam/,,"Python the language is named after Monty Python, the comedy group and the word ""spam"" is repeated many times in one of their sketches. It's where we get the email meaning of the word ""spam"". Python programmers are encouraged to use Monty Python references.",

m50vzry,https://www.reddit.com/r/learnpython/comments/1hrwudp/if_statements_not_working/m50vzry/,2025-01-02 15:59:41 UTC,,learnpython,0,https://www.reddit.com/r/learnpython/comments/1hrwudp/if_statements_not_working/,,Hit return one more time with no indentation to finish the `if` statement,

m69mn33,https://www.reddit.com/r/learnpython/comments/1hxizqe/i_could_use_some_assistance_with_a_new_scripting/m69mn33/,2025-01-09 18:38:53 UTC,,learnpython,0,https://www.reddit.com/r/learnpython/comments/1hxizqe/i_could_use_some_assistance_with_a_new_scripting/,,"You might want to look into ""Voronoi diagrams"". If the region you're studying is small (which it appears to be), you can use Mercator coordinates and pretend distances are linear.

If you're studying a large region and can't assume distance are linear, consider using a KDTree or something",

m6okjsz,https://www.reddit.com/r/learnpython/comments/1hzbxtn/i_want_someone_to_hire_me/m6okjsz/,2025-01-12 02:33:46 UTC,,learnpython,0,https://www.reddit.com/r/learnpython/comments/1hzbxtn/i_want_someone_to_hire_me/,,Isn't Dubai the capital of the richest country in the world?,

m9478qt,https://www.reddit.com/r/learnpython/comments/1i9r3gb/deleted_by_user/m9478qt/,2025-01-25 16:58:07 UTC,,learnpython,0,https://www.reddit.com/r/learnpython/comments/1i9r3gb/deleted_by_user/,,What about 121?,

mbip3g2,https://www.reddit.com/r/learnpython/comments/1ik1gss/whats_the_bestcleanest_way_to_do_process_data/mbip3g2/,2025-02-07 18:19:02 UTC,,learnpython,0,https://www.reddit.com/r/learnpython/comments/1ik1gss/whats_the_bestcleanest_way_to_do_process_data/,,"The pedant in me must point out that 30 times a second is closer to once every 0.03 seconds, not once every 0.3 seconds",

mqw5edk,https://www.reddit.com/r/learnpython/comments/1kg66i4/this_short_python_video_helped_me_understand/mqw5edk/,2025-05-06 14:45:37 UTC,98.48.122.229,learnpython,0,https://www.reddit.com/r/learnpython/comments/1kg66i4/this_short_python_video_helped_me_understand/,,Are you affiliated with this video?,

myztz5d,https://www.reddit.com/r/learnpython/comments/1lgyanb/please_suggest_a_faster_method_for_this_question/myztz5d/,2025-06-21 14:57:08 UTC,98.48.122.229,learnpython,0,https://www.reddit.com/r/learnpython/comments/1lgyanb/please_suggest_a_faster_method_for_this_question/,,"Unless the array always has exactly 3 elements, I'd start by `map`ping `lower` to the array, then sorting the array and then looking for unique elements. You could also consider using a dictionary of the lowercased array whose keys will then be the unique elements",

