
m4js91r,https://www.reddit.com/r/IWantToLearn/comments/1hprxgs/iwtl_how_to_accept_being_an_anomaly_among_people/m4js91r/,2024-12-30 17:12:22 UTC,,IWantToLearn,0,https://www.reddit.com/r/IWantToLearn/comments/1hprxgs/iwtl_how_to_accept_being_an_anomaly_among_people/,,"Your post probably doesn't qualify here, but my advice: even in countries where one culture is dominant, you'll find people who think like you. Seek out mroe of these people and form your own group of friends.",

m6u34fn,https://www.reddit.com/r/IWantToLearn/comments/1i001ax/deleted_by_user/m6u34fn/,2025-01-12 23:57:51 UTC,,IWantToLearn,0,https://www.reddit.com/r/IWantToLearn/comments/1i001ax/deleted_by_user/,,"Based on your previous posts, you appear to be Muslim. Does your religion prohibit disobeying your parents? If so, are you willing to leave your religion to marry this woman (who is apparently also Muslim)? Romeo and Juliet doesn't really work in this scenario",

mar70f4,https://www.reddit.com/r/IWantToLearn/comments/1igrjsb/iwtl_how_to_negotiate_gift_money_for_brother_in/mar70f4/,2025-02-03 16:05:29 UTC,,IWantToLearn,0,https://www.reddit.com/r/IWantToLearn/comments/1igrjsb/iwtl_how_to_negotiate_gift_money_for_brother_in/,,"> half year salary for a typical person in my brother in law’s profession

Interesting choice of comparison. How many months of YOUR salary is it?

By saying you're the ""sole breadwinner in the family"" sounds like you and your wife may have deeper budgeting issues. Do you generally agree on other expenses? Do you feel your wife contributes to your marriage/family in non-monetary ways? Do you frequently have discussions/fights about money?",

mc7k1es,https://www.reddit.com/r/IWantToLearn/comments/1in24ox/iwtl_how_to_be_a_better_programmer/mc7k1es/,2025-02-11 16:53:08 UTC,,IWantToLearn,0,https://www.reddit.com/r/IWantToLearn/comments/1in24ox/iwtl_how_to_be_a_better_programmer/,mc7jn47,"Wow, that's a lot. If you're good at math, I'm surprised you're not good at computer programming.",

mc7cgkx,https://www.reddit.com/r/IWantToLearn/comments/1in24ox/iwtl_how_to_be_a_better_programmer/mc7cgkx/,2025-02-11 16:17:34 UTC,,IWantToLearn,0,https://www.reddit.com/r/IWantToLearn/comments/1in24ox/iwtl_how_to_be_a_better_programmer/,,Unpopular opinion: learn math. Computer programming is really math,

mhy6mo8,https://www.reddit.com/r/IWantToLearn/comments/1jbzp47/iwtl_to_desensitize_myself_to_violence_gore_and/mhy6mo8/,2025-03-15 17:13:51 UTC,,IWantToLearn,0,https://www.reddit.com/r/IWantToLearn/comments/1jbzp47/iwtl_to_desensitize_myself_to_violence_gore_and/,,"The easy solution is to get diagnosed with clinical depression and get meds that take the edge off. The hard solution is to actually solve all the world's problems, but, if you're shocked by history too, you'll need a time machine.",

mjijysa,https://www.reddit.com/r/IWantToLearn/comments/1jiv09b/iwtl_how_to_get_the_thought_of_women_out_my_brain/mjijysa/,2025-03-24 17:52:55 UTC,98.48.122.229,IWantToLearn,0,https://www.reddit.com/r/IWantToLearn/comments/1jiv09b/iwtl_how_to_get_the_thought_of_women_out_my_brain/,,"I mean, you're fighting a biological imperative here. If it's interfering with your life, a doctor could prescribe something. Some antidepressants have the side effect of suppressing libido",