
m16r6rv,https://www.reddit.com/r/3amjokes/comments/1ha8w3z/what_do_you_call_a_dog_that_can_walk_on_its_hind/m16r6rv/,2024-12-09 13:03:17 UTC,,3amjokes,0,https://www.reddit.com/r/3amjokes/comments/1ha8w3z/what_do_you_call_a_dog_that_can_walk_on_its_hind/,,Correct answer: mai waiff,

m111i7t,https://www.reddit.com/r/3amjokes/comments/1h9iwh7/asked_a_guy_if_he_wanted_to_come_back_as_a_toilet/m111i7t/,2024-12-08 13:42:17 UTC,,3amjokes,0,https://www.reddit.com/r/3amjokes/comments/1h9iwh7/asked_a_guy_if_he_wanted_to_come_back_as_a_toilet/,,"""as a toilet seat, I can get all the ass I want""

Also, technically, unfertilized eggs don't have gender",

m5d5tl8,https://www.reddit.com/r/3amjokes/comments/1htgrv9/two_raindrops_were_hanging_out_on_a_cloud/m5d5tl8/,2025-01-04 15:36:27 UTC,,3amjokes,0,https://www.reddit.com/r/3amjokes/comments/1htgrv9/two_raindrops_were_hanging_out_on_a_cloud/,,"""I'm so wet!""",

m69iqwg,https://www.reddit.com/r/3amjokes/comments/1hxhvic/newlyweds_and_their_middleaged_neighbors/m69iqwg/,2025-01-09 18:20:12 UTC,,3amjokes,0,https://www.reddit.com/r/3amjokes/comments/1hxhvic/newlyweds_and_their_middleaged_neighbors/,,I'm writing a porno with a serious but also humorous plot: a dramadery,

m84rw01,https://www.reddit.com/r/3amjokes/comments/1i5kr96/i_started_a_company_teaching_short_people_how_to/m84rw01/,2025-01-20 08:35:20 UTC,,3amjokes,0,https://www.reddit.com/r/3amjokes/comments/1i5kr96/i_started_a_company_teaching_short_people_how_to/,,"Funnier as ""teaching children math""",

maddopx,https://www.reddit.com/r/3amjokes/comments/1if5ugo/what_is_essex/maddopx/,2025-02-01 13:19:59 UTC,,3amjokes,0,https://www.reddit.com/r/3amjokes/comments/1if5ugo/what_is_essex/,,"They say The Only Way Is Essex, but Einvitro fertilization is another option",

mayc5x6,https://www.reddit.com/r/3amjokes/comments/1ihly6w/what_do_you_call_slutty_dairy_products/mayc5x6/,2025-02-04 17:21:27 UTC,,3amjokes,0,https://www.reddit.com/r/3amjokes/comments/1ihly6w/what_do_you_call_slutty_dairy_products/,,Rant: I hate it when people confuse Easy Cheese and Cheez Whiz,

mbbnrzw,https://www.reddit.com/r/3amjokes/comments/1ihly6w/what_do_you_call_slutty_dairy_products/mbbnrzw/,2025-02-06 17:17:21 UTC,,3amjokes,0,https://www.reddit.com/r/3amjokes/comments/1ihly6w/what_do_you_call_slutty_dairy_products/,mbb7p9y,"Easy Cheese: spray cheese

Cheez Whiz: Blended (American) cheese used for cooking",

myt776z,https://www.reddit.com/r/3amjokes/comments/1lg3v27/what_do_you_call_a_female_doctor_who_is/myt776z/,2025-06-20 13:43:53 UTC,98.48.122.229,3amjokes,0,https://www.reddit.com/r/3amjokes/comments/1lg3v27/what_do_you_call_a_female_doctor_who_is/,myt6oz5,"No, *I* was being sexist by implying all female doctors are consistently incorrect with their evaluations. IE, female doctor = bad doctor.",

myt4kaw,https://www.reddit.com/r/3amjokes/comments/1lg3v27/what_do_you_call_a_female_doctor_who_is/myt4kaw/,2025-06-20 13:29:15 UTC,98.48.122.229,3amjokes,0,https://www.reddit.com/r/3amjokes/comments/1lg3v27/what_do_you_call_a_female_doctor_who_is/,,"> What do you call a female doctor who is consistently incorrect with her evaluations? 

A female doctor (good old fashioned sexism there)",