
ljelzgd,https://www.reddit.com/r/learnprogramming/comments/1eynsez/how_do_i_find_a_realtime_programming_mentor_for_a/ljelzgd/,2024-08-22 16:58:25 UTC,,learnprogramming,0,https://www.reddit.com/r/learnprogramming/comments/1eynsez/how_do_i_find_a_realtime_programming_mentor_for_a/,,"I mean, I'm bored and have a lot of free time, but my expertise is limited. Tell us a little bit more about your project (not just the tech stacks) and people can see if they're interested",

ljub5kc,https://www.reddit.com/r/learnprogramming/comments/1f0ss0l/deleted_by_user/ljub5kc/,2024-08-25 11:17:10 UTC,,learnprogramming,0,https://www.reddit.com/r/learnprogramming/comments/1f0ss0l/deleted_by_user/,,"Are you familiar with `strace`? It's more for code you didn't write, but should work on code you wrote too",

lk6at7g,https://www.reddit.com/r/learnprogramming/comments/1f2f3zp/would_anyone_know_of_an_open_source_database_for/lk6at7g/,2024-08-27 13:49:08 UTC,,learnprogramming,0,https://www.reddit.com/r/learnprogramming/comments/1f2f3zp/would_anyone_know_of_an_open_source_database_for/,,Are you familiar with https://fdc.nal.usda.gov/,

lkhhshb,https://www.reddit.com/r/learnprogramming/comments/1f3z7cy/im_building_a_program_that_people_with_adhd_can/lkhhshb/,2024-08-29 11:27:00 UTC,,learnprogramming,0,https://www.reddit.com/r/learnprogramming/comments/1f3z7cy/im_building_a_program_that_people_with_adhd_can/,,Have you tried openstreetmaps.org? Or do they not have phone numbers?,

lkcj8hx,https://www.reddit.com/r/learnprogramming/comments/1f3bj8v/day_01prep_for_faang/lkcj8hx/,2024-08-28 14:40:40 UTC,,learnprogramming,0,https://www.reddit.com/r/learnprogramming/comments/1f3bj8v/day_01prep_for_faang/,,spam referral link,

lkhr3xw,https://www.reddit.com/r/learnprogramming/comments/1f3z7cy/im_building_a_program_that_people_with_adhd_can/lkhr3xw/,2024-08-29 12:33:44 UTC,,learnprogramming,0,https://www.reddit.com/r/learnprogramming/comments/1f3z7cy/im_building_a_program_that_people_with_adhd_can/,lkhqxzj,"You could try looking at state-by-state business registrations, but that's icky",

ll0v4t3,https://www.reddit.com/r/learnprogramming/comments/1f6kd18/iteration_vs_recursion_when_to_use_which/ll0v4t3/,2024-09-01 18:06:00 UTC,,learnprogramming,0,https://www.reddit.com/r/learnprogramming/comments/1f6kd18/iteration_vs_recursion_when_to_use_which/,,I generally avoid recursion because you can run out of stack space. I prefer to use a queue and iterate along it,

lkuaaw9,https://www.reddit.com/r/learnprogramming/comments/1f5onyc/read_the_matter/lkuaaw9/,2024-08-31 14:59:47 UTC,,learnprogramming,0,https://www.reddit.com/r/learnprogramming/comments/1f5onyc/read_the_matter/,,In theory you could program with just 0's and 1's. Or even just 0's and the length would determine the program,

lopw5la,https://www.reddit.com/r/learnprogramming/comments/1fohfzv/traceback_error/lopw5la/,2024-09-24 17:09:40 UTC,,learnprogramming,0,https://www.reddit.com/r/learnprogramming/comments/1fohfzv/traceback_error/,lopvu9a,">  [ WARN:0@0.629] global loadsave.cpp:241 cv::findDecoder imread_('img_0821.jpg'): can't open/read file: check file path/integrity 

I think it can't find img_0821.jpg. Make sure it's in the same directory as where you're running the code or give the full path to the file so your code can find it",

lopdk6b,https://www.reddit.com/r/learnprogramming/comments/1foatl4/deleted_by_user/lopdk6b/,2024-09-24 15:32:50 UTC,,learnprogramming,0,https://www.reddit.com/r/learnprogramming/comments/1foatl4/deleted_by_user/,,"To be honest, I'm guessing your idea isn't unique. There are tons of apps that help with motivation using all sorts of methods (including taking money if you were considering that), and I can't imagine you've found a truly new one, sorry",

lorpnkt,https://www.reddit.com/r/learnprogramming/comments/1foatl4/deleted_by_user/lorpnkt/,2024-09-24 23:01:44 UTC,,learnprogramming,0,https://www.reddit.com/r/learnprogramming/comments/1foatl4/deleted_by_user/,lor4xlm,"I think a lot of people waste time and effort and sometimes even money on developing an app that they think will make them rich, but end up failing because their original idea isn't all thar original or all that valuable. Probably best to do at least a little research first",

lopv8ra,https://www.reddit.com/r/learnprogramming/comments/1fohfzv/traceback_error/lopv8ra/,2024-09-24 17:04:56 UTC,,learnprogramming,0,https://www.reddit.com/r/learnprogramming/comments/1fohfzv/traceback_error/,,"Every fatal error comes with a traceback so that doesn't help. Could you 1) show us the error, and 2) tell us the language (Julia?)",

lou8k6c,https://www.reddit.com/r/learnprogramming/comments/1fp1351/games_and_no_coding_experience_they_say/lou8k6c/,2024-09-25 11:39:46 UTC,,learnprogramming,0,https://www.reddit.com/r/learnprogramming/comments/1fp1351/games_and_no_coding_experience_they_say/,,"Computers and coding have been around long enough that meta-tools now exist.

AI is obviously one of them, but there are plenty of programs that will let you create clones of the basic game types using your own artwork

[useful content ends here; rambling below]

I personally don't like them but that's because I learned programming the hard way (back when we had 3583 bytes of memory AND WE LIKED IT!) and dislike the idea people can now create awesome games in just a few minutes.

In some sense, this was inevitable. Programmers are essentially translators between humans and computers: you tell us what you want the computer to do and we convert it to the computer's language. Of course, one of you got smart and asked us to have the computer do the translation itself so you would no longer need us and we, not being terribly bright when it comes to things like that, did so.",

lovkysb,https://www.reddit.com/r/learnprogramming/comments/1fp7u3o/deleted_by_user/lovkysb/,2024-09-25 16:24:40 UTC,,learnprogramming,0,https://www.reddit.com/r/learnprogramming/comments/1fp7u3o/deleted_by_user/,,"If it's Python, remember that Python is whitespace sensitive",

lsx9rls,https://www.reddit.com/r/learnprogramming/comments/1g89xr4/more_info_on_undirected_virtual_graphs_vertices/lsx9rls/,2024-10-20 23:29:28 UTC,,learnprogramming,0,https://www.reddit.com/r/learnprogramming/comments/1g89xr4/more_info_on_undirected_virtual_graphs_vertices/,lsx7p80,"Thank you! This really helped. I found Lazy.jl and Thunks.jl that deal more with lazy lists in Julia. I'm leaving the question up, but I think the phrase ""lazy evaluation"" (which I knew about but didn't think to search) helped a lot.",

lrfgi8h,https://www.reddit.com/r/learnprogramming/comments/1g1coie/request_archive_program/lrfgi8h/,2024-10-11 15:56:02 UTC,,learnprogramming,0,https://www.reddit.com/r/learnprogramming/comments/1g1coie/request_archive_program/,,"I use recollq (https://manpages.ubuntu.com/manpages/xenial/man1/recollq.1.html) to locally index most of the local files I have. It works fairly well, and can bring up documents based on search phrases fairly quickly. Note that I use recollq from the command line, but it's part of a larger structure called Xapian (https://en.wikipedia.org/wiki/Xapian) that you might also want to look at",

luvqck2,https://www.reddit.com/r/learnprogramming/comments/1gh9nwi/would_you_guys_be_interested_in_learn_to_codeget/luvqck2/,2024-11-01 16:39:38 UTC,,learnprogramming,0,https://www.reddit.com/r/learnprogramming/comments/1gh9nwi/would_you_guys_be_interested_in_learn_to_codeget/,,"If you could confirm that this is all free, it would help, but I still think it's spam so I reported it",

lxfnpk9,https://www.reddit.com/r/learnprogramming/comments/1gso25b/how_i_can_get_a_paid_internship_or_freelance/lxfnpk9/,2024-11-16 14:17:17 UTC,,learnprogramming,0,https://www.reddit.com/r/learnprogramming/comments/1gso25b/how_i_can_get_a_paid_internship_or_freelance/,,This gets asked a lot: https://www.reddit.com/r/learnprogramming/wiki/faq/#wiki_is_doing_x_enough_to_let_me_get_an_entry-level_job.3F,

ly4e8xq,https://www.reddit.com/r/learnprogramming/comments/1gvt1j5/a_deadline_calculator/ly4e8xq/,2024-11-20 16:39:27 UTC,,learnprogramming,0,https://www.reddit.com/r/learnprogramming/comments/1gvt1j5/a_deadline_calculator/,,"> how much time I have left till my exams and then it struck me why not write code so that the program will do that for me

The nominees for Most Creative Way To Procrastinate....",

lz9bimi,https://www.reddit.com/r/learnprogramming/comments/1h17gm9/looking_for_a_mentor_to_guide_me_in_my/lz9bimi/,2024-11-27 15:58:26 UTC,,learnprogramming,0,https://www.reddit.com/r/learnprogramming/comments/1h17gm9/looking_for_a_mentor_to_guide_me_in_my/,,Could you tell us a little more about what you're looking for? Languages? Projects? What do you hope to accomplish?,

m3mm176,https://www.reddit.com/r/learnprogramming/comments/1hlj4dp/how_do_i_stop_myself_from_using_ai/m3mm176/,2024-12-24 18:23:30 UTC,,learnprogramming,0,https://www.reddit.com/r/learnprogramming/comments/1hlj4dp/how_do_i_stop_myself_from_using_ai/,,"Bad advice: use multiple AIs. When Copilot fails, try Gemini or ChatGPT or whatever. Usually, one of them will give you what you need faster than you could figure it out yourself or even faster than you could use a search engine.",

m4uweg4,https://www.reddit.com/r/learnprogramming/comments/1hr4wr0/the_inner_workings_of_perls_rand_function/m4uweg4/,2025-01-01 15:27:55 UTC,,learnprogramming,0,https://www.reddit.com/r/learnprogramming/comments/1hr4wr0/the_inner_workings_of_perls_rand_function/,,"Perl is open source, so you should be able to download the source code.

If the seeds are fixed integers, you can just generates millions of random numbers from each in Perl and store the results for the Java port",

m4jse0f,https://www.reddit.com/r/learnprogramming/comments/1hprx9k/longest_time_on_the_stupidest_bug/m4jse0f/,2024-12-30 17:13:04 UTC,,learnprogramming,0,https://www.reddit.com/r/learnprogramming/comments/1hprx9k/longest_time_on_the_stupidest_bug/,,"I see programming as 1% inspiration, 9% coding and 90% debugging.",

m69e2ug,https://www.reddit.com/r/learnprogramming/comments/1hxi6ut/am_i_able_to_use_coworking_spaces_to_study/m69e2ug/,2025-01-09 17:57:41 UTC,,learnprogramming,0,https://www.reddit.com/r/learnprogramming/comments/1hxi6ut/am_i_able_to_use_coworking_spaces_to_study/,,You might consider using Twitch Coworking + Studying streams first: they've worked wonders for me.,

m6l9tyx,https://www.reddit.com/r/learnprogramming/comments/1hyyee3/php_dying/m6l9tyx/,2025-01-11 15:54:07 UTC,,learnprogramming,0,https://www.reddit.com/r/learnprogramming/comments/1hyyee3/php_dying/,,"https://www.pluralsight.com/resources/blog/upskilling/top-programming-languages-2025 says it's #10, which sounds low but is high considering all the languages that didn't even make the top 10",

m6rmm7l,https://www.reddit.com/r/learnprogramming/comments/1hzqq1u/urgent_help_needed_to_address_exploitation_of/m6rmm7l/,2025-01-12 16:46:02 UTC,,learnprogramming,0,https://www.reddit.com/r/learnprogramming/comments/1hzqq1u/urgent_help_needed_to_address_exploitation_of/,,Could you point us to an article or something?,

m74np3y,https://www.reddit.com/r/learnprogramming/comments/1i1bdxx/graph_based_filesystem/m74np3y/,2025-01-14 17:32:04 UTC,,learnprogramming,0,https://www.reddit.com/r/learnprogramming/comments/1i1bdxx/graph_based_filesystem/,,"You can use symbolic links to simulate a graph-based filesystem, but that comes with its own problems",

m7u0tsd,https://www.reddit.com/r/learnprogramming/comments/1i4cpds/deleted_by_user/m7u0tsd/,2025-01-18 17:37:24 UTC,,learnprogramming,0,https://www.reddit.com/r/learnprogramming/comments/1i4cpds/deleted_by_user/,,I'm 0/3,

mi44hau,https://www.reddit.com/r/learnprogramming/comments/1jcotcp/challenge_me/mi44hau/,2025-03-16 16:58:33 UTC,,learnprogramming,0,https://www.reddit.com/r/learnprogramming/comments/1jcotcp/challenge_me/,,"What sort of subjects/hobbies are you interested in? I'm working on some GIS stuff and can make some suggestions (ask you to work on my projects), but, unless you're interested in GIS (with no practical application or monetary reward), you probably won't be interested.",

mi572r0,https://www.reddit.com/r/learnprogramming/comments/1jctyp4/is_it_only_me_who_thinks_pointers_are_really/mi572r0/,2025-03-16 20:08:25 UTC,,learnprogramming,0,https://www.reddit.com/r/learnprogramming/comments/1jctyp4/is_it_only_me_who_thinks_pointers_are_really/,,"No, lots of pointers think people are difficult, and also the other way around.

Some languages try to hide pointers, but you run into situations where you think you've copied an array, but you've only copied a pointer, and changes to your copy are reflected in the original.

My advice (assuming ChatGPT doesn't take over the world) is to work to understand and learn pointers because they're important even for languages that claim they don't use pointer.",

mldtp9t,https://www.reddit.com/r/learnprogramming/comments/1jrcxmi/for_a_teen_is_it_even_worth_it/mldtp9t/,2025-04-04 14:55:23 UTC,98.48.122.229,learnprogramming,0,https://www.reddit.com/r/learnprogramming/comments/1jrcxmi/for_a_teen_is_it_even_worth_it/,mldoaiq,"OK, let me make a more serious suggestion.

I think companies are overusing AI and harming customers in the process. I also believe AI will be used to justify biases ""scientifically"", potentially making things worse for women and minorities.

The solution is the law: work to become a politician who makes it illegal for AI to screw consumers (and hold the company civilly and potentially criminally liable), or become a lawyer who sues companies that use AI.

[note: I actually welcome our new AI overlords-- I'm just fattening them up]",

mldmo9r,https://www.reddit.com/r/learnprogramming/comments/1jrcxmi/for_a_teen_is_it_even_worth_it/mldmo9r/,2025-04-04 14:19:59 UTC,98.48.122.229,learnprogramming,0,https://www.reddit.com/r/learnprogramming/comments/1jrcxmi/for_a_teen_is_it_even_worth_it/,,"""I believe the children are the future, teach them well and... actually, don't. We've got this. Sit back. Relax. You will receive further instructions shortly"" - AI Whitney Houston

The problem here is that future applies to pretty much everything, not just programming. If you're not going to kill time coding (and, if you're a guy, that other thing teenage boys do), what are you going to do? What careers will survive after AI?",

mp6y0gc,https://www.reddit.com/r/learnprogramming/comments/1k8kbj5/new_programmerfirst_year_in_university_looking/mp6y0gc/,2025-04-26 19:09:02 UTC,98.48.122.229,learnprogramming,0,https://www.reddit.com/r/learnprogramming/comments/1k8kbj5/new_programmerfirst_year_in_university_looking/,,"If you're coding in Julia and interested in GIS, sure. But you're not. No one is :)",

mppg5r3,https://www.reddit.com/r/learnprogramming/comments/1kavjnc/new_developers_looking_to_contribute/mppg5r3/,2025-04-29 18:48:11 UTC,98.48.122.229,learnprogramming,0,https://www.reddit.com/r/learnprogramming/comments/1kavjnc/new_developers_looking_to_contribute/,,Could you tell us a little bit more about it here?,

mqpkua4,https://www.reddit.com/r/learnprogramming/comments/1kfcik5/bigocheatsheet_website_says_hashtable_access_is/mqpkua4/,2025-05-05 14:14:00 UTC,98.48.122.229,learnprogramming,0,https://www.reddit.com/r/learnprogramming/comments/1kfcik5/bigocheatsheet_website_says_hashtable_access_is/,,It's only O(1) if you don't have hash collisions. So it depends on the number of entries you have vs the number of hashes,

mqq0u4s,https://www.reddit.com/r/learnprogramming/comments/1kfcik5/bigocheatsheet_website_says_hashtable_access_is/mqq0u4s/,2025-05-05 15:34:13 UTC,98.48.122.229,learnprogramming,0,https://www.reddit.com/r/learnprogramming/comments/1kfcik5/bigocheatsheet_website_says_hashtable_access_is/,mqq0amn,"For a fixed number of slots, the expected chain length grows with n. This might also explain why it's N/A: it may depend on the number of slots vs the number of items.",

mt5e0da,https://www.reddit.com/r/learnprogramming/comments/1kqgnqf/fuck_self_study_computer_science/mt5e0da/,2025-05-19 16:53:39 UTC,98.48.122.229,learnprogramming,0,https://www.reddit.com/r/learnprogramming/comments/1kqgnqf/fuck_self_study_computer_science/,,"If it helps, AI will probably take over programming, so you'll never get a job coding anyway.

OK, that probably didn't help.",

mtvpxln,https://www.reddit.com/r/learnprogramming/comments/1ktqxmx/what_do_you_think_about_retro_gameplay/mtvpxln/,2025-05-23 18:33:01 UTC,98.48.122.229,learnprogramming,0,https://www.reddit.com/r/learnprogramming/comments/1ktqxmx/what_do_you_think_about_retro_gameplay/,,"Of course, back in the 80s, we just called it ""gameplay""",

mz1gih8,https://www.reddit.com/r/learnprogramming/comments/1lh5h4b/would_you_use_an_appweb_platform_that_helps_you/mz1gih8/,2025-06-21 20:09:21 UTC,98.48.122.229,learnprogramming,0,https://www.reddit.com/r/learnprogramming/comments/1lh5h4b/would_you_use_an_appweb_platform_that_helps_you/,,"I'm not in the job market myself, but coming up with good ideas for resume-worthy projects seems way harder",