
l6ywk3u,https://www.reddit.com/r/TooAfraidToAsk/comments/1d793aq/what_motivation_would_trump_even_have_to_stop/l6ywk3u/,2024-06-03 21:01:21 UTC,,TooAfraidToAsk,0,https://www.reddit.com/r/TooAfraidToAsk/comments/1d793aq/what_motivation_would_trump_even_have_to_stop/,l6yw1kw,"I thought he used his own money, but the campaign money was used as a cover? Also, I regard campaign money as personal gifts (it's not tax deductible), so not really an issue there, though I admit it's a bit dicey",

l6y8b2z,https://www.reddit.com/r/TooAfraidToAsk/comments/1d793aq/what_motivation_would_trump_even_have_to_stop/l6y8b2z/,2024-06-03 18:47:11 UTC,,TooAfraidToAsk,0,https://www.reddit.com/r/TooAfraidToAsk/comments/1d793aq/what_motivation_would_trump_even_have_to_stop/,l6y7um0,"Morality always takes priority over legality, at least in my mind. Blind obedience to the law is morally wrong (in my mind). I'm dating Jennifer Aniston (in my mind). So it's not 100%",

l72s1d0,https://www.reddit.com/r/TooAfraidToAsk/comments/1d793aq/what_motivation_would_trump_even_have_to_stop/l72s1d0/,2024-06-04 15:30:56 UTC,,TooAfraidToAsk,0,https://www.reddit.com/r/TooAfraidToAsk/comments/1d793aq/what_motivation_would_trump_even_have_to_stop/,l72r8d4,"Well, I don't believe in campaign spending limits (I view them as free speech violations), and I don't see how a politician is legally required to provide negative information about himself (though I agree it wouldn't have seriously harmed his chances).

I also don't see what regulations he was trying to evade that I feel a government could legally impose upon a business. Of course, I'm strong libertarian/capitalist and am opposed to government intervention in general",

l73jh83,https://www.reddit.com/r/TooAfraidToAsk/comments/1d793aq/what_motivation_would_trump_even_have_to_stop/l73jh83/,2024-06-04 18:04:07 UTC,,TooAfraidToAsk,0,https://www.reddit.com/r/TooAfraidToAsk/comments/1d793aq/what_motivation_would_trump_even_have_to_stop/,l73hzfb,"Only those laws that violate other people's rights. I'm happy to continue answering questions, but you might want to google/wikipedia libertarianism to get a general overview",

l78auwn,https://www.reddit.com/r/TooAfraidToAsk/comments/1d8s4x8/trigger_content_warning_with_step_content_being/l78auwn/,2024-06-05 15:24:37 UTC,,TooAfraidToAsk,0,https://www.reddit.com/r/TooAfraidToAsk/comments/1d8s4x8/trigger_content_warning_with_step_content_being/,l78a0p3,"I'm sure there are some irresponsible parents out there, but I'd need evidence for ""large consumer market"". Also, I don't necessarily believe in the concept of underage porn viewing since people mature at different rates and some parents are OK with their kids viewing porn

I agree that teens confusing fantasy with reality is an issue, but not just in terms of sex, but more dangerously in terms of violence. It's definitely an issue, but since blocking free speech is inherently wrong, finding a correlation between step-porn and actual step-abuse wouldn't be very useful.

We need a better solution, such as increased parental responsibility.",

l7yzorp,https://www.reddit.com/r/TooAfraidToAsk/comments/1dcnh9o/deleted_by_user/l7yzorp/,2024-06-10 15:05:00 UTC,,TooAfraidToAsk,0,https://www.reddit.com/r/TooAfraidToAsk/comments/1dcnh9o/deleted_by_user/,,"It's hard to get good data on stuff like this, so here's some bad data: https://psychcentral.com/blog/how-common-is-cheating-infidelity-really#statistics

According to this link, about 46% of people cheat. However, I'd take that with a grain of salt.",

l7id228,https://www.reddit.com/r/TooAfraidToAsk/comments/1d9qucy/deleted_by_user/l7id228/,2024-06-07 10:52:15 UTC,,TooAfraidToAsk,0,https://www.reddit.com/r/TooAfraidToAsk/comments/1d9qucy/deleted_by_user/,,"The majority of people have rape fantasies, but some of those are being raped, not raping others. Some people enjoy ""consensual non-consent"", which includes rape play. There are also plenty of people who enjoy (consensual) BDSM, which may include someone screaming ""no"" (since that's rarely the safeword) or even laying there looking uncomfortable.

I suspect you might be virtue signalling when you say you're a ""normal person"" who ""doesn't understand rapists"". I think a normal person would fully understand WHY people rape, but still treat it as a terrible crime.",

l8qihia,https://www.reddit.com/r/TooAfraidToAsk/comments/1dg0nli/what_are_some_secrets_you_know_about_working_of/l8qihia/,2024-06-15 15:45:47 UTC,,TooAfraidToAsk,0,https://www.reddit.com/r/TooAfraidToAsk/comments/1dg0nli/what_are_some_secrets_you_know_about_working_of/,l8ovons,"> they also make money on the stuff they throw away too

It's called depreciation, the decrease in value of items the company owns (both goods for sales and supplies/equipment). They can write off depreciation against profits, and thus pay less in taxes.

Why not just sell the goods at market value? Because the IRS allows depreciation to be calculated in a way that taxes on the loss value are reduced by more than the fair market price. In other words, if a company could sell items at $100, it might be able to depreciate them for $700 and save $200 in taxes, coming out ahead.",

l91ejca,https://www.reddit.com/r/TooAfraidToAsk/comments/1di523f/are_private_jets_pressurized/l91ejca/,2024-06-17 18:37:46 UTC,,TooAfraidToAsk,0,https://www.reddit.com/r/TooAfraidToAsk/comments/1di523f/are_private_jets_pressurized/,,"We need a certain amount of air pressure to survive, so yes. I happen to live in a mile high city where the air pressure is quite a bit less than at sea level, but still more than enough to survive. Once you get to about 3 miles up, the pressure becomes dangerously low",

l9lp8p0,https://www.reddit.com/r/TooAfraidToAsk/comments/1dl1qtz/black_people_often_get_miffed_when_called/l9lp8p0/,2024-06-21 11:49:34 UTC,,TooAfraidToAsk,0,https://www.reddit.com/r/TooAfraidToAsk/comments/1dl1qtz/black_people_often_get_miffed_when_called/,,"> Black people often get miffed

I assume that's a personal observation that doesn't apply in general. When I tell someone they're a good speaker, it's with the automatic implication they they're better than me at public speaking and they don't seem to take it as insult",

l9lo6e7,https://www.reddit.com/r/TooAfraidToAsk/comments/1dl1uog/deleted_by_user/l9lo6e7/,2024-06-21 11:40:23 UTC,,TooAfraidToAsk,0,https://www.reddit.com/r/TooAfraidToAsk/comments/1dl1uog/deleted_by_user/,,"You're not as liberal as you think :) Regard sex as a recreational activity just like playing tennis with someone, watching a movie with them, or going out to lunch or dinner with them. The fact that you think ""[t]he idea of getting naked and having sex with someone you barely know seems a pretty wild endeavour"" pretty much contradicts your ""absolutely no prejudices about causal sex"" comment.",

la1lgnt,https://www.reddit.com/r/TooAfraidToAsk/comments/1dncvoh/deleted_by_user/la1lgnt/,2024-06-24 13:07:42 UTC,,TooAfraidToAsk,0,https://www.reddit.com/r/TooAfraidToAsk/comments/1dncvoh/deleted_by_user/,,"This is really more a request for relationship advice, but I guess I'd first talk to her about indecent exposure laws, and then explain you want her to save the view for you.

On the other hand, for all us lonely guys out here, your wife is a hero :)",

la7d8yw,https://www.reddit.com/r/TooAfraidToAsk/comments/1do6737/deleted_by_user/la7d8yw/,2024-06-25 13:39:43 UTC,,TooAfraidToAsk,0,https://www.reddit.com/r/TooAfraidToAsk/comments/1do6737/deleted_by_user/,,"Since you can't really see or even hear emotion on Reddit, and can't verify what actually happened, I wouldn't worry about.

Now, if you are emotionless watching YouTube or something, it may be different",

laofjsw,https://www.reddit.com/r/TooAfraidToAsk/comments/1dqjppq/deleted_by_user/laofjsw/,2024-06-28 13:39:23 UTC,,TooAfraidToAsk,0,https://www.reddit.com/r/TooAfraidToAsk/comments/1dqjppq/deleted_by_user/,,CyberTipline (1.800.843.5678) per https://www.stopitnow.org/ohc-content/reporting-child-sexual-abuse,

laofq0s,https://www.reddit.com/r/TooAfraidToAsk/comments/1dqjnvs/why_is_reddit_so_disgusting/laofq0s/,2024-06-28 13:40:30 UTC,,TooAfraidToAsk,0,https://www.reddit.com/r/TooAfraidToAsk/comments/1dqjnvs/why_is_reddit_so_disgusting/,,"Reddit is tolerant. And tolerance means sometimes seeing and hearing things we don't want to, so we can do things others might find disgusting. Freedom!",

latttjr,https://www.reddit.com/r/TooAfraidToAsk/comments/1draobc/deleted_by_user/latttjr/,2024-06-29 13:15:18 UTC,,TooAfraidToAsk,0,https://www.reddit.com/r/TooAfraidToAsk/comments/1draobc/deleted_by_user/,,"It would require amending the US Constitution, and I doubt they have enough states for that (38 required)",

lb403dj,https://www.reddit.com/r/TooAfraidToAsk/comments/1dsqa06/does_feeling_uncomfortable_receiving_kisses_x_at/lb403dj/,2024-07-01 11:16:44 UTC,,TooAfraidToAsk,0,https://www.reddit.com/r/TooAfraidToAsk/comments/1dsqa06/does_feeling_uncomfortable_receiving_kisses_x_at/,,"You're aware that, in some European countries, men kissing each other on the cheeks is a form of greeting, right? I don't know if you're homophobic, but asking people to stop will probably give you more flack than you want. I'd suggest just ignoring them",

ldpwzot,https://www.reddit.com/r/TooAfraidToAsk/comments/1e619j3/deleted_by_user/ldpwzot/,2024-07-18 03:35:56 UTC,,TooAfraidToAsk,0,https://www.reddit.com/r/TooAfraidToAsk/comments/1e619j3/deleted_by_user/,,"> I do believe most Muslims harbour extremist and fundamentalist views.

Do you have a source for this? I'm not saying it's not true, but the Pew research report I vaguely remember reading suggests otherwise, especially for Muslims who live outside countries that observe sharia law.

Even if you could show the majority harbor extremist views, it would be wrong to judge an individual person solely by their religion. You have to consider all factors about that and not assume they are identical or even similar to other people who share (or claim to share) their religion.

> He was a respectable man, so I don't disagree with him.

This is really problematic because, while we love and respect our grandparents and ancestors, they often have views that were acceptable at the time (Blacks should drink from different water fountains and attend different schools), but no longer are. You can respect people and still realize they're not perfect and that it's difficult for someone to hold progressive views in a non-progressive time.",

ld5dxkz,https://www.reddit.com/r/TooAfraidToAsk/comments/1e34iq9/is_there_something_wrong_with_me_emotionally/ld5dxkz/,2024-07-14 15:18:18 UTC,,TooAfraidToAsk,0,https://www.reddit.com/r/TooAfraidToAsk/comments/1e34iq9/is_there_something_wrong_with_me_emotionally/,ld5dsox,"> mum had died

I mean, are you sure? Maybe she was just...",

ldh6jwr,https://www.reddit.com/r/TooAfraidToAsk/comments/1e4tlf2/has_anyone_ever_had_green_poop/ldh6jwr/,2024-07-16 17:07:54 UTC,,TooAfraidToAsk,0,https://www.reddit.com/r/TooAfraidToAsk/comments/1e4tlf2/has_anyone_ever_had_green_poop/,,sugar free chocolate wafers do this to me,

ldhc19f,https://www.reddit.com/r/TooAfraidToAsk/comments/1e4tmcz/what_else_can_you_to_say_to_someone_whos/ldhc19f/,2024-07-16 17:37:14 UTC,,TooAfraidToAsk,0,https://www.reddit.com/r/TooAfraidToAsk/comments/1e4tmcz/what_else_can_you_to_say_to_someone_whos/,ldhbv5q,"I mean, I often end conversations with ""let me know if I can help"" as I walk away, and it's like, wtf, if they say ""well, actually..."".",

ldhb692,https://www.reddit.com/r/TooAfraidToAsk/comments/1e4tmcz/what_else_can_you_to_say_to_someone_whos/ldhb692/,2024-07-16 17:32:38 UTC,,TooAfraidToAsk,0,https://www.reddit.com/r/TooAfraidToAsk/comments/1e4tmcz/what_else_can_you_to_say_to_someone_whos/,ldhawoo,"Yes, or willing to say ""Oh, I just forgot-- I'm taking a 12 month non-cancellable trip to the British Virgin Islands for business and/or medical purposes, sorry""",

ld5d29r,https://www.reddit.com/r/TooAfraidToAsk/comments/1e34iq9/is_there_something_wrong_with_me_emotionally/ld5d29r/,2024-07-14 15:13:13 UTC,,TooAfraidToAsk,0,https://www.reddit.com/r/TooAfraidToAsk/comments/1e34iq9/is_there_something_wrong_with_me_emotionally/,,"There's a terrible joke I could make here, but I don't want to break rule 1",

ldhcys7,https://www.reddit.com/r/TooAfraidToAsk/comments/1e4tmcz/what_else_can_you_to_say_to_someone_whos/ldhcys7/,2024-07-16 17:42:14 UTC,,TooAfraidToAsk,0,https://www.reddit.com/r/TooAfraidToAsk/comments/1e4tmcz/what_else_can_you_to_say_to_someone_whos/,ldhcl0h,"Well, it's different with a girlfriend or a very close friend. I mean the people you meet at work or school that you only sort of know and probably just ""unloading"" on you.",

ldh6d9p,https://www.reddit.com/r/TooAfraidToAsk/comments/1e4tmcz/what_else_can_you_to_say_to_someone_whos/ldh6d9p/,2024-07-16 17:06:55 UTC,,TooAfraidToAsk,0,https://www.reddit.com/r/TooAfraidToAsk/comments/1e4tmcz/what_else_can_you_to_say_to_someone_whos/,,"You could add ""is there anything I can do to help"", but there's the very real danger they will say yes.",

ldh5zh7,https://www.reddit.com/r/TooAfraidToAsk/comments/1e4tmyo/deleted_by_user/ldh5zh7/,2024-07-16 17:04:48 UTC,,TooAfraidToAsk,0,https://www.reddit.com/r/TooAfraidToAsk/comments/1e4tmyo/deleted_by_user/,,"I mean, we WATCH sports more than we DO sports. That's a clue right there.",

ldlkxn4,https://www.reddit.com/r/TooAfraidToAsk/comments/1e5gipz/deleted_by_user/ldlkxn4/,2024-07-17 12:17:10 UTC,,TooAfraidToAsk,0,https://www.reddit.com/r/TooAfraidToAsk/comments/1e5gipz/deleted_by_user/,,"Honest advice: find out what kind of things your bf is into, particularly if it's roleplay or a certain type of fictional person (eg, anime, Disney princess, schoolgirl, stepsister, prostitute, et), and tailor your dirty talk to that.

I could probably give you some generic advice, but it'll work way better if you hit his ""hot button"".",

ldrf5f0,https://www.reddit.com/r/TooAfraidToAsk/comments/1e6a162/with_regards_to_talking_about_the_current/ldrf5f0/,2024-07-18 12:23:29 UTC,,TooAfraidToAsk,0,https://www.reddit.com/r/TooAfraidToAsk/comments/1e6a162/with_regards_to_talking_about_the_current/,,We blame politicians too. Congress has a very low approval rating,

lfiu7vs,https://www.reddit.com/r/TooAfraidToAsk/comments/1ef4t78/deleted_by_user/lfiu7vs/,2024-07-29 18:04:43 UTC,,TooAfraidToAsk,0,https://www.reddit.com/r/TooAfraidToAsk/comments/1ef4t78/deleted_by_user/,,"> which explains how the culture of non western countries are too a major factor responsible form their own backwardness ,underdevelopment or problems

Well, first tell us which subreddits you mean, but this just seems rude no matter where you post it. Unless you're posting on extremely anti-USA subs, no wonder it's removed.

Also, this seems more like a rant than an actual question",

lg0bi4l,https://www.reddit.com/r/TooAfraidToAsk/comments/1ehm6gq/deleted_by_user/lg0bi4l/,2024-08-01 17:41:18 UTC,,TooAfraidToAsk,0,https://www.reddit.com/r/TooAfraidToAsk/comments/1ehm6gq/deleted_by_user/,,"> I donâ€™t watch porn

That's why. Frequent vigorous masturbation with high-quality porn will solve this problem.",

lg0tqiw,https://www.reddit.com/r/TooAfraidToAsk/comments/1ehm6gq/deleted_by_user/lg0tqiw/,2024-08-01 19:16:11 UTC,,TooAfraidToAsk,0,https://www.reddit.com/r/TooAfraidToAsk/comments/1ehm6gq/deleted_by_user/,lg0gn30,"The psychological effects it has are that it cures the problems you're having. Porn makes you a smarter, better person",

lfj56se,https://www.reddit.com/r/TooAfraidToAsk/comments/1ef7f0u/do_pilots_and_flight_attendants_actually_fuck/lfj56se/,2024-07-29 19:02:17 UTC,,TooAfraidToAsk,0,https://www.reddit.com/r/TooAfraidToAsk/comments/1ef7f0u/do_pilots_and_flight_attendants_actually_fuck/,,probably not in the cockpit (despite its name),

lg08ru8,https://www.reddit.com/r/TooAfraidToAsk/comments/1ehmdo5/deleted_by_user/lg08ru8/,2024-08-01 17:27:08 UTC,,TooAfraidToAsk,0,https://www.reddit.com/r/TooAfraidToAsk/comments/1ehmdo5/deleted_by_user/,,"Are you sure it's them? Don't trust ""screenshots"" of their Paypal accounts, a common fraud tactic",

lfzyu4d,https://www.reddit.com/r/TooAfraidToAsk/comments/1ehl04v/why_do_a_lot_of_people_hate_japan_over_the/lfzyu4d/,2024-08-01 16:35:32 UTC,,TooAfraidToAsk,0,https://www.reddit.com/r/TooAfraidToAsk/comments/1ehl04v/why_do_a_lot_of_people_hate_japan_over_the/,,I'm pretty sure someone asked the exact opposite question just a couple of days ago.,

lgg4kqy,https://www.reddit.com/r/TooAfraidToAsk/comments/1ejuxpy/deleted_by_user/lgg4kqy/,2024-08-04 13:15:04 UTC,,TooAfraidToAsk,0,https://www.reddit.com/r/TooAfraidToAsk/comments/1ejuxpy/deleted_by_user/,,"Where are you? Legal age in the USA is 21 in 49 states, so I'm guessing some foreign country?",

lgg4p48,https://www.reddit.com/r/TooAfraidToAsk/comments/1ejuuwq/deleted_by_user/lgg4p48/,2024-08-04 13:15:57 UTC,,TooAfraidToAsk,0,https://www.reddit.com/r/TooAfraidToAsk/comments/1ejuuwq/deleted_by_user/,,"Why do people create blogs? Post on reddit? Write comments?

We just love shooting the bull",

lggahqi,https://www.reddit.com/r/TooAfraidToAsk/comments/1ejuxpy/deleted_by_user/lggahqi/,2024-08-04 13:55:32 UTC,,TooAfraidToAsk,0,https://www.reddit.com/r/TooAfraidToAsk/comments/1ejuxpy/deleted_by_user/,lggaco1,"Yeah. I think England is 18 or something, so not that. But, basically, if OP isn't American, I've stopped caring :)",

lgbqugn,https://www.reddit.com/r/TooAfraidToAsk/comments/1ej8k9x/im_just_started_driving_here_in_the_us_and_im_so/lgbqugn/,2024-08-03 17:15:10 UTC,,TooAfraidToAsk,0,https://www.reddit.com/r/TooAfraidToAsk/comments/1ej8k9x/im_just_started_driving_here_in_the_us_and_im_so/,,"I mean, I think speed limits are just plain stupid, and I rarely get tickets for violating them, so I strive to drive at the fastest safe speed, as all good people should. Fuck the government",

lgx8suv,https://www.reddit.com/r/TooAfraidToAsk/comments/1em95p2/deleted_by_user/lgx8suv/,2024-08-07 11:35:52 UTC,,TooAfraidToAsk,0,https://www.reddit.com/r/TooAfraidToAsk/comments/1em95p2/deleted_by_user/,,"This could be a sign of Type 2 Diabetes. Try eating less sugar/carbs and see if that helps. I'm not a doctor, and, of course, it's a sign of many other things too, so do try to see a doctor regardless",

lgrv8vk,https://www.reddit.com/r/TooAfraidToAsk/comments/1elig7o/why_are_americans_so_open_about_drugs/lgrv8vk/,2024-08-06 14:08:21 UTC,,TooAfraidToAsk,0,https://www.reddit.com/r/TooAfraidToAsk/comments/1elig7o/why_are_americans_so_open_about_drugs/,,"Which culture are you from?

Americans have had high disregard for government since the 60s, and don't agree with each other either. As late as the 50s, there were government films misrepresenting marijuana as being extremely dangerous, but, during the 60s and 70s (the hippie era), we realized the government lies to us a lot and no longer trust it.",

lgxcenx,https://www.reddit.com/r/TooAfraidToAsk/comments/1em95p2/deleted_by_user/lgxcenx/,2024-08-07 12:03:47 UTC,,TooAfraidToAsk,0,https://www.reddit.com/r/TooAfraidToAsk/comments/1em95p2/deleted_by_user/,lgx9k2t,"Sure thing. You can get diabetes meters to test your own blood sugar without a doctor, but it's probably not worth it unless cutting carbs/sugars helps",

lggxllb,https://www.reddit.com/r/TooAfraidToAsk/comments/1ejxo6j/bangladesh_is_burning_whats_next/lggxllb/,2024-08-04 16:12:28 UTC,,TooAfraidToAsk,0,https://www.reddit.com/r/TooAfraidToAsk/comments/1ejxo6j/bangladesh_is_burning_whats_next/,lggub3p,"Still not a question and my prime directive forbids me from interfering with purely internal matters.

Seriously, I do think it's a tragedy, but it's not a question, and there are a lot of tragedies in the world. Yours does not deserve extra special attention.",

lgxfqfo,https://www.reddit.com/r/TooAfraidToAsk/comments/1em9e7o/deleted_by_user/lgxfqfo/,2024-08-07 12:27:44 UTC,,TooAfraidToAsk,0,https://www.reddit.com/r/TooAfraidToAsk/comments/1em9e7o/deleted_by_user/,,The title of this post is confusing-- I thought you meant you walked on air and was going to suggest lowering the dosage or trying a different blend,

lgrwq22,https://www.reddit.com/r/TooAfraidToAsk/comments/1elig7o/why_are_americans_so_open_about_drugs/lgrwq22/,2024-08-06 14:16:38 UTC,,TooAfraidToAsk,0,https://www.reddit.com/r/TooAfraidToAsk/comments/1elig7o/why_are_americans_so_open_about_drugs/,lgrwhyt,Interesting. Not what I expected. I was thinking more a Muslim country or something. I didn't realize Greece was that negative about drugs,

lggsh63,https://www.reddit.com/r/TooAfraidToAsk/comments/1ejxo6j/bangladesh_is_burning_whats_next/lggsh63/,2024-08-04 15:43:15 UTC,,TooAfraidToAsk,0,https://www.reddit.com/r/TooAfraidToAsk/comments/1ejxo6j/bangladesh_is_burning_whats_next/,,"Source: https://apnews.com/article/bangladesh-hasina-student-protest-quota-violence-1496d6471792cbc11f39c3bacee813f7

Not to be an ahole, but doesn't Bangladesh have like 173 million people?

Also, this isn't really a question",

lhdlmcp,https://www.reddit.com/r/TooAfraidToAsk/comments/1eohdz2/i_was_wondering_what_where_the_benefits_of/lhdlmcp/,2024-08-10 02:18:41 UTC,,TooAfraidToAsk,0,https://www.reddit.com/r/TooAfraidToAsk/comments/1eohdz2/i_was_wondering_what_where_the_benefits_of/,,"Nope, quitting porn just makes life worse.",

lhdm9b4,https://www.reddit.com/r/TooAfraidToAsk/comments/1eohdz2/i_was_wondering_what_where_the_benefits_of/lhdm9b4/,2024-08-10 02:23:09 UTC,,TooAfraidToAsk,0,https://www.reddit.com/r/TooAfraidToAsk/comments/1eohdz2/i_was_wondering_what_where_the_benefits_of/,lhdm2wi,"Remember, when you're wanking off to porn, you're not out there mugging little old ladies.

Of course, when you're out there mugging little old ladies, you're not wanking off to porn, so it goes both ways.",

lhs9gy1,https://www.reddit.com/r/TooAfraidToAsk/comments/1eql18m/do_you_think_americans_would_be_more_likely_to/lhs9gy1/,2024-08-12 18:27:19 UTC,,TooAfraidToAsk,0,https://www.reddit.com/r/TooAfraidToAsk/comments/1eql18m/do_you_think_americans_would_be_more_likely_to/,,"I mean this is what Bernie Sanders has been openly pushing, and some people are listening, but nowhere near a majority.

I think I understand both concepts and dislike them, but what do you think the definitions are?",

lhx82t2,https://www.reddit.com/r/TooAfraidToAsk/comments/1eraarz/why_is_it_that_women_feel_free_and_entitled_to/lhx82t2/,2024-08-13 15:21:45 UTC,,TooAfraidToAsk,0,https://www.reddit.com/r/TooAfraidToAsk/comments/1eraarz/why_is_it_that_women_feel_free_and_entitled_to/,,"While I agree with you that all abuse is bad (by definition), it's presumably worse for women, so some people feel that focusing on women will end up helping more. It's a variation of ""think globally, act locally"", even though I don't necessarily agree with it",

liehda8,https://www.reddit.com/r/TooAfraidToAsk/comments/1etogjd/deleted_by_user/liehda8/,2024-08-16 13:20:23 UTC,,TooAfraidToAsk,0,https://www.reddit.com/r/TooAfraidToAsk/comments/1etogjd/deleted_by_user/,,Fake news: https://www.reuters.com/fact-check/project-2025-did-not-propose-period-passport-women-2024-07-16/,

liey0f9,https://www.reddit.com/r/TooAfraidToAsk/comments/1etql2a/is_the_us_ever_gonna_get_past_this_cold_civil_war/liey0f9/,2024-08-16 14:54:31 UTC,,TooAfraidToAsk,0,https://www.reddit.com/r/TooAfraidToAsk/comments/1etql2a/is_the_us_ever_gonna_get_past_this_cold_civil_war/,,"This is going to sound leftist, but, yes, we will get over this cold civil war once we get rid of intolerant people or at least them not influence politics. As long as one person wants to control another, we will have conflict.",

liem9jl,https://www.reddit.com/r/TooAfraidToAsk/comments/1etogjd/deleted_by_user/liem9jl/,2024-08-16 13:49:30 UTC,,TooAfraidToAsk,0,https://www.reddit.com/r/TooAfraidToAsk/comments/1etogjd/deleted_by_user/,liem6dx,"You are correct, which is why I sneakily edited my comment :)",

liez95z,https://www.reddit.com/r/TooAfraidToAsk/comments/1etql2a/is_the_us_ever_gonna_get_past_this_cold_civil_war/liez95z/,2024-08-16 15:01:03 UTC,,TooAfraidToAsk,0,https://www.reddit.com/r/TooAfraidToAsk/comments/1etql2a/is_the_us_ever_gonna_get_past_this_cold_civil_war/,lieyx4h,"Well, I see myself as libertarian, and supporting universal freedom and tolerance, but you're probably right.",

liw688w,https://www.reddit.com/r/TooAfraidToAsk/comments/1ew3ohp/are_the_average_young_people_in_the_us_and_north/liw688w/,2024-08-19 16:11:57 UTC,,TooAfraidToAsk,0,https://www.reddit.com/r/TooAfraidToAsk/comments/1ew3ohp/are_the_average_young_people_in_the_us_and_north/,livuw4r,"Fat is still a negative term, and people should use a non-offensive way to describe heavier people with higher BMIs",

